[{
    "body": "Leipzig",
    "content": "1/1 \n \n \n \n \n  \nEinwohneranfrage-Nr. VII-EF-08640 \n \nStatus: \u00f6ffentlich \n \nEingereicht von: \nHeidi Koll \n \n \n \nBetreff: \nDrohnen statt Hubschrauber? \n \n \nBeratungsfolge (\u00c4nderungen vorbehalten): \nGremium \nVoraussichtlicher \nSitzungstermin \nZust\u00e4ndigkeit \n   \nRatsversammlung 14.06.2023 schriftliche \nBeantwortung \n \nSachverhalt \n \nIch wohne in der S\u00fcdvorstadt. \n \nRegelm\u00e4\u00dfig - und besonders an Wochenenden - kreist bei Demonstrationen, Veranstaltun-\ngen und zu jedem RB-Fu\u00dfballspiel stundenlang ein Hubschrauber \u00fcber diesen und angren-\nzende Stadtteile. \nIch wei\u00df nicht, ob dies eine polizeiliche Ma\u00dfnahme ist oder der \u00dcberwachung der Verkehrs-\nlage dient. \n \nIch wei\u00df aber, dass es f\u00fcr viele Menschen in der Stadt eine erhebliche L\u00e4rmbel\u00e4stigung dar-\nstellt. Und dies besonders zu Zeiten, die eigentlich der Erholung dienen sollen. \n \nIch stelle mir vor, dass es heutzutage m\u00f6glich ist, den Hubschrauber durch professionelle \nDrohnen zu ersetzen, die die Eins\u00e4tze leiser, \u00f6konomischer und \u00f6kologischer durchf\u00fchren \nk\u00f6nnen. \n \nIch bitte Sie diese Option zu pr\u00fcfen und wenn m\u00f6glich umzusetzen. \n \n \nAnlage/n \nKeine \n \n1 von 1 in Zusammenstellung\n\tVorlage",
    "name": "Drohnen statt Hubschrauber?",
    "resolution": null,
    "originator": "Heidi Koll",
    "paper_type": "Einwohneranfrage",
    "published_at": "2023-05-09",
    "reference": "VII-EF-08640",
    "url": "https://ratsinformation.leipzig.de/allris_leipzig_public/vo020?VOLFDNR=2011216"
}, {
    "body": "Leipzig",
    "content": "<empty>",
    "name": "R\u00e4umlichkeiten Sitzungen Ortschaftsrat Hartmannsdorf-Knautnaundorf (OR 0060/ 23/24)",
    "resolution": null,
    "originator": "OR Hartmannsdorf-Knautnaundorf",
    "paper_type": "\u00c4nderung zum HH-Planentwurf",
    "published_at": "2023-05-09",
    "reference": "VII-HP-08642",
    "url": "https://ratsinformation.leipzig.de/allris_leipzig_public/vo020?VOLFDNR=2010914"
}, {
    "body": "Leipzig",
    "content": "<empty>",
    "name": "Fortf\u00fchrung des Vorhabens \"Einbau einer Turmuhr ohne Schlagwerk\" (OR 0025/ 23)",
    "resolution": null,
    "originator": "OR L\u00fctzschena-Stahmeln",
    "paper_type": "\u00c4nderung zum HH-Planentwurf",
    "published_at": "2023-05-09",
    "reference": "VII-HP-08643",
    "url": "https://ratsinformation.leipzig.de/allris_leipzig_public/vo020?VOLFDNR=2010915"
}, {
    "body": "Leipzig",
    "content": "<empty>",
    "name": "Personalstellenerweiterung f\u00fcr integrierte Jugendarbeit - Kulturwerkstatt KAOS (SBB 0006/ 23/24)",
    "resolution": null,
    "originator": "SBB Altwest",
    "paper_type": "\u00c4nderung zum HH-Planentwurf",
    "published_at": "2023-05-09",
    "reference": "VII-HP-08640",
    "url": "https://ratsinformation.leipzig.de/allris_leipzig_public/vo020?VOLFDNR=2010912"
}, {
    "body": "Leipzig",
    "content": "<empty>",
    "name": "Instandsetzung/Erneuerung Toiletten Liebertwolkwitz Markt 9 (OR 0017/ 23/24)",
    "resolution": null,
    "originator": "OR Liebertwolkwitz",
    "paper_type": "\u00c4nderung zum HH-Planentwurf",
    "published_at": "2023-05-09",
    "reference": "VII-HP-08646",
    "url": "https://ratsinformation.leipzig.de/allris_leipzig_public/vo020?VOLFDNR=2010918"
}, {
    "body": "Leipzig",
    "content": "<empty>",
    "name": "L\u00e4rmschutz f\u00fcr Clubs verbessern - Konflikten vorbeugen (A 0041/ 23/24)",
    "resolution": null,
    "originator": "Fraktion B\u00fcndnis 90/Die Gr\u00fcnen",
    "paper_type": "\u00c4nderung zum HH-Planentwurf",
    "published_at": "2023-05-09",
    "reference": "VII-HP-08641",
    "url": "https://ratsinformation.leipzig.de/allris_leipzig_public/vo020?VOLFDNR=2010913"
}, {
    "body": "Leipzig",
    "content": "<empty>",
    "name": "2 Papierk\u00f6rbe f\u00fcr Bushaltestellen in Gottscheina (OR 0007/ 23/24)",
    "resolution": null,
    "originator": "OR Seehausen",
    "paper_type": "\u00c4nderung zum HH-Planentwurf",
    "published_at": "2023-05-09",
    "reference": "VII-HP-08645",
    "url": "https://ratsinformation.leipzig.de/allris_leipzig_public/vo020?VOLFDNR=2010917"
}, {
    "body": "Leipzig",
    "content": "<empty>",
    "name": "Erarbeiten Entwurfsplanung eines Gemeinschaftszentrums in R\u00fcckmarsdorf (OR 0026/ 23/24)",
    "resolution": null,
    "originator": "OR R\u00fcckmarsdorf",
    "paper_type": "\u00c4nderung zum HH-Planentwurf",
    "published_at": "2023-05-09",
    "reference": "VII-HP-08644",
    "url": "https://ratsinformation.leipzig.de/allris_leipzig_public/vo020?VOLFDNR=2010916"
}, {
    "body": "Leipzig",
    "content": "<empty>",
    "name": "Toilettenanlage im Lene-Voigt-Park (SBB 0021/ 23)",
    "resolution": null,
    "originator": "SBB S\u00fcdost",
    "paper_type": "\u00c4nderung zum HH-Planentwurf",
    "published_at": "2023-05-09",
    "reference": "VII-HP-08647",
    "url": "https://ratsinformation.leipzig.de/allris_leipzig_public/vo020?VOLFDNR=2010919"
}, {
    "body": "Leipzig",
    "content": "<empty>",
    "name": "Erh\u00f6hung Verkehrssicherheit - Anschaffung Blitzer (A 0166/ 23/24)",
    "resolution": null,
    "originator": "SPD-Fraktion",
    "paper_type": "\u00c4nderung zum HH-Planentwurf",
    "published_at": "2023-05-09",
    "reference": "VII-HP-08648",
    "url": "https://ratsinformation.leipzig.de/allris_leipzig_public/vo020?VOLFDNR=2010920"
}, {
    "body": "Leipzig",
    "content": "<empty>",
    "name": "Bedrohte Freie Kunst und Kultur st\u00e4rken durch zus\u00e4tzliche F\u00f6rdermittel - Personal  (A 0024/ 23/24)",
    "resolution": null,
    "originator": "Fraktion B\u00fcndnis 90/Die Gr\u00fcnen",
    "paper_type": "\u00c4nderung zum HH-Planentwurf",
    "published_at": "2023-05-09",
    "reference": "VII-HP-08649",
    "url": "https://ratsinformation.leipzig.de/allris_leipzig_public/vo020?VOLFDNR=2010921"
}, {
    "body": "Leipzig",
    "content": "<empty>",
    "name": "\"B\u00fcrger- und Akteursbeteiligung\" weiter verstetigen - Teil I - Stellen (A 0037/ 23/24)",
    "resolution": null,
    "originator": "Fraktion B\u00fcndnis 90/Die Gr\u00fcnen",
    "paper_type": "\u00c4nderung zum HH-Planentwurf",
    "published_at": "2023-05-09",
    "reference": "VII-HP-08654",
    "url": "https://ratsinformation.leipzig.de/allris_leipzig_public/vo020?VOLFDNR=2010926"
}, {
    "body": "Leipzig",
    "content": "<empty>",
    "name": "Sperre zur Auslastungssicherung von Stellen (A 0068/ 23/24)",
    "resolution": null,
    "originator": "Fraktion CDU",
    "paper_type": "\u00c4nderung zum HH-Planentwurf",
    "published_at": "2023-05-09",
    "reference": "VII-HP-08650",
    "url": "https://ratsinformation.leipzig.de/allris_leipzig_public/vo020?VOLFDNR=2010922"
}, {
    "body": "Leipzig",
    "content": "<empty>",
    "name": "Gesundheitspr\u00e4vention, Informationsveranstaltungen und Sensibilisierungskampagnen im Bereich Sexualit\u00e4t in Gesundheitsamt (A 0033/ 23/24)",
    "resolution": null,
    "originator": "Fraktion B\u00fcndnis 90/Die Gr\u00fcnen",
    "paper_type": "\u00c4nderung zum HH-Planentwurf",
    "published_at": "2023-05-09",
    "reference": "VII-HP-08651",
    "url": "https://ratsinformation.leipzig.de/allris_leipzig_public/vo020?VOLFDNR=2010923"
}, {
    "body": "Leipzig",
    "content": "<empty>",
    "name": "Streichung der Bauma\u00dfnahmen am Werk II (A 0074/ 23/24)",
    "resolution": null,
    "originator": "Fraktion AfD",
    "paper_type": "\u00c4nderung zum HH-Planentwurf",
    "published_at": "2023-05-09",
    "reference": "VII-HP-08652",
    "url": "https://ratsinformation.leipzig.de/allris_leipzig_public/vo020?VOLFDNR=2010924"
}, {
    "body": "Leipzig",
    "content": "<empty>",
    "name": "Familienhebamme - Projektbeteiligung  (A 0034/ 23/24)",
    "resolution": null,
    "originator": "Fraktion B\u00fcndnis 90/Die Gr\u00fcnen",
    "paper_type": "\u00c4nderung zum HH-Planentwurf",
    "published_at": "2023-05-09",
    "reference": "VII-HP-08653",
    "url": "https://ratsinformation.leipzig.de/allris_leipzig_public/vo020?VOLFDNR=2010925"
}, {
    "body": "Leipzig",
    "content": "<empty>",
    "name": "Aufstockung von Stellen im Klimareferat f\u00fcr Energiewende  (A 0045/ 23/24)",
    "resolution": null,
    "originator": "Fraktion B\u00fcndnis 90/Die Gr\u00fcnen",
    "paper_type": "\u00c4nderung zum HH-Planentwurf",
    "published_at": "2023-05-09",
    "reference": "VII-HP-08655",
    "url": "https://ratsinformation.leipzig.de/allris_leipzig_public/vo020?VOLFDNR=2010927"
}, {
    "body": "Leipzig",
    "content": "<empty>",
    "name": "St\u00e4rkung der Energie- und Klimaschutzberatung im UiZ  (A 0050/ 23/24)",
    "resolution": null,
    "originator": "Fraktion B\u00fcndnis 90/Die Gr\u00fcnen",
    "paper_type": "\u00c4nderung zum HH-Planentwurf",
    "published_at": "2023-05-09",
    "reference": "VII-HP-08656",
    "url": "https://ratsinformation.leipzig.de/allris_leipzig_public/vo020?VOLFDNR=2010928"
}, {
    "body": "Leipzig",
    "content": "<empty>",
    "name": "Wohngeldreform sachgerecht umsetzen (A 0104/ 23/24)",
    "resolution": null,
    "originator": "Fraktion DIE LINKE",
    "paper_type": "\u00c4nderung zum HH-Planentwurf",
    "published_at": "2023-05-09",
    "reference": "VII-HP-08657",
    "url": "https://ratsinformation.leipzig.de/allris_leipzig_public/vo020?VOLFDNR=2010929"
}, {
    "body": "Leipzig",
    "content": "<empty>",
    "name": "Mehr Personal braucht mehr Personal (A 0110/ 23/24)",
    "resolution": null,
    "originator": "Fraktion DIE LINKE",
    "paper_type": "\u00c4nderung zum HH-Planentwurf",
    "published_at": "2023-05-09",
    "reference": "VII-HP-08658",
    "url": "https://ratsinformation.leipzig.de/allris_leipzig_public/vo020?VOLFDNR=2010930"
}, {
    "body": "Leipzig",
    "content": "<empty>",
    "name": "Digitale Schnittstellen f\u00fcr B\u00fcrgerInnen, Unternehmen und Vereine (A 0170/ 23/24)",
    "resolution": null,
    "originator": "SPD-Fraktion",
    "paper_type": "\u00c4nderung zum HH-Planentwurf",
    "published_at": "2023-05-09",
    "reference": "VII-HP-08665",
    "url": "https://ratsinformation.leipzig.de/allris_leipzig_public/vo020?VOLFDNR=2010937"
}, {
    "body": "Leipzig",
    "content": "<empty>",
    "name": "St\u00e4rkung von Personalbetreuung und -entwicklung (A 0186/ 23/24)",
    "resolution": null,
    "originator": "SPD-Fraktion",
    "paper_type": "\u00c4nderung zum HH-Planentwurf",
    "published_at": "2023-05-09",
    "reference": "VII-HP-08666",
    "url": "https://ratsinformation.leipzig.de/allris_leipzig_public/vo020?VOLFDNR=2010938"
}, {
    "body": "Leipzig",
    "content": "<empty>",
    "name": "Eine zus\u00e4tzliche Stelle f\u00fcr die Vergabe von Stipendien (A 0154/ 23/24)",
    "resolution": null,
    "originator": "SR M. Gehrt; SR Th. Kumbernu\u00df; SR M. G\u00f6tze",
    "paper_type": "\u00c4nderung zum HH-Planentwurf",
    "published_at": "2023-05-09",
    "reference": "VII-HP-08661",
    "url": "https://ratsinformation.leipzig.de/allris_leipzig_public/vo020?VOLFDNR=2010933"
}, {
    "body": "Leipzig",
    "content": "<empty>",
    "name": "Guter B\u00fcrgerservice braucht mehr Personal (A 0112/ 23/24)",
    "resolution": null,
    "originator": "Fraktion DIE LINKE",
    "paper_type": "\u00c4nderung zum HH-Planentwurf",
    "published_at": "2023-05-09",
    "reference": "VII-HP-08659",
    "url": "https://ratsinformation.leipzig.de/allris_leipzig_public/vo020?VOLFDNR=2010931"
}, {
    "body": "Leipzig",
    "content": "<empty>",
    "name": "Leipiger Schulbibliotheken und Leser\u00e4ume konsequent weiterentwickeln! (A 0149/ 23/24)",
    "resolution": null,
    "originator": "SR Dr. A. Bednarsky; SR M. G\u00f6tze; SR Oliver Gebhardt; SR S. Pellmann; SR U. K\u00f6hler-Siegel",
    "paper_type": "\u00c4nderung zum HH-Planentwurf",
    "published_at": "2023-05-09",
    "reference": "VII-HP-08662",
    "url": "https://ratsinformation.leipzig.de/allris_leipzig_public/vo020?VOLFDNR=2010934"
}, {
    "body": "Leipzig",
    "content": "<empty>",
    "name": "Regeneration braucht Personal (A 0161/ 23/24)",
    "resolution": null,
    "originator": "SR Dr. A. Bednarsky; SR J. Nagel; SR B. Ehms; SR M. G\u00f6tze; SR M. K\u00fcng-Vildebrand; SR O. Gebhardt",
    "paper_type": "\u00c4nderung zum HH-Planentwurf",
    "published_at": "2023-05-09",
    "reference": "VII-HP-08660",
    "url": "https://ratsinformation.leipzig.de/allris_leipzig_public/vo020?VOLFDNR=2010932"
}, {
    "body": "Leipzig",
    "content": "<empty>",
    "name": "Streichung der Bauma\u00dfnahmen am \"Conne Island\" (A 0075/ 23/24)",
    "resolution": null,
    "originator": "Fraktion AfD",
    "paper_type": "\u00c4nderung zum HH-Planentwurf",
    "published_at": "2023-05-09",
    "reference": "VII-HP-08663",
    "url": "https://ratsinformation.leipzig.de/allris_leipzig_public/vo020?VOLFDNR=2010935"
}, {
    "body": "Leipzig",
    "content": "<empty>",
    "name": "Aufstockung der Umweltberatung im Umweltinformationszentrum (UiZ) (A 0129/ 23/24)",
    "resolution": null,
    "originator": "SR M. Neuhaus; SR Prof. Dr. G. Abraham",
    "paper_type": "\u00c4nderung zum HH-Planentwurf",
    "published_at": "2023-05-09",
    "reference": "VII-HP-08664",
    "url": "https://ratsinformation.leipzig.de/allris_leipzig_public/vo020?VOLFDNR=2010936"
}, {
    "body": "Leipzig",
    "content": "<empty>",
    "name": "Baalsdorfer Vereins- und Begegnungsst\u00e4tte vorantreiben! (A 0086/ 24)",
    "resolution": null,
    "originator": "Fraktion AfD",
    "paper_type": "\u00c4nderung zum HH-Planentwurf",
    "published_at": "2023-05-09",
    "reference": "VII-HP-08674",
    "url": "https://ratsinformation.leipzig.de/allris_leipzig_public/vo020?VOLFDNR=2010946"
}, {
    "body": "Leipzig",
    "content": "<empty>",
    "name": "Schulsozialarbeit; Kita- und Schulsozialarbeit aufstocken (Schulsozialarbeit) - Neufassung zu den Antr\u00e4gen A 0197/23/24 und A 0118/23/24 (A 0197/ 23/24-01-NF)",
    "resolution": null,
    "originator": "Fraktion B\u00fcndnis 90/Die Gr\u00fcnen; Fraktion DIE LINKE; SPD-Fraktion",
    "paper_type": "\u00c4nderung zum HH-Planentwurf",
    "published_at": "2023-05-09",
    "reference": "VII-HP-08673",
    "url": "https://ratsinformation.leipzig.de/allris_leipzig_public/vo020?VOLFDNR=2010945"
}, {
    "body": "Leipzig",
    "content": "<empty>",
    "name": "Erh\u00f6hung Medienetat der Schulbibliotheken und Leser\u00e4ume (A 0189/ 23/24)",
    "resolution": null,
    "originator": "SPD-Fraktion",
    "paper_type": "\u00c4nderung zum HH-Planentwurf",
    "published_at": "2023-05-09",
    "reference": "VII-HP-08672",
    "url": "https://ratsinformation.leipzig.de/allris_leipzig_public/vo020?VOLFDNR=2010944"
}, {
    "body": "Leipzig",
    "content": "<empty>",
    "name": "Quartiersschule Ihmelsstra\u00dfe - Projekt \u00d6ffnung ins Quartier (A 0040/ 23/24-01-NF)",
    "resolution": null,
    "originator": "Fraktion B\u00fcndnis 90/Die Gr\u00fcnen",
    "paper_type": "\u00c4nderung zum HH-Planentwurf",
    "published_at": "2023-05-09",
    "reference": "VII-HP-08669",
    "url": "https://ratsinformation.leipzig.de/allris_leipzig_public/vo020?VOLFDNR=2010941"
}, {
    "body": "Leipzig",
    "content": "<empty>",
    "name": "Sachmittel f\u00fcr Leipziger Schulbibliotheken und Leser\u00e4ume  (A 0148/ 23/24)",
    "resolution": null,
    "originator": "SR Dr. A. Bednarsky; SR M. G\u00f6tze; SR Oliver Gebhardt",
    "paper_type": "\u00c4nderung zum HH-Planentwurf",
    "published_at": "2023-05-09",
    "reference": "VII-HP-08671",
    "url": "https://ratsinformation.leipzig.de/allris_leipzig_public/vo020?VOLFDNR=2010943"
}, {
    "body": "Leipzig",
    "content": "<empty>",
    "name": "Neue Stelle Qualit\u00e4tssicherung in der Wohnungslosenhilfe der Stadt Leipzig (A 0206/ 23/24)",
    "resolution": null,
    "originator": "Fraktion B\u00fcndnis 90/Die Gr\u00fcnen",
    "paper_type": "\u00c4nderung zum HH-Planentwurf",
    "published_at": "2023-05-09",
    "reference": "VII-HP-08667",
    "url": "https://ratsinformation.leipzig.de/allris_leipzig_public/vo020?VOLFDNR=2010939"
}, {
    "body": "Leipzig",
    "content": "<empty>",
    "name": "Verkehrs\u00fcberwachung im ruhenden Verkehr dem tats\u00e4chlichen Bedarf anpassen (A 0207/ 23/24)",
    "resolution": null,
    "originator": "Fraktion DIE LINKE",
    "paper_type": "\u00c4nderung zum HH-Planentwurf",
    "published_at": "2023-05-09",
    "reference": "VII-HP-08668",
    "url": "https://ratsinformation.leipzig.de/allris_leipzig_public/vo020?VOLFDNR=2010940"
}, {
    "body": "Leipzig",
    "content": "<empty>",
    "name": "Bearbeitungsstau abbauen, neue Aufgaben meistern: Ausl\u00e4nderbeh\u00f6rde aufstocken (Neufassung zu den Antr\u00e4gen A 0106/23/24 und A 0171/23/24) (A 0106/ 23/24-01-NF)",
    "resolution": null,
    "originator": "Fraktion DIE LINKE; SPD-Fraktion",
    "paper_type": "\u00c4nderung zum HH-Planentwurf",
    "published_at": "2023-05-09",
    "reference": "VII-HP-08670",
    "url": "https://ratsinformation.leipzig.de/allris_leipzig_public/vo020?VOLFDNR=2010942"
}, {
    "body": "Leipzig",
    "content": "<empty>",
    "name": "Radverkehrs\u00fcbungsplatz im Stadtbezirk Leipzig-Ost (SBB 0014/ 23/24)",
    "resolution": null,
    "originator": "SBB Ost",
    "paper_type": "\u00c4nderung zum HH-Planentwurf",
    "published_at": "2023-05-09",
    "reference": "VII-HP-08675",
    "url": "https://ratsinformation.leipzig.de/allris_leipzig_public/vo020?VOLFDNR=2010947"
}, {
    "body": "Leipzig",
    "content": "<empty>",
    "name": "F\u00f6rderung von baulichen und technischen Schutz- und Reparaturma\u00dfnahmen f\u00fcr muslimische und j\u00fcdische Gemeinden (A 0009/ 23/24)",
    "resolution": null,
    "originator": "Migrantenbeirat",
    "paper_type": "\u00c4nderung zum HH-Planentwurf",
    "published_at": "2023-05-09",
    "reference": "VII-HP-08676",
    "url": "https://ratsinformation.leipzig.de/allris_leipzig_public/vo020?VOLFDNR=2010948"
}, {
    "body": "Leipzig",
    "content": "<empty>",
    "name": "Sanierung OFT Sellerhausen (SBB 0015/ 23/24)",
    "resolution": null,
    "originator": "SBB Ost",
    "paper_type": "\u00c4nderung zum HH-Planentwurf",
    "published_at": "2023-05-09",
    "reference": "VII-HP-08678",
    "url": "https://ratsinformation.leipzig.de/allris_leipzig_public/vo020?VOLFDNR=2010950"
}, {
    "body": "Leipzig",
    "content": "<empty>",
    "name": "Handschwengelpumpe Wurzener Stra\u00dfe und im Stadtgebiet (SBB 0016/ 23/24)",
    "resolution": null,
    "originator": "SBB Ost",
    "paper_type": "\u00c4nderung zum HH-Planentwurf",
    "published_at": "2023-05-09",
    "reference": "VII-HP-08677",
    "url": "https://ratsinformation.leipzig.de/allris_leipzig_public/vo020?VOLFDNR=2010949"
}, {
    "body": "Leipzig",
    "content": "<empty>",
    "name": "Erh\u00f6hung der Druckkostenzusch\u00fcsse f\u00fcr Ortsteilbl\u00e4tter (OR 0061/ 23/24)",
    "resolution": null,
    "originator": "OR R\u00fcckmarsdorf",
    "paper_type": "\u00c4nderung zum HH-Planentwurf",
    "published_at": "2023-05-09",
    "reference": "VII-HP-08679",
    "url": "https://ratsinformation.leipzig.de/allris_leipzig_public/vo020?VOLFDNR=2010951"
}, {
    "body": "Leipzig",
    "content": "<empty>",
    "name": "Dynamisierung F\u00f6rderung von Vereinen und Verb\u00e4nden im Umweltbereich  (A 0172/ 23/24)",
    "resolution": null,
    "originator": "SPD-Fraktion",
    "paper_type": "\u00c4nderung zum HH-Planentwurf",
    "published_at": "2023-05-09",
    "reference": "VII-HP-08684",
    "url": "https://ratsinformation.leipzig.de/allris_leipzig_public/vo020?VOLFDNR=2010956"
}, {
    "body": "Leipzig",
    "content": "<empty>",
    "name": "Erh\u00f6hung der Druckkostenzusch\u00fcsse f\u00fcr Ortsteilbl\u00e4tter (OR 0051/ 23/24)",
    "resolution": null,
    "originator": "OR Burghausen",
    "paper_type": "\u00c4nderung zum HH-Planentwurf",
    "published_at": "2023-05-09",
    "reference": "VII-HP-08682",
    "url": "https://ratsinformation.leipzig.de/allris_leipzig_public/vo020?VOLFDNR=2010954"
}, {
    "body": "Leipzig",
    "content": "<empty>",
    "name": "Fonds \"Leipzig. Ort der Vielfalt\" aufstocken  (A 0036/ 23/24)",
    "resolution": null,
    "originator": "Fraktion B\u00fcndnis 90/Die Gr\u00fcnen",
    "paper_type": "\u00c4nderung zum HH-Planentwurf",
    "published_at": "2023-05-09",
    "reference": "VII-HP-08680",
    "url": "https://ratsinformation.leipzig.de/allris_leipzig_public/vo020?VOLFDNR=2010952"
}, {
    "body": "Leipzig",
    "content": "<empty>",
    "name": "Erh\u00f6hung des Budgets f\u00fcr Sprach- und Kulturmittlung (SPRINT) (A 0151/ 23/24)",
    "resolution": null,
    "originator": "SR J. Nagel; SR. Dr. V. K\u00fclow; SR B. Ehms; SR S. Pellmann; SR Th. Kumbernu\u00df; SR K. Krefft; SR N. Silvestre",
    "paper_type": "\u00c4nderung zum HH-Planentwurf",
    "published_at": "2023-05-09",
    "reference": "VII-HP-08681",
    "url": "https://ratsinformation.leipzig.de/allris_leipzig_public/vo020?VOLFDNR=2010953"
}, {
    "body": "Leipzig",
    "content": "<empty>",
    "name": "Erh\u00f6hung der Druckkostenzusch\u00fcsse f\u00fcr Ortsteilbl\u00e4tter (OR 0059/ 23)",
    "resolution": null,
    "originator": "OR B\u00f6hlitz-Ehrenberg",
    "paper_type": "\u00c4nderung zum HH-Planentwurf",
    "published_at": "2023-05-09",
    "reference": "VII-HP-08683",
    "url": "https://ratsinformation.leipzig.de/allris_leipzig_public/vo020?VOLFDNR=2010955"
}, {
    "body": "Leipzig",
    "content": "<empty>",
    "name": "Stellenaufwuchs Bauhof Engelsdorf/M\u00f6lkau (A 0084/ 23/24)",
    "resolution": null,
    "originator": "Fraktion AfD",
    "paper_type": "\u00c4nderung zum HH-Planentwurf",
    "published_at": "2023-05-09",
    "reference": "VII-HP-08685",
    "url": "https://ratsinformation.leipzig.de/allris_leipzig_public/vo020?VOLFDNR=2010957"
}, {
    "body": "Leipzig",
    "content": "<empty>",
    "name": "Sanierung historischer Handschwengelpumpen (SBB 0024/ 23/24)",
    "resolution": null,
    "originator": "SBB Mitte",
    "paper_type": "\u00c4nderung zum HH-Planentwurf",
    "published_at": "2023-05-09",
    "reference": "VII-HP-08686",
    "url": "https://ratsinformation.leipzig.de/allris_leipzig_public/vo020?VOLFDNR=2010958"
}, {
    "body": "Leipzig",
    "content": "<empty>",
    "name": "Ausbau Beratung zu Autismus-Spektrum  (A 0032/ 23/24)",
    "resolution": null,
    "originator": "Fraktion B\u00fcndnis 90/Die Gr\u00fcnen",
    "paper_type": "\u00c4nderung zum HH-Planentwurf",
    "published_at": "2023-05-09",
    "reference": "VII-HP-08693",
    "url": "https://ratsinformation.leipzig.de/allris_leipzig_public/vo020?VOLFDNR=2010965"
}, {
    "body": "Leipzig",
    "content": "<empty>",
    "name": "Finanzierung der Personal- und Sachkosten f\u00fcr das \"Modellprojekt zur Verbesserung der psychosozialen Versorgung von gefl\u00fcchteten Menschen\" (A 0010/ 23/24)",
    "resolution": null,
    "originator": "Migrantenbeirat",
    "paper_type": "\u00c4nderung zum HH-Planentwurf",
    "published_at": "2023-05-09",
    "reference": "VII-HP-08690",
    "url": "https://ratsinformation.leipzig.de/allris_leipzig_public/vo020?VOLFDNR=2010962"
}, {
    "body": "Leipzig",
    "content": "<empty>",
    "name": "Projekt \"Offener Dialog\" zur Beratung psychisch Kranker mobilisieren  (A 0030/ 23/24)",
    "resolution": null,
    "originator": "Fraktion B\u00fcndnis 90/Die Gr\u00fcnen",
    "paper_type": "\u00c4nderung zum HH-Planentwurf",
    "published_at": "2023-05-09",
    "reference": "VII-HP-08692",
    "url": "https://ratsinformation.leipzig.de/allris_leipzig_public/vo020?VOLFDNR=2010964"
}, {
    "body": "Leipzig",
    "content": "<empty>",
    "name": "Erh\u00f6hung der SprInt-Mittel f\u00fcr die \u00e4rztliche Versorgung durch den Verbund Gemeindenahe Psychiatrie (A 0008/ 23/24)",
    "resolution": null,
    "originator": "Migrantenbeirat",
    "paper_type": "\u00c4nderung zum HH-Planentwurf",
    "published_at": "2023-05-09",
    "reference": "VII-HP-08689",
    "url": "https://ratsinformation.leipzig.de/allris_leipzig_public/vo020?VOLFDNR=2010961"
}, {
    "body": "Leipzig",
    "content": "<empty>",
    "name": "Budgetaufstockung des Migrant/-innenbeirats Leipzig (A 0003/ 23/24)",
    "resolution": null,
    "originator": "Migrantenbeirat",
    "paper_type": "\u00c4nderung zum HH-Planentwurf",
    "published_at": "2023-05-09",
    "reference": "VII-HP-08687",
    "url": "https://ratsinformation.leipzig.de/allris_leipzig_public/vo020?VOLFDNR=2010959"
}, {
    "body": "Leipzig",
    "content": "<empty>",
    "name": "Aufstockung der Behandlungskapazit\u00e4ten des Psychosozialen Zentrums f\u00fcr Gefl\u00fcchtete Leipzig (PSZ Leipzig) Mosaik Leipzig e. V. (A 0004/ 23/24)",
    "resolution": null,
    "originator": "Migrantenbeirat",
    "paper_type": "\u00c4nderung zum HH-Planentwurf",
    "published_at": "2023-05-09",
    "reference": "VII-HP-08688",
    "url": "https://ratsinformation.leipzig.de/allris_leipzig_public/vo020?VOLFDNR=2010960"
}, {
    "body": "Leipzig",
    "content": "<empty>",
    "name": "Gedenkort Riebeckstra\u00dfe 63 - Finanzierung der Betriebskosten  (A 0042/ 23/24)",
    "resolution": null,
    "originator": "Fraktion B\u00fcndnis 90/Die Gr\u00fcnen",
    "paper_type": "\u00c4nderung zum HH-Planentwurf",
    "published_at": "2023-05-09",
    "reference": "VII-HP-08694",
    "url": "https://ratsinformation.leipzig.de/allris_leipzig_public/vo020?VOLFDNR=2010966"
}, {
    "body": "Leipzig",
    "content": "<empty>",
    "name": "Unabh\u00e4ngige Beratung f\u00fcr Armutsbetroffene  (A 0022/ 23/24)",
    "resolution": null,
    "originator": "Fraktion B\u00fcndnis 90/Die Gr\u00fcnen",
    "paper_type": "\u00c4nderung zum HH-Planentwurf",
    "published_at": "2023-05-09",
    "reference": "VII-HP-08691",
    "url": "https://ratsinformation.leipzig.de/allris_leipzig_public/vo020?VOLFDNR=2010963"
}, {
    "body": "Leipzig",
    "content": "<empty>",
    "name": "F\u00f6rderung Suchtzentrum Leipzig gGmbH (A 0195/ 23/24-01-NF)",
    "resolution": null,
    "originator": "SPD-Fraktion; Fraktion DIE LINKE",
    "paper_type": "\u00c4nderung zum HH-Planentwurf",
    "published_at": "2023-05-09",
    "reference": "VII-HP-08698",
    "url": "https://ratsinformation.leipzig.de/allris_leipzig_public/vo020?VOLFDNR=2010970"
}, {
    "body": "Leipzig",
    "content": "<empty>",
    "name": "Verbesserung der psychosozialen Versorgung gefl\u00fcchteter Menschen in Leipzig (A 0142/ 23/24)",
    "resolution": null,
    "originator": "Fraktion DIE LINKE; Fraktion B\u00fcndnis 90/Die Gr\u00fcnen; SPD-Fraktion",
    "paper_type": "\u00c4nderung zum HH-Planentwurf",
    "published_at": "2023-05-09",
    "reference": "VII-HP-08695",
    "url": "https://ratsinformation.leipzig.de/allris_leipzig_public/vo020?VOLFDNR=2010967"
}, {
    "body": "Leipzig",
    "content": "<empty>",
    "name": "Beseitigung illegaler Graffiti (A 0091/ 23/24)",
    "resolution": null,
    "originator": "Fraktion AfD",
    "paper_type": "\u00c4nderung zum HH-Planentwurf",
    "published_at": "2023-05-09",
    "reference": "VII-HP-08696",
    "url": "https://ratsinformation.leipzig.de/allris_leipzig_public/vo020?VOLFDNR=2010968"
}, {
    "body": "Leipzig",
    "content": "<empty>",
    "name": "F\u00f6rderung CABL e.V.; Budgeterh\u00f6hung f\u00fcr Clearingstelle/ Anonymer Behandlungsschein CABL e. V. (Beschlusspunkte 1+2) (A 0146/ 23/24-01-NF1)",
    "resolution": null,
    "originator": "Fraktion B\u00fcndnis 90/Die Gr\u00fcnen; Fraktion DIE LINKE",
    "paper_type": "\u00c4nderung zum HH-Planentwurf",
    "published_at": "2023-05-09",
    "reference": "VII-HP-08697",
    "url": "https://ratsinformation.leipzig.de/allris_leipzig_public/vo020?VOLFDNR=2010969"
}, {
    "body": "Leipzig",
    "content": "<empty>",
    "name": "Bau einer Sporthalle (OR 0056/ 23)",
    "resolution": null,
    "originator": "OR B\u00f6hlitz-Ehrenberg",
    "paper_type": "\u00c4nderung zum HH-Planentwurf",
    "published_at": "2023-05-09",
    "reference": "VII-HP-08704",
    "url": "https://ratsinformation.leipzig.de/allris_leipzig_public/vo020?VOLFDNR=2010976"
}, {
    "body": "Leipzig",
    "content": "<empty>",
    "name": "Sportinvestitionsf\u00f6rderung f\u00fcr Ma\u00dfnahmen zur Ressourcenschonung aufstocken (Neufassung zu den Antr\u00e4gen A 0139/23/24 und A 0173/23/24) (A 0139/ 23/24-01-NF)",
    "resolution": null,
    "originator": "Fraktion Die Linke; SPD-Fraktion",
    "paper_type": "\u00c4nderung zum HH-Planentwurf",
    "published_at": "2023-05-09",
    "reference": "VII-HP-08706",
    "url": "https://ratsinformation.leipzig.de/allris_leipzig_public/vo020?VOLFDNR=2010978"
}, {
    "body": "Leipzig",
    "content": "<empty>",
    "name": "Zukunft f\u00fcr unser Wackerbad (A 0136/ 23)",
    "resolution": null,
    "originator": "SR O. Gebhardt; SR Dr. V. K\u00fclow; SR Dr. A. Bednarsky",
    "paper_type": "\u00c4nderung zum HH-Planentwurf",
    "published_at": "2023-05-09",
    "reference": "VII-HP-08702",
    "url": "https://ratsinformation.leipzig.de/allris_leipzig_public/vo020?VOLFDNR=2010974"
}, {
    "body": "Leipzig",
    "content": "<empty>",
    "name": "F\u00f6rderung in den Bereichen Soziales, Migration, Gesundheit und Vielfalt (Neufassung zu den Antr\u00e4gen A 0108/23/24, A 0020/23/24, A0031/ 23/24, A 0200/23/24, A 0201/23/24, A 0202/23/24, A 0203/23/24) (A 0108/ 23/24-01-NF)",
    "resolution": null,
    "originator": "SPD-Fraktion; Fraktion B\u00fcndnis 90/Die Gr\u00fcnen; Fraktion DIE LINKE",
    "paper_type": "\u00c4nderung zum HH-Planentwurf",
    "published_at": "2023-05-09",
    "reference": "VII-HP-08699",
    "url": "https://ratsinformation.leipzig.de/allris_leipzig_public/vo020?VOLFDNR=2010971"
}, {
    "body": "Leipzig",
    "content": "<empty>",
    "name": "Kostenfreie \u00d6PNV-Tickets f\u00fcr obdachlose Menschen  (A 0199/ 23/24)",
    "resolution": null,
    "originator": "SPD-Fraktion",
    "paper_type": "\u00c4nderung zum HH-Planentwurf",
    "published_at": "2023-05-09",
    "reference": "VII-HP-08701",
    "url": "https://ratsinformation.leipzig.de/allris_leipzig_public/vo020?VOLFDNR=2010973"
}, {
    "body": "Leipzig",
    "content": "<empty>",
    "name": "Infrastrukturma\u00dfnahmen am Standort Eutritzsch (Delitzscher Stra\u00dfe 141)  (A 0117/ 23/24)",
    "resolution": null,
    "originator": "Fraktion DIE LINKE; Fraktion B\u00fcndnis 90/Die Gr\u00fcnen; SPD-Fraktion",
    "paper_type": "\u00c4nderung zum HH-Planentwurf",
    "published_at": "2023-05-09",
    "reference": "VII-HP-08700",
    "url": "https://ratsinformation.leipzig.de/allris_leipzig_public/vo020?VOLFDNR=2010972"
}, {
    "body": "Leipzig",
    "content": "<empty>",
    "name": "Gohliser Wackerbad wieder nutzbar machen (A 0163/ 23)",
    "resolution": null,
    "originator": "Fraktion AfD",
    "paper_type": "\u00c4nderung zum HH-Planentwurf",
    "published_at": "2023-05-09",
    "reference": "VII-HP-08703",
    "url": "https://ratsinformation.leipzig.de/allris_leipzig_public/vo020?VOLFDNR=2010975"
}, {
    "body": "Leipzig",
    "content": "<empty>",
    "name": "Machbarkeitsstudie Wackerbad  (A 0175/ 23)",
    "resolution": null,
    "originator": "SPD-Fraktion",
    "paper_type": "\u00c4nderung zum HH-Planentwurf",
    "published_at": "2023-05-09",
    "reference": "VII-HP-08705",
    "url": "https://ratsinformation.leipzig.de/allris_leipzig_public/vo020?VOLFDNR=2010977"
}, {
    "body": "Leipzig",
    "content": "<empty>",
    "name": "Nachr\u00fcstung eines Oberflurhydranten Ger\u00e4tehaus der Freiwilligen Feuerwehr B\u00f6hlitz-Ehrenberg (OR 0052/ 23)",
    "resolution": null,
    "originator": "OR B\u00f6hlitz-Ehrenberg",
    "paper_type": "\u00c4nderung zum HH-Planentwurf",
    "published_at": "2023-05-09",
    "reference": "VII-HP-08707",
    "url": "https://ratsinformation.leipzig.de/allris_leipzig_public/vo020?VOLFDNR=2010979"
}, {
    "body": "Leipzig",
    "content": "<empty>",
    "name": "Zusch\u00fcsse f\u00fcr Sportpachtanlagen erh\u00f6hen - Mehrbedarfe f\u00fcr Sportvereine abfedern (Neufassung zu den Antr\u00e4gen A 0113/23/24 und A 0174/23/24) (A 0174/ 23/24-01-NF)",
    "resolution": null,
    "originator": "SPD-Fraktion; Fraktion Die Linke",
    "paper_type": "\u00c4nderung zum HH-Planentwurf",
    "published_at": "2023-05-09",
    "reference": "VII-HP-08708",
    "url": "https://ratsinformation.leipzig.de/allris_leipzig_public/vo020?VOLFDNR=2010980"
}, {
    "body": "Leipzig",
    "content": "<empty>",
    "name": "Energieeffizienz mit stabilen Mieten  (A 0103/ 24)",
    "resolution": null,
    "originator": "Fraktion DIE LINKE",
    "paper_type": "\u00c4nderung zum HH-Planentwurf",
    "published_at": "2023-05-09",
    "reference": "VII-HP-08712",
    "url": "https://ratsinformation.leipzig.de/allris_leipzig_public/vo020?VOLFDNR=2010984"
}, {
    "body": "Leipzig",
    "content": "<empty>",
    "name": "Kommunales F\u00f6rderprogramm Heizungsmodernisierung f\u00fcr stabile Mieten  (A 0043/ 24)",
    "resolution": null,
    "originator": "Fraktion B\u00fcndnis 90/Die Gr\u00fcnen",
    "paper_type": "\u00c4nderung zum HH-Planentwurf",
    "published_at": "2023-05-09",
    "reference": "VII-HP-08710",
    "url": "https://ratsinformation.leipzig.de/allris_leipzig_public/vo020?VOLFDNR=2010982"
}, {
    "body": "Leipzig",
    "content": "<empty>",
    "name": "Quartiersmanagement f\u00fcr Aufmerksamkeitsgebiete  (A 0177/ 24)",
    "resolution": null,
    "originator": "SPD-Fraktion",
    "paper_type": "\u00c4nderung zum HH-Planentwurf",
    "published_at": "2023-05-09",
    "reference": "VII-HP-08713",
    "url": "https://ratsinformation.leipzig.de/allris_leipzig_public/vo020?VOLFDNR=2010985"
}, {
    "body": "Leipzig",
    "content": "<empty>",
    "name": "Leipziger Radrennbahn - flott machen f\u00fcr die Zukunft! (A 0155/ 23-01-NF)",
    "resolution": null,
    "originator": "SR Ch. Zenker; SR U. K\u00f6hler-Siegel; SR Dr. A. Bednarski; SR St. Wehmann; SR J. Lehmann; SR J. Heller; SR M. Biederstedt; SR N. Volger",
    "paper_type": "\u00c4nderung zum HH-Planentwurf",
    "published_at": "2023-05-09",
    "reference": "VII-HP-08709",
    "url": "https://ratsinformation.leipzig.de/allris_leipzig_public/vo020?VOLFDNR=2010981"
}, {
    "body": "Leipzig",
    "content": "<empty>",
    "name": "F\u00f6rderprogramm Nachhaltiges Bauen einrichten  (A 0065/ 24)",
    "resolution": null,
    "originator": "Fraktion B\u00fcndnis 90/Die Gr\u00fcnen",
    "paper_type": "\u00c4nderung zum HH-Planentwurf",
    "published_at": "2023-05-09",
    "reference": "VII-HP-08711",
    "url": "https://ratsinformation.leipzig.de/allris_leipzig_public/vo020?VOLFDNR=2010983"
}, {
    "body": "Leipzig",
    "content": "<empty>",
    "name": "Energieeffizienz mit stabilen Mieten  (A 0103/ 24-01-\u00c4A)",
    "resolution": null,
    "originator": "SPD-Fraktion",
    "paper_type": "\u00c4nderung zum HH-Planentwurf",
    "published_at": "2023-05-09",
    "reference": "VII-HP-08714",
    "url": "https://ratsinformation.leipzig.de/allris_leipzig_public/vo020?VOLFDNR=2010986"
}, {
    "body": "Leipzig",
    "content": "<empty>",
    "name": "Neugestaltung Siegfriedplatz  (SBB 0007/ 23/24)",
    "resolution": null,
    "originator": "SBB S\u00fcd",
    "paper_type": "\u00c4nderung zum HH-Planentwurf",
    "published_at": "2023-05-09",
    "reference": "VII-HP-08716",
    "url": "https://ratsinformation.leipzig.de/allris_leipzig_public/vo020?VOLFDNR=2010988"
}, {
    "body": "Leipzig",
    "content": "<empty>",
    "name": "\u00d6ffentlichen Raum entlang der R\u00f6del aufwerten - ErgHH (SBB 0001/ 23)",
    "resolution": null,
    "originator": "SBB S\u00fcdwest",
    "paper_type": "\u00c4nderung zum HH-Planentwurf",
    "published_at": "2023-05-09",
    "reference": "VII-HP-08715",
    "url": "https://ratsinformation.leipzig.de/allris_leipzig_public/vo020?VOLFDNR=2010987"
}, {
    "body": "Leipzig",
    "content": "<empty>",
    "name": "Sitzb\u00e4nke auf dem Platz vor dem PEP-Center in Gr\u00fcnau (SBB 0008/ 23/24)",
    "resolution": null,
    "originator": "SBB West",
    "paper_type": "\u00c4nderung zum HH-Planentwurf",
    "published_at": "2023-05-09",
    "reference": "VII-HP-08717",
    "url": "https://ratsinformation.leipzig.de/allris_leipzig_public/vo020?VOLFDNR=2010989"
}, {
    "body": "Leipzig",
    "content": "<empty>",
    "name": "Ert\u00fcchtigung des Ger\u00e4tehauses Feuerwache B\u00f6hlitz-Ehrenberg zur Nutzung und Verwendung einer Netzersatzanlage (OR 0053/ 23)",
    "resolution": null,
    "originator": "OR B\u00f6hlitz-Ehrenberg",
    "paper_type": "\u00c4nderung zum HH-Planentwurf",
    "published_at": "2023-05-09",
    "reference": "VII-HP-08718",
    "url": "https://ratsinformation.leipzig.de/allris_leipzig_public/vo020?VOLFDNR=2010990"
}, {
    "body": "Leipzig",
    "content": "<empty>",
    "name": "Trimm-Dich-Pfad im Leipziger S\u00fcdosten (SBB 0020/ 23/24)",
    "resolution": null,
    "originator": "SBB S\u00fcdost",
    "paper_type": "\u00c4nderung zum HH-Planentwurf",
    "published_at": "2023-05-09",
    "reference": "VII-HP-08722",
    "url": "https://ratsinformation.leipzig.de/allris_leipzig_public/vo020?VOLFDNR=2010994"
}, {
    "body": "Leipzig",
    "content": "<empty>",
    "name": "F\u00f6rderprogramm f\u00fcr Ma\u00dfnahmen zur Entsiegelung und Begr\u00fcnung; Begr\u00fcnung von Innenh\u00f6fen (Neufassung zu den Antr\u00e4gen A 0055/24 und A 0164/23/24) (A 0055/ 24-01-NF)",
    "resolution": null,
    "originator": "Fraktion B\u00fcndnis 90/Die Gr\u00fcnen; SPD-Fraktion",
    "paper_type": "\u00c4nderung zum HH-Planentwurf",
    "published_at": "2023-05-09",
    "reference": "VII-HP-08723",
    "url": "https://ratsinformation.leipzig.de/allris_leipzig_public/vo020?VOLFDNR=2010995"
}, {
    "body": "Leipzig",
    "content": "<empty>",
    "name": "Geh\u00f6lz- und Bl\u00fchstreifen  (OR 0050/ 23/24)",
    "resolution": null,
    "originator": "OR M\u00f6lkau",
    "paper_type": "\u00c4nderung zum HH-Planentwurf",
    "published_at": "2023-05-09",
    "reference": "VII-HP-08721",
    "url": "https://ratsinformation.leipzig.de/allris_leipzig_public/vo020?VOLFDNR=2010993"
}, {
    "body": "Leipzig",
    "content": "<empty>",
    "name": "Umsetzung der Denkmalpflegerischen Zielstellung im Gutspark M\u00f6lkau (OR 0038/ 23/24)",
    "resolution": null,
    "originator": "OR M\u00f6lkau",
    "paper_type": "\u00c4nderung zum HH-Planentwurf",
    "published_at": "2023-05-09",
    "reference": "VII-HP-08720",
    "url": "https://ratsinformation.leipzig.de/allris_leipzig_public/vo020?VOLFDNR=2010992"
}, {
    "body": "Leipzig",
    "content": "<empty>",
    "name": "Fu\u00df-und Radweg Hohenheida nach Krostitz (OR 0008/ 23/24)",
    "resolution": null,
    "originator": "OR Seehausen",
    "paper_type": "\u00c4nderung zum HH-Planentwurf",
    "published_at": "2023-05-09",
    "reference": "VII-HP-08725",
    "url": "https://ratsinformation.leipzig.de/allris_leipzig_public/vo020?VOLFDNR=2010997"
}, {
    "body": "Leipzig",
    "content": "<empty>",
    "name": "Bau eines Gehweges entlang B 181 vom \"Gr\u00fcnen Bogen\" bis zum Ochsenweg (OR 0011/ 23/24)",
    "resolution": null,
    "originator": "OR Burghausen",
    "paper_type": "\u00c4nderung zum HH-Planentwurf",
    "published_at": "2023-05-09",
    "reference": "VII-HP-08726",
    "url": "https://ratsinformation.leipzig.de/allris_leipzig_public/vo020?VOLFDNR=2010998"
}, {
    "body": "Leipzig",
    "content": "<empty>",
    "name": "Neugestaltung des namenlosen Platzes vor dem PEP-Center in Gr\u00fcnau (SBB 0009/ 23/24)",
    "resolution": null,
    "originator": "SBB West",
    "paper_type": "\u00c4nderung zum HH-Planentwurf",
    "published_at": "2023-05-09",
    "reference": "VII-HP-08719",
    "url": "https://ratsinformation.leipzig.de/allris_leipzig_public/vo020?VOLFDNR=2010991"
}, {
    "body": "Leipzig",
    "content": "<empty>",
    "name": "Wiederinstandsetzung Streetballanlage Bielagarten (OR 0055/ 23)",
    "resolution": null,
    "originator": "OR B\u00f6hlitz-Ehrenberg",
    "paper_type": "\u00c4nderung zum HH-Planentwurf",
    "published_at": "2023-05-09",
    "reference": "VII-HP-08724",
    "url": "https://ratsinformation.leipzig.de/allris_leipzig_public/vo020?VOLFDNR=2010996"
}, {
    "body": "Leipzig",
    "content": "<empty>",
    "name": "Mittelerh\u00f6hung f\u00fcr Gehwegsanierungsprogramm (A 0116/ 23/24)",
    "resolution": null,
    "originator": "Fraktion DIE LINKE; Fraktion B\u00fcndnis 90/Die Gr\u00fcnen; SPD-Fraktion",
    "paper_type": "\u00c4nderung zum HH-Planentwurf",
    "published_at": "2023-05-09",
    "reference": "VII-HP-08731",
    "url": "https://ratsinformation.leipzig.de/allris_leipzig_public/vo020?VOLFDNR=2011003"
}, {
    "body": "Leipzig",
    "content": "<empty>",
    "name": "Vervollst\u00e4ndigung und Ausbau Schulweg (OR 0033/ 23)",
    "resolution": null,
    "originator": "OR M\u00f6lkau",
    "paper_type": "\u00c4nderung zum HH-Planentwurf",
    "published_at": "2023-05-09",
    "reference": "VII-HP-08727",
    "url": "https://ratsinformation.leipzig.de/allris_leipzig_public/vo020?VOLFDNR=2010999"
}, {
    "body": "Leipzig",
    "content": "<empty>",
    "name": "Verbesserung der Verkehrsf\u00fchrung am Knotenpunkt St\u00f6tteritzer Landstra\u00dfe/M\u00f6lkauer Stra\u00dfe (OR 0014/ 23/24)",
    "resolution": null,
    "originator": "OR Holzhausen",
    "paper_type": "\u00c4nderung zum HH-Planentwurf",
    "published_at": "2023-05-09",
    "reference": "VII-HP-08734",
    "url": "https://ratsinformation.leipzig.de/allris_leipzig_public/vo020?VOLFDNR=2011006"
}, {
    "body": "Leipzig",
    "content": "<empty>",
    "name": "Bau eines Weges zwischen Buchenweg und Sporthalle/Schulen als Schulweg (OR 0045/ 23/24)",
    "resolution": null,
    "originator": "OR M\u00f6lkau",
    "paper_type": "\u00c4nderung zum HH-Planentwurf",
    "published_at": "2023-05-09",
    "reference": "VII-HP-08728",
    "url": "https://ratsinformation.leipzig.de/allris_leipzig_public/vo020?VOLFDNR=2011000"
}, {
    "body": "Leipzig",
    "content": "<empty>",
    "name": "Bedarfsampel Sommerfelder Stra\u00dfe - H\u00f6he K\u00e4rrnerweg (SBB 0005/ 23/24)",
    "resolution": null,
    "originator": "SBB S\u00fcdost",
    "paper_type": "\u00c4nderung zum HH-Planentwurf",
    "published_at": "2023-05-09",
    "reference": "VII-HP-08733",
    "url": "https://ratsinformation.leipzig.de/allris_leipzig_public/vo020?VOLFDNR=2011005"
}, {
    "body": "Leipzig",
    "content": "<empty>",
    "name": "Schaffung zus\u00e4tzlicher Planstellen f\u00fcr das Sachgebiet Wasserwirtschaft (ASG) (SBB 0012/ 23/24)",
    "resolution": null,
    "originator": "SBB West",
    "paper_type": "\u00c4nderung zum HH-Planentwurf",
    "published_at": "2023-05-09",
    "reference": "VII-HP-08729",
    "url": "https://ratsinformation.leipzig.de/allris_leipzig_public/vo020?VOLFDNR=2011001"
}, {
    "body": "Leipzig",
    "content": "<empty>",
    "name": "Erh\u00f6hung der Mittel f\u00fcr Fu\u00dfg\u00e4nger\u00fcberwege/Querungshilfen (A 0131/ 23/24)",
    "resolution": null,
    "originator": "SR F. Riekewald; SR. A. Feichtinger; SR Kristina Weyh",
    "paper_type": "\u00c4nderung zum HH-Planentwurf",
    "published_at": "2023-05-09",
    "reference": "VII-HP-08732",
    "url": "https://ratsinformation.leipzig.de/allris_leipzig_public/vo020?VOLFDNR=2011004"
}, {
    "body": "Leipzig",
    "content": "<empty>",
    "name": "Fu\u00df- und Radwegverbindung inkl. Br\u00fccke \u00fcber die \u00f6stliche Rietzschke (OR 0046/ 23/24)",
    "resolution": null,
    "originator": "OR M\u00f6lkau",
    "paper_type": "\u00c4nderung zum HH-Planentwurf",
    "published_at": "2023-05-09",
    "reference": "VII-HP-08730",
    "url": "https://ratsinformation.leipzig.de/allris_leipzig_public/vo020?VOLFDNR=2011002"
}, {
    "body": "Leipzig",
    "content": "<empty>",
    "name": "Mittel f\u00fcr Mobilit\u00e4tspunkte (A 0178/ 23/24)",
    "resolution": null,
    "originator": "SPD-Fraktion",
    "paper_type": "\u00c4nderung zum HH-Planentwurf",
    "published_at": "2023-05-09",
    "reference": "VII-HP-08736",
    "url": "https://ratsinformation.leipzig.de/allris_leipzig_public/vo020?VOLFDNR=2011008"
}, {
    "body": "Leipzig",
    "content": "<empty>",
    "name": "Ausbau Parkraumbewirtschaftung  (A 0180/ 23/24)",
    "resolution": null,
    "originator": "SPD-Fraktion",
    "paper_type": "\u00c4nderung zum HH-Planentwurf",
    "published_at": "2023-05-09",
    "reference": "VII-HP-08737",
    "url": "https://ratsinformation.leipzig.de/allris_leipzig_public/vo020?VOLFDNR=2011009"
}, {
    "body": "Leipzig",
    "content": "<empty>",
    "name": "Bewohnerparken in Leipzig ausweiten  (A 0125/ 23/24)",
    "resolution": null,
    "originator": "Fraktion B\u00fcndnis 90/Die Gr\u00fcnen; Fraktion Freibeuter",
    "paper_type": "\u00c4nderung zum HH-Planentwurf",
    "published_at": "2023-05-09",
    "reference": "VII-HP-08735",
    "url": "https://ratsinformation.leipzig.de/allris_leipzig_public/vo020?VOLFDNR=2011007"
}, {
    "body": "Leipzig",
    "content": "<empty>",
    "name": "Asphaltierung der Holbeinstra\u00dfe als Hocheinbau zwischen Schnorrstra\u00dfe und Oeserstra\u00dfe  (A 0120/ 24)",
    "resolution": null,
    "originator": "SR M. Schmidt; SR M. Weber",
    "paper_type": "\u00c4nderung zum HH-Planentwurf",
    "published_at": "2023-05-09",
    "reference": "VII-HP-08738",
    "url": "https://ratsinformation.leipzig.de/allris_leipzig_public/vo020?VOLFDNR=2011010"
}, {
    "body": "Leipzig",
    "content": "<empty>",
    "name": "Sanierung und Modernisierung der Arthur-Polenz-Stra\u00dfe (OR 0012/ 23/24)",
    "resolution": null,
    "originator": "OR Holzhausen",
    "paper_type": "\u00c4nderung zum HH-Planentwurf",
    "published_at": "2023-05-09",
    "reference": "VII-HP-08742",
    "url": "https://ratsinformation.leipzig.de/allris_leipzig_public/vo020?VOLFDNR=2011014"
}, {
    "body": "Leipzig",
    "content": "<empty>",
    "name": "Ausbau Stra\u00dfe \"Am Eulengraben\" ohne Erschlie\u00dfungsbeitr\u00e4ge (OR 0020/ 23/24)",
    "resolution": null,
    "originator": "OR Liebertwolkwitz",
    "paper_type": "\u00c4nderung zum HH-Planentwurf",
    "published_at": "2023-05-09",
    "reference": "VII-HP-08743",
    "url": "https://ratsinformation.leipzig.de/allris_leipzig_public/vo020?VOLFDNR=2011015"
}, {
    "body": "Leipzig",
    "content": "<empty>",
    "name": "Freie Fahrt f\u00fcr Rad  (A 0128/ 24)",
    "resolution": null,
    "originator": "Fraktion B\u00fcndnis 90/Die Gr\u00fcnen; SPD-Fraktion",
    "paper_type": "\u00c4nderung zum HH-Planentwurf",
    "published_at": "2023-05-09",
    "reference": "VII-HP-08739",
    "url": "https://ratsinformation.leipzig.de/allris_leipzig_public/vo020?VOLFDNR=2011011"
}, {
    "body": "Leipzig",
    "content": "<empty>",
    "name": "Erh\u00f6hung Planansatz des Gemeindeanteils an der Umsatzsteuer HH-Jahre 2023/ 2024 (A 0105/ 23/24)",
    "resolution": null,
    "originator": "Fraktion DIE LINKE",
    "paper_type": "\u00c4nderung zum HH-Planentwurf",
    "published_at": "2023-05-09",
    "reference": "VII-HP-08745",
    "url": "https://ratsinformation.leipzig.de/allris_leipzig_public/vo020?VOLFDNR=2011017"
}, {
    "body": "Leipzig",
    "content": "<empty>",
    "name": "Kompensation der Mehrkosten f\u00fcr die Tarifeinf\u00fchrung bei der LTM GmbH (A 0130/ 23/24)",
    "resolution": null,
    "originator": "SR M. K\u00fcng-Vildebrand",
    "paper_type": "\u00c4nderung zum HH-Planentwurf",
    "published_at": "2023-05-09",
    "reference": "VII-HP-08744",
    "url": "https://ratsinformation.leipzig.de/allris_leipzig_public/vo020?VOLFDNR=2011016"
}, {
    "body": "Leipzig",
    "content": "<empty>",
    "name": "Erh\u00f6hung der Stellen in der Ausl\u00e4nderbeh\u00f6rde (A 0007/ 23/24)",
    "resolution": null,
    "originator": "Fraktion Freibeuter",
    "paper_type": "\u00c4nderung zum HH-Planentwurf",
    "published_at": "2023-05-09",
    "reference": "VII-HP-08740",
    "url": "https://ratsinformation.leipzig.de/allris_leipzig_public/vo020?VOLFDNR=2011012"
}, {
    "body": "Leipzig",
    "content": "<empty>",
    "name": "Mittelbereitstellung f\u00fcr die Stra\u00dfeninstandsetzung Gundorfer Str. (OR 0005/ 23/24)",
    "resolution": null,
    "originator": "OR Burghausen",
    "paper_type": "\u00c4nderung zum HH-Planentwurf",
    "published_at": "2023-05-09",
    "reference": "VII-HP-08741",
    "url": "https://ratsinformation.leipzig.de/allris_leipzig_public/vo020?VOLFDNR=2011013"
}, {
    "body": "Leipzig",
    "content": "<empty>",
    "name": "Erh\u00f6hung der Ertr\u00e4ge aus dem Gemeindeanteil Einkommensteuer  (A 0193/ 23/24)",
    "resolution": null,
    "originator": "SPD-Fraktion",
    "paper_type": "\u00c4nderung zum HH-Planentwurf",
    "published_at": "2023-05-09",
    "reference": "VII-HP-08746",
    "url": "https://ratsinformation.leipzig.de/allris_leipzig_public/vo020?VOLFDNR=2011018"
}, {
    "body": "Leipzig",
    "content": "<empty>",
    "name": "Herstellung eines barrierefreien Zuganges zum ehemaligen Gemeindeamt Burghausen   (OR 0001/ 23/24)",
    "resolution": null,
    "originator": "OR Burghausen",
    "paper_type": "\u00c4nderung zum HH-Planentwurf",
    "published_at": "2023-05-09",
    "reference": "VII-HP-08753",
    "url": "https://ratsinformation.leipzig.de/allris_leipzig_public/vo020?VOLFDNR=2011025"
}, {
    "body": "Leipzig",
    "content": "<empty>",
    "name": "Erh\u00f6hung der Ertr\u00e4ge aus dem Gemeindeanteil Umsatzsteuer  (A 0192/ 23/24)",
    "resolution": null,
    "originator": "SPD-Fraktion",
    "paper_type": "\u00c4nderung zum HH-Planentwurf",
    "published_at": "2023-05-09",
    "reference": "VII-HP-08747",
    "url": "https://ratsinformation.leipzig.de/allris_leipzig_public/vo020?VOLFDNR=2011019"
}, {
    "body": "Leipzig",
    "content": "<empty>",
    "name": "\"B\u00fcndnis f\u00fcr bezahlbares Wohnen\" f\u00f6rdern - Einrichtung Stellenpool (A 0016/ 23/24)",
    "resolution": null,
    "originator": "Fraktion B\u00fcndnis 90/Die Gr\u00fcnen",
    "paper_type": "\u00c4nderung zum HH-Planentwurf",
    "published_at": "2023-05-09",
    "reference": "VII-HP-08752",
    "url": "https://ratsinformation.leipzig.de/allris_leipzig_public/vo020?VOLFDNR=2011024"
}, {
    "body": "Leipzig",
    "content": "<empty>",
    "name": "Sicherung digitaler p\u00e4dagogischer Musikschulangebote - Teil I  (A 0027/ 23/24)",
    "resolution": null,
    "originator": "Fraktion B\u00fcndnis 90/Die Gr\u00fcnen",
    "paper_type": "\u00c4nderung zum HH-Planentwurf",
    "published_at": "2023-05-09",
    "reference": "VII-HP-08750",
    "url": "https://ratsinformation.leipzig.de/allris_leipzig_public/vo020?VOLFDNR=2011022"
}, {
    "body": "Leipzig",
    "content": "<empty>",
    "name": "Au\u00dfenbeleuchtung des Schulhofes Geschwister-Scholl-Schule (OR 0022/ 23/24)",
    "resolution": null,
    "originator": "OR Liebertwolkwitz",
    "paper_type": "\u00c4nderung zum HH-Planentwurf",
    "published_at": "2023-05-09",
    "reference": "VII-HP-08754",
    "url": "https://ratsinformation.leipzig.de/allris_leipzig_public/vo020?VOLFDNR=2011026"
}, {
    "body": "Leipzig",
    "content": "<empty>",
    "name": "Vorbereitung Jubil\u00e4umsfeier 700 Jahre M\u00f6lkau anno 2024 (OR 0047/ 23/24)",
    "resolution": null,
    "originator": "OR M\u00f6lkau",
    "paper_type": "\u00c4nderung zum HH-Planentwurf",
    "published_at": "2023-05-09",
    "reference": "VII-HP-08749",
    "url": "https://ratsinformation.leipzig.de/allris_leipzig_public/vo020?VOLFDNR=2011021"
}, {
    "body": "Leipzig",
    "content": "<empty>",
    "name": "F\u00f6rdermittel Balkonsolarger\u00e4te  (A 0049/ 23/24)",
    "resolution": null,
    "originator": "Fraktion B\u00fcndnis 90/Die Gr\u00fcnen",
    "paper_type": "\u00c4nderung zum HH-Planentwurf",
    "published_at": "2023-05-09",
    "reference": "VII-HP-08748",
    "url": "https://ratsinformation.leipzig.de/allris_leipzig_public/vo020?VOLFDNR=2011020"
}, {
    "body": "Leipzig",
    "content": "<empty>",
    "name": "Institutionelle F\u00f6rderung der soziokulturellen Arbeit des Urban Souls e.V. (SBB 0011/ 23/24)",
    "resolution": null,
    "originator": "SBB West",
    "paper_type": "\u00c4nderung zum HH-Planentwurf",
    "published_at": "2023-05-09",
    "reference": "VII-HP-08751",
    "url": "https://ratsinformation.leipzig.de/allris_leipzig_public/vo020?VOLFDNR=2011023"
}, {
    "body": "Leipzig",
    "content": "<empty>",
    "name": "Entfernung des Schilfes und Einfassung des Teiches in Seehausen  (OR 0006/ 23/24)",
    "resolution": null,
    "originator": "OR Seehausen",
    "paper_type": "\u00c4nderung zum HH-Planentwurf",
    "published_at": "2023-05-09",
    "reference": "VII-HP-08757",
    "url": "https://ratsinformation.leipzig.de/allris_leipzig_public/vo020?VOLFDNR=2011029"
}, {
    "body": "Leipzig",
    "content": "<empty>",
    "name": "Anschluss Festplatzes Holzhausen an die Trink- und Abwasserversorgung (OR 0013/ 23/24)",
    "resolution": null,
    "originator": "OR Holzhausen",
    "paper_type": "\u00c4nderung zum HH-Planentwurf",
    "published_at": "2023-05-09",
    "reference": "VII-HP-08756",
    "url": "https://ratsinformation.leipzig.de/allris_leipzig_public/vo020?VOLFDNR=2011028"
}, {
    "body": "Leipzig",
    "content": "<empty>",
    "name": "Konzeption und Gestaltung der Festwiese f\u00fcr k\u00fcnftige kulturelle und gesellschaftliche Veranstaltungen (OR 0028/ 23/24)",
    "resolution": null,
    "originator": "OR M\u00f6lkau",
    "paper_type": "\u00c4nderung zum HH-Planentwurf",
    "published_at": "2023-05-09",
    "reference": "VII-HP-08758",
    "url": "https://ratsinformation.leipzig.de/allris_leipzig_public/vo020?VOLFDNR=2011030"
}, {
    "body": "Leipzig",
    "content": "<empty>",
    "name": "Abriss Anbau Westseite der Oberschule Liebertwolkwitz (OR 0023/ 23/24)",
    "resolution": null,
    "originator": "OR Liebertwolkwitz",
    "paper_type": "\u00c4nderung zum HH-Planentwurf",
    "published_at": "2023-05-09",
    "reference": "VII-HP-08755",
    "url": "https://ratsinformation.leipzig.de/allris_leipzig_public/vo020?VOLFDNR=2011027"
}, {
    "body": "Leipzig",
    "content": "<empty>",
    "name": "Zus\u00e4tzliche Personalstelle f\u00fcr das Referat zur Gleichstellung von Frau und Mann  (A 0021/ 23/24)",
    "resolution": null,
    "originator": "Fraktion B\u00fcndnis 90/Die Gr\u00fcnen",
    "paper_type": "\u00c4nderung zum HH-Planentwurf",
    "published_at": "2023-05-09",
    "reference": "VII-HP-08763",
    "url": "https://ratsinformation.leipzig.de/allris_leipzig_public/vo020?VOLFDNR=2011035"
}, {
    "body": "Leipzig",
    "content": "<empty>",
    "name": "Erhaltung von Grabmalen auf st\u00e4dtischen Friedh\u00f6fen (A 0070/ 23/24)",
    "resolution": null,
    "originator": "Fraktion AfD",
    "paper_type": "\u00c4nderung zum HH-Planentwurf",
    "published_at": "2023-05-09",
    "reference": "VII-HP-08761",
    "url": "https://ratsinformation.leipzig.de/allris_leipzig_public/vo020?VOLFDNR=2011033"
}, {
    "body": "Leipzig",
    "content": "<empty>",
    "name": "Unterhaltung Wege in Parkanlagen (A 0183/ 23/24)",
    "resolution": null,
    "originator": "SPD-Fraktion",
    "paper_type": "\u00c4nderung zum HH-Planentwurf",
    "published_at": "2023-05-09",
    "reference": "VII-HP-08762",
    "url": "https://ratsinformation.leipzig.de/allris_leipzig_public/vo020?VOLFDNR=2011034"
}, {
    "body": "Leipzig",
    "content": "<empty>",
    "name": "Beschleunigung der Umstellung der Stadtbeleuchtung auf LED (A 0160/ 23/24)",
    "resolution": null,
    "originator": "SR M. Weber; SR O. Gebhardt; SR S. Pellmann; SR F. Riekewald",
    "paper_type": "\u00c4nderung zum HH-Planentwurf",
    "published_at": "2023-05-09",
    "reference": "VII-HP-08766",
    "url": "https://ratsinformation.leipzig.de/allris_leipzig_public/vo020?VOLFDNR=2011038"
}, {
    "body": "Leipzig",
    "content": "<empty>",
    "name": "Verwilderte Parzellen an der Engelsdorfer Stra\u00dfe um den Bergfriedhof in einen \u00f6ffentlichen Erholungs- und Gr\u00fcnbereich umgestalten (OR 0029/ 23/24)",
    "resolution": null,
    "originator": "OR M\u00f6lkau",
    "paper_type": "\u00c4nderung zum HH-Planentwurf",
    "published_at": "2023-05-09",
    "reference": "VII-HP-08759",
    "url": "https://ratsinformation.leipzig.de/allris_leipzig_public/vo020?VOLFDNR=2011031"
}, {
    "body": "Leipzig",
    "content": "<empty>",
    "name": "Spielplatzsituation in Volkmarsdorf und Neustadt-Neusch\u00f6nefeld verbessern (A 0132/ 23/24)",
    "resolution": null,
    "originator": "SR St. Wehmann",
    "paper_type": "\u00c4nderung zum HH-Planentwurf",
    "published_at": "2023-05-09",
    "reference": "VII-HP-08765",
    "url": "https://ratsinformation.leipzig.de/allris_leipzig_public/vo020?VOLFDNR=2011037"
}, {
    "body": "Leipzig",
    "content": "<empty>",
    "name": "Anlegen von regul\u00e4ren Bl\u00fchwiesen (OR 0049/ 23/24)",
    "resolution": null,
    "originator": "OR M\u00f6lkau",
    "paper_type": "\u00c4nderung zum HH-Planentwurf",
    "published_at": "2023-05-09",
    "reference": "VII-HP-08760",
    "url": "https://ratsinformation.leipzig.de/allris_leipzig_public/vo020?VOLFDNR=2011032"
}, {
    "body": "Leipzig",
    "content": "<empty>",
    "name": "Vorbereitung eines Sport- und Spielparks  (OR 0037/ 23/24)",
    "resolution": null,
    "originator": "OR M\u00f6lkau",
    "paper_type": "\u00c4nderung zum HH-Planentwurf",
    "published_at": "2023-05-09",
    "reference": "VII-HP-08764",
    "url": "https://ratsinformation.leipzig.de/allris_leipzig_public/vo020?VOLFDNR=2011036"
}, {
    "body": "Leipzig",
    "content": "<empty>",
    "name": "Verbesserung \u00d6PNV-Anbindung der Ortsteile G\u00f6bschelwitz, Hohenheida und Gottscheina (OR 0009/ 23/24)",
    "resolution": null,
    "originator": "OR Seehausen",
    "paper_type": "\u00c4nderung zum HH-Planentwurf",
    "published_at": "2023-05-09",
    "reference": "VII-HP-08767",
    "url": "https://ratsinformation.leipzig.de/allris_leipzig_public/vo020?VOLFDNR=2011039"
}, {
    "body": "Leipzig",
    "content": "<empty>",
    "name": "Herstellen von Schulwegsicherheit Kreuzung Schul/ Zweinaundorfer Stra\u00dfe (OR 0044/ 23/24)",
    "resolution": null,
    "originator": "OR M\u00f6lkau",
    "paper_type": "\u00c4nderung zum HH-Planentwurf",
    "published_at": "2023-05-09",
    "reference": "VII-HP-08768",
    "url": "https://ratsinformation.leipzig.de/allris_leipzig_public/vo020?VOLFDNR=2011040"
}, {
    "body": "Leipzig",
    "content": "<empty>",
    "name": "Deckensanierung Landsberger Stra\u00dfe  (A 0082/ 23)",
    "resolution": null,
    "originator": "Fraktion AfD",
    "paper_type": "\u00c4nderung zum HH-Planentwurf",
    "published_at": "2023-05-09",
    "reference": "VII-HP-08769",
    "url": "https://ratsinformation.leipzig.de/allris_leipzig_public/vo020?VOLFDNR=2011041"
}, {
    "body": "Leipzig",
    "content": "<empty>",
    "name": "Ukraine-Teilbudget \"Finanzielle F\u00f6rderung der Aktivit\u00e4ten zivilgesellschaftlicher Akteure\" (A 0019/ 23/24)",
    "resolution": null,
    "originator": "Fraktion B\u00fcndnis 90/Die Gr\u00fcnen",
    "paper_type": "\u00c4nderung zum HH-Planentwurf",
    "published_at": "2023-05-09",
    "reference": "VII-HP-08771",
    "url": "https://ratsinformation.leipzig.de/allris_leipzig_public/vo020?VOLFDNR=2011043"
}, {
    "body": "Leipzig",
    "content": "<empty>",
    "name": "F\u00f6rderung CABL e.V.  (A 0190/ 23/24)",
    "resolution": null,
    "originator": "SPD-Fraktion",
    "paper_type": "\u00c4nderung zum HH-Planentwurf",
    "published_at": "2023-05-09",
    "reference": "VII-HP-08772",
    "url": "https://ratsinformation.leipzig.de/allris_leipzig_public/vo020?VOLFDNR=2011044"
}, {
    "body": "Leipzig",
    "content": "<empty>",
    "name": "Sonderdynamisierung F\u00f6rderung Vereine/Verb\u00e4nde Kinder- und Jugendf\u00f6rderung (A 0198/ 23/24)",
    "resolution": null,
    "originator": "SPD-Fraktion",
    "paper_type": "\u00c4nderung zum HH-Planentwurf",
    "published_at": "2023-05-09",
    "reference": "VII-HP-08770",
    "url": "https://ratsinformation.leipzig.de/allris_leipzig_public/vo020?VOLFDNR=2011042"
}, {
    "body": "Leipzig",
    "content": "<empty>",
    "name": "F\u00f6rderung der mehrsprachigen Betreuungsaufgaben in st\u00e4dtischen Kulturprojekten mit gefl\u00fcchteten Menschen (A 0029/ 23/24)",
    "resolution": null,
    "originator": "Fraktion B\u00fcndnis 90/Die Gr\u00fcnen",
    "paper_type": "\u00c4nderung zum HH-Planentwurf",
    "published_at": "2023-05-09",
    "reference": "VII-HP-08774",
    "url": "https://ratsinformation.leipzig.de/allris_leipzig_public/vo020?VOLFDNR=2011046"
}, {
    "body": "Leipzig",
    "content": "<empty>",
    "name": "Wasserbauhof  (A 0167/ 23/24)",
    "resolution": null,
    "originator": "SPD-Fraktion",
    "paper_type": "\u00c4nderung zum HH-Planentwurf",
    "published_at": "2023-05-09",
    "reference": "VII-HP-08773",
    "url": "https://ratsinformation.leipzig.de/allris_leipzig_public/vo020?VOLFDNR=2011045"
}, {
    "body": "Leipzig",
    "content": "<empty>",
    "name": "Forstbauhof  (A 0168/ 23/24)",
    "resolution": null,
    "originator": "SPD-Fraktion",
    "paper_type": "\u00c4nderung zum HH-Planentwurf",
    "published_at": "2023-05-09",
    "reference": "VII-HP-08776",
    "url": "https://ratsinformation.leipzig.de/allris_leipzig_public/vo020?VOLFDNR=2011048"
}, {
    "body": "Leipzig",
    "content": "<empty>",
    "name": "Weiterentwicklung und Pflege der Leipzig-App  (A 0181/ 24)",
    "resolution": null,
    "originator": "SPD-Fraktion",
    "paper_type": "\u00c4nderung zum HH-Planentwurf",
    "published_at": "2023-05-09",
    "reference": "VII-HP-08778",
    "url": "https://ratsinformation.leipzig.de/allris_leipzig_public/vo020?VOLFDNR=2011050"
}, {
    "body": "Leipzig",
    "content": "<empty>",
    "name": "H\u00e4rtefallfonds und Risikovorsorge (Neufassung zu den Antr\u00e4gen A 0194/23/24 und A 0185/23/24) (A 0194/ 23-01-NF)",
    "resolution": null,
    "originator": "SPD-Fraktion",
    "paper_type": "\u00c4nderung zum HH-Planentwurf",
    "published_at": "2023-05-09",
    "reference": "VII-HP-08775",
    "url": "https://ratsinformation.leipzig.de/allris_leipzig_public/vo020?VOLFDNR=2011047"
}, {
    "body": "Leipzig",
    "content": "<empty>",
    "name": "Gewerbesteuer (A 0012/ 23/24)",
    "resolution": null,
    "originator": "Fraktion B\u00fcndnis 90/Die Gr\u00fcnen",
    "paper_type": "\u00c4nderung zum HH-Planentwurf",
    "published_at": "2023-05-09",
    "reference": "VII-HP-08777",
    "url": "https://ratsinformation.leipzig.de/allris_leipzig_public/vo020?VOLFDNR=2011049"
}, {
    "body": "Leipzig",
    "content": "<empty>",
    "name": "Die Sirenen zur Alarmierung der Feuerwehrmitglieder und der Zivilbev\u00f6lkerung werden wieder instandgesetzt (OR 0054/ 23)",
    "resolution": null,
    "originator": "OR B\u00f6hlitz-Ehrenberg",
    "paper_type": "\u00c4nderung zum HH-Planentwurf",
    "published_at": "2023-05-09",
    "reference": "VII-HP-08782",
    "url": "https://ratsinformation.leipzig.de/allris_leipzig_public/vo020?VOLFDNR=2011054"
}, {
    "body": "Leipzig",
    "content": "<empty>",
    "name": "CO2-Rechner f\u00fcr Kultureinrichtungen  (A 0025/ 23/24)",
    "resolution": null,
    "originator": "Fraktion B\u00fcndnis 90/Die Gr\u00fcnen",
    "paper_type": "\u00c4nderung zum HH-Planentwurf",
    "published_at": "2023-05-09",
    "reference": "VII-HP-08779",
    "url": "https://ratsinformation.leipzig.de/allris_leipzig_public/vo020?VOLFDNR=2011051"
}, {
    "body": "Leipzig",
    "content": "<empty>",
    "name": "Green Economy  (A 0047/ 23/24)",
    "resolution": null,
    "originator": "Fraktion B\u00fcndnis 90/Die Gr\u00fcnen",
    "paper_type": "\u00c4nderung zum HH-Planentwurf",
    "published_at": "2023-05-09",
    "reference": "VII-HP-08780",
    "url": "https://ratsinformation.leipzig.de/allris_leipzig_public/vo020?VOLFDNR=2011052"
}, {
    "body": "Leipzig",
    "content": "<empty>",
    "name": "Verpflichtungserm\u00e4chtigung f\u00fcr brandschutztechnische Ert\u00fcchtigung Werk 2 (A 0208/ 24)",
    "resolution": null,
    "originator": "SR Christopher Zenker; SRin Monika Lazar; SR Thomas Kumbernu\u00df",
    "paper_type": "\u00c4nderung zum HH-Planentwurf",
    "published_at": "2023-05-09",
    "reference": "VII-HP-08781",
    "url": "https://ratsinformation.leipzig.de/allris_leipzig_public/vo020?VOLFDNR=2011053"
}, {
    "body": "Leipzig",
    "content": "<empty>",
    "name": "Digitale Schulungen u.a. zu IT-Sicherheit und Datenschutz (A 0176/ 23/24-01)",
    "resolution": null,
    "originator": "SPD-Fraktion",
    "paper_type": "\u00c4nderung zum HH-Planentwurf",
    "published_at": "2023-05-09",
    "reference": "VII-HP-08786",
    "url": "https://ratsinformation.leipzig.de/allris_leipzig_public/vo020?VOLFDNR=2011058"
}, {
    "body": "Leipzig",
    "content": "<empty>",
    "name": "Stellenaufwuchs im Umweltinformationszentrum (A 0079/ 23/24)",
    "resolution": null,
    "originator": "Fraktion AfD",
    "paper_type": "\u00c4nderung zum HH-Planentwurf",
    "published_at": "2023-05-09",
    "reference": "VII-HP-08785",
    "url": "https://ratsinformation.leipzig.de/allris_leipzig_public/vo020?VOLFDNR=2011057"
}, {
    "body": "Leipzig",
    "content": "<empty>",
    "name": "Bessere Unterhaltung des Radwegenetzes  (A 0205/ 23/24)",
    "resolution": null,
    "originator": "SPD-Fraktion",
    "paper_type": "\u00c4nderung zum HH-Planentwurf",
    "published_at": "2023-05-09",
    "reference": "VII-HP-08783",
    "url": "https://ratsinformation.leipzig.de/allris_leipzig_public/vo020?VOLFDNR=2011055"
}, {
    "body": "Leipzig",
    "content": "<empty>",
    "name": "\"Coole Stra\u00dfen\" - mehr Lebensqualit\u00e4t in Leipzigs Stra\u00dfen - Stellen (A 0063/ 23/24)",
    "resolution": null,
    "originator": "Fraktion B\u00fcndnis 90/Die Gr\u00fcnen",
    "paper_type": "\u00c4nderung zum HH-Planentwurf",
    "published_at": "2023-05-09",
    "reference": "VII-HP-08784",
    "url": "https://ratsinformation.leipzig.de/allris_leipzig_public/vo020?VOLFDNR=2011056"
}, {
    "body": "Leipzig",
    "content": "<empty>",
    "name": "Drei Vollzeitstellen \"Wohnraum f\u00fcr Gefl\u00fcchtete aus der Ukraine\" einrichten (A 0137/ 23/24)",
    "resolution": null,
    "originator": "SR J. Nagel; SR B. Ehms; SR Th. Kumbernu\u00df; SR Dr. T. Peter; SR K. Krefft; SR A. Kaleri; SR S. Matzke",
    "paper_type": "\u00c4nderung zum HH-Planentwurf",
    "published_at": "2023-05-09",
    "reference": "VII-HP-08790",
    "url": "https://ratsinformation.leipzig.de/allris_leipzig_public/vo020?VOLFDNR=2011062"
}, {
    "body": "Leipzig",
    "content": "<empty>",
    "name": "Umsetzung Fachplan Leipziger Wohnungsnotfallhilfe (A 0018/ 23/24)",
    "resolution": null,
    "originator": "Fraktion B\u00fcndnis 90/Die Gr\u00fcnen",
    "paper_type": "\u00c4nderung zum HH-Planentwurf",
    "published_at": "2023-05-09",
    "reference": "VII-HP-08792",
    "url": "https://ratsinformation.leipzig.de/allris_leipzig_public/vo020?VOLFDNR=2011064"
}, {
    "body": "Leipzig",
    "content": "<empty>",
    "name": "Ukraine-Teilbudget - \"Humanit\u00e4re Hilfe vor Ort\" (A 0019/ 23/24-02-\u00c4A)",
    "resolution": null,
    "originator": "SPD-Fraktion",
    "paper_type": "\u00c4nderung zum HH-Planentwurf",
    "published_at": "2023-05-09",
    "reference": "VII-HP-08791",
    "url": "https://ratsinformation.leipzig.de/allris_leipzig_public/vo020?VOLFDNR=2011063"
}, {
    "body": "Leipzig",
    "content": "<empty>",
    "name": "Hauptvoraussetzung zur Umsetzung des Digitalpaktes  (OR 0021/ 23/24)",
    "resolution": null,
    "originator": "OR Liebertwolkwitz",
    "paper_type": "\u00c4nderung zum HH-Planentwurf",
    "published_at": "2023-05-09",
    "reference": "VII-HP-08787",
    "url": "https://ratsinformation.leipzig.de/allris_leipzig_public/vo020?VOLFDNR=2011059"
}, {
    "body": "Leipzig",
    "content": "<empty>",
    "name": "Barrierefreiheit OS Liebertwolkwitz (OR 0024/ 23/24)",
    "resolution": null,
    "originator": "OR Liebertwolkwitz",
    "paper_type": "\u00c4nderung zum HH-Planentwurf",
    "published_at": "2023-05-09",
    "reference": "VII-HP-08788",
    "url": "https://ratsinformation.leipzig.de/allris_leipzig_public/vo020?VOLFDNR=2011060"
}, {
    "body": "Leipzig",
    "content": "<empty>",
    "name": "Ankauf von Fl\u00e4chen f\u00fcr einen zuk\u00fcnftigen Sportpark in M\u00f6lkau (OR 0042/ 23/24)",
    "resolution": null,
    "originator": "OR M\u00f6lkau",
    "paper_type": "\u00c4nderung zum HH-Planentwurf",
    "published_at": "2023-05-09",
    "reference": "VII-HP-08794",
    "url": "https://ratsinformation.leipzig.de/allris_leipzig_public/vo020?VOLFDNR=2011066"
}, {
    "body": "Leipzig",
    "content": "<empty>",
    "name": "Aufl\u00f6sung Dialogforum LEJ  (A 0013/ 23/24)",
    "resolution": null,
    "originator": "Fraktion B\u00fcndnis 90/Die Gr\u00fcnen",
    "paper_type": "\u00c4nderung zum HH-Planentwurf",
    "published_at": "2023-05-09",
    "reference": "VII-HP-08789",
    "url": "https://ratsinformation.leipzig.de/allris_leipzig_public/vo020?VOLFDNR=2011061"
}, {
    "body": "Leipzig",
    "content": "<empty>",
    "name": "Sportfl\u00e4che in Knauthain-Knautkleeberg (SBB 0002/ 23/24)",
    "resolution": null,
    "originator": "SBB S\u00fcdwest",
    "paper_type": "\u00c4nderung zum HH-Planentwurf",
    "published_at": "2023-05-09",
    "reference": "VII-HP-08793",
    "url": "https://ratsinformation.leipzig.de/allris_leipzig_public/vo020?VOLFDNR=2011065"
}, {
    "body": "Leipzig",
    "content": "<empty>",
    "name": "Weitere Ma\u00dfnahmen f\u00fcr die Wasserzufuhr Kirchteich Seehausen (OR 0010/ 23/24)",
    "resolution": null,
    "originator": "OR Seehausen",
    "paper_type": "\u00c4nderung zum HH-Planentwurf",
    "published_at": "2023-05-09",
    "reference": "VII-HP-08797",
    "url": "https://ratsinformation.leipzig.de/allris_leipzig_public/vo020?VOLFDNR=2011069"
}, {
    "body": "Leipzig",
    "content": "<empty>",
    "name": "Erarbeitung einer Ortsgestaltungskonzeption f\u00fcr die Ortschaft M\u00f6lkau  (OR 0034/ 23)",
    "resolution": null,
    "originator": "OR M\u00f6lkau",
    "paper_type": "\u00c4nderung zum HH-Planentwurf",
    "published_at": "2023-05-09",
    "reference": "VII-HP-08795",
    "url": "https://ratsinformation.leipzig.de/allris_leipzig_public/vo020?VOLFDNR=2011067"
}, {
    "body": "Leipzig",
    "content": "<empty>",
    "name": "Einrichtung einer Gesch\u00e4ftsstelle \"Jugendfeuerwehr/Freiwillige Feuerwehren\" (A 0092/ 23/24)",
    "resolution": null,
    "originator": "Fraktion AfD",
    "paper_type": "\u00c4nderung zum HH-Planentwurf",
    "published_at": "2023-05-09",
    "reference": "VII-HP-08796",
    "url": "https://ratsinformation.leipzig.de/allris_leipzig_public/vo020?VOLFDNR=2011068"
}, {
    "body": "Leipzig",
    "content": "<empty>",
    "name": "Erh\u00f6hung der Sicherheit an Seen (A 0039/ 23/24)",
    "resolution": null,
    "originator": "Fraktion B\u00fcndnis 90/Die Gr\u00fcnen",
    "paper_type": "\u00c4nderung zum HH-Planentwurf",
    "published_at": "2023-05-09",
    "reference": "VII-HP-08798",
    "url": "https://ratsinformation.leipzig.de/allris_leipzig_public/vo020?VOLFDNR=2011070"
}, {
    "body": "Leipzig",
    "content": "<empty>",
    "name": "Errichtung eines Platzes der Generationen in Mockau (SBB 0018/ 23/24)",
    "resolution": null,
    "originator": "SBB Nordost",
    "paper_type": "\u00c4nderung zum HH-Planentwurf",
    "published_at": "2023-05-09",
    "reference": "VII-HP-08805",
    "url": "https://ratsinformation.leipzig.de/allris_leipzig_public/vo020?VOLFDNR=2011077"
}, {
    "body": "Leipzig",
    "content": "<empty>",
    "name": "Naturbad Nordost (Bagger) - Entwicklung und Sanierung f\u00fcr Thekla z\u00fcgig umsetzen  (A 0133/ 23/24)",
    "resolution": null,
    "originator": "SR St. Wehmann; SR Dr. T. Peter",
    "paper_type": "\u00c4nderung zum HH-Planentwurf",
    "published_at": "2023-05-09",
    "reference": "VII-HP-08799",
    "url": "https://ratsinformation.leipzig.de/allris_leipzig_public/vo020?VOLFDNR=2011071"
}, {
    "body": "Leipzig",
    "content": "<empty>",
    "name": "Ortsrand M\u00f6lkau Richtung S\u00fcden mit Alleeb\u00e4umen und Geh\u00f6lzstreifen bepflanzen (OR 0027/ 23/24)",
    "resolution": null,
    "originator": "OR M\u00f6lkau",
    "paper_type": "\u00c4nderung zum HH-Planentwurf",
    "published_at": "2023-05-09",
    "reference": "VII-HP-08802",
    "url": "https://ratsinformation.leipzig.de/allris_leipzig_public/vo020?VOLFDNR=2011074"
}, {
    "body": "Leipzig",
    "content": "<empty>",
    "name": "Gastronomisches und kulturelles Angebot im Mariannenpark st\u00e4rken (A 0134/ 23/24)",
    "resolution": null,
    "originator": "SR Dr. T. Peter; SR St. Wehmann",
    "paper_type": "\u00c4nderung zum HH-Planentwurf",
    "published_at": "2023-05-09",
    "reference": "VII-HP-08806",
    "url": "https://ratsinformation.leipzig.de/allris_leipzig_public/vo020?VOLFDNR=2011078"
}, {
    "body": "Leipzig",
    "content": "<empty>",
    "name": "Aufforstung entlang der Bachl\u00e4ufe Hoher Graben und \u00d6stliche Rietzschke (OR 0031/ 23)",
    "resolution": null,
    "originator": "OR M\u00f6lkau",
    "paper_type": "\u00c4nderung zum HH-Planentwurf",
    "published_at": "2023-05-09",
    "reference": "VII-HP-08803",
    "url": "https://ratsinformation.leipzig.de/allris_leipzig_public/vo020?VOLFDNR=2011075"
}, {
    "body": "Leipzig",
    "content": "<empty>",
    "name": "Sanierung des historischen Pavillons im Park \"T\u00e4schners Garten\"  (OR 0015/ 23/24)",
    "resolution": null,
    "originator": "OR Holzhausen",
    "paper_type": "\u00c4nderung zum HH-Planentwurf",
    "published_at": "2023-05-09",
    "reference": "VII-HP-08801",
    "url": "https://ratsinformation.leipzig.de/allris_leipzig_public/vo020?VOLFDNR=2011073"
}, {
    "body": "Leipzig",
    "content": "<empty>",
    "name": "Ber\u00e4umung und Wiederanlage, Wiederaufforstung des Feenwaldes (OR 0041/ 23/24)",
    "resolution": null,
    "originator": "OR M\u00f6lkau",
    "paper_type": "\u00c4nderung zum HH-Planentwurf",
    "published_at": "2023-05-09",
    "reference": "VII-HP-08804",
    "url": "https://ratsinformation.leipzig.de/allris_leipzig_public/vo020?VOLFDNR=2011076"
}, {
    "body": "Leipzig",
    "content": "<empty>",
    "name": "\u00d6ffentlichen Raum entlang der R\u00f6del aufwerten - FinHH (SBB 0001/ 24-01)",
    "resolution": null,
    "originator": "SBB S\u00fcdwest",
    "paper_type": "\u00c4nderung zum HH-Planentwurf",
    "published_at": "2023-05-09",
    "reference": "VII-HP-08800",
    "url": "https://ratsinformation.leipzig.de/allris_leipzig_public/vo020?VOLFDNR=2011072"
}, {
    "body": "Leipzig",
    "content": "<empty>",
    "name": "Schotterg\u00e4rten den Garaus machen - Gr\u00fcnsatzung kontrollieren (A 0056/ 24)",
    "resolution": null,
    "originator": "Fraktion B\u00fcndnis 90/Die Gr\u00fcnen",
    "paper_type": "\u00c4nderung zum HH-Planentwurf",
    "published_at": "2023-05-09",
    "reference": "VII-HP-08807",
    "url": "https://ratsinformation.leipzig.de/allris_leipzig_public/vo020?VOLFDNR=2011079"
}, {
    "body": "Leipzig",
    "content": "<empty>",
    "name": "Tischtennisplatten am Flo\u00dfplatz  (SBB 0023/ 23/24)",
    "resolution": null,
    "originator": "SBB Mitte",
    "paper_type": "\u00c4nderung zum HH-Planentwurf",
    "published_at": "2023-05-09",
    "reference": "VII-HP-08808",
    "url": "https://ratsinformation.leipzig.de/allris_leipzig_public/vo020?VOLFDNR=2011080"
}, {
    "body": "Leipzig",
    "content": "<empty>",
    "name": "Herstellung eines Stadtplatzes am denkmalgesch\u00fctzten Dorfanger Probstheida  (SBB 0004/ 23/24)",
    "resolution": null,
    "originator": "SBB S\u00fcdost",
    "paper_type": "\u00c4nderung zum HH-Planentwurf",
    "published_at": "2023-05-09",
    "reference": "VII-HP-08814",
    "url": "https://ratsinformation.leipzig.de/allris_leipzig_public/vo020?VOLFDNR=2011086"
}, {
    "body": "Leipzig",
    "content": "<empty>",
    "name": "Herstellen einer Wegeverbindung von der Karl-Friedrich-Stra\u00dfe um das ehemalige Kippengel\u00e4nde zur Stra\u00dfe An den Rietzschkewiesen (OR 0030/ 23/24)",
    "resolution": null,
    "originator": "OR M\u00f6lkau",
    "paper_type": "\u00c4nderung zum HH-Planentwurf",
    "published_at": "2023-05-09",
    "reference": "VII-HP-08810",
    "url": "https://ratsinformation.leipzig.de/allris_leipzig_public/vo020?VOLFDNR=2011082"
}, {
    "body": "Leipzig",
    "content": "<empty>",
    "name": "Asphalt-Pumptrack mit Halfpipe im Stadtbezirk Nord  (SBB 0025/ 23/24)",
    "resolution": null,
    "originator": "SBB Nord",
    "paper_type": "\u00c4nderung zum HH-Planentwurf",
    "published_at": "2023-05-09",
    "reference": "VII-HP-08809",
    "url": "https://ratsinformation.leipzig.de/allris_leipzig_public/vo020?VOLFDNR=2011081"
}, {
    "body": "Leipzig",
    "content": "<empty>",
    "name": "Schulwegsicherheit Goethe-Gymnasium (A 0069/ 24)",
    "resolution": null,
    "originator": "SR F. Dossin",
    "paper_type": "\u00c4nderung zum HH-Planentwurf",
    "published_at": "2023-05-09",
    "reference": "VII-HP-08813",
    "url": "https://ratsinformation.leipzig.de/allris_leipzig_public/vo020?VOLFDNR=2011085"
}, {
    "body": "Leipzig",
    "content": "<empty>",
    "name": "provisorischen Begehbarmachung des Weges entlang der Eisenbahntrasse/ an den Schwarzen Feldern (OR 0036/ 23)",
    "resolution": null,
    "originator": "OR M\u00f6lkau",
    "paper_type": "\u00c4nderung zum HH-Planentwurf",
    "published_at": "2023-05-09",
    "reference": "VII-HP-08811",
    "url": "https://ratsinformation.leipzig.de/allris_leipzig_public/vo020?VOLFDNR=2011083"
}, {
    "body": "Leipzig",
    "content": "<empty>",
    "name": "Fu\u00df- und Radwegverbindung \"Koppelweg\" (OR 0048/ 23/24)",
    "resolution": null,
    "originator": "OR M\u00f6lkau",
    "paper_type": "\u00c4nderung zum HH-Planentwurf",
    "published_at": "2023-05-09",
    "reference": "VII-HP-08812",
    "url": "https://ratsinformation.leipzig.de/allris_leipzig_public/vo020?VOLFDNR=2011084"
}, {
    "body": "Leipzig",
    "content": "<empty>",
    "name": "Weiterf\u00fchrung der Investitionsprojekte \"Kirschbergsiedlung und Siedlung Gr\u00fcnau\" (SBB 0010/ 23/24)",
    "resolution": null,
    "originator": "SBB West",
    "paper_type": "\u00c4nderung zum HH-Planentwurf",
    "published_at": "2023-05-09",
    "reference": "VII-HP-08815",
    "url": "https://ratsinformation.leipzig.de/allris_leipzig_public/vo020?VOLFDNR=2011087"
}, {
    "body": "Leipzig",
    "content": "<empty>",
    "name": "Anlegen von Parktaschen in der Sommerfelder Stra\u00dfe (OR 0043/ 23/24)",
    "resolution": null,
    "originator": "OR M\u00f6lkau",
    "paper_type": "\u00c4nderung zum HH-Planentwurf",
    "published_at": "2023-05-09",
    "reference": "VII-HP-08817",
    "url": "https://ratsinformation.leipzig.de/allris_leipzig_public/vo020?VOLFDNR=2011089"
}, {
    "body": "Leipzig",
    "content": "<empty>",
    "name": "Widmung, Wiederherstellung und Freigabe der Stra\u00dfe entlang des Stadtgutes (OR 0035/ 23)",
    "resolution": null,
    "originator": "OR M\u00f6lkau",
    "paper_type": "\u00c4nderung zum HH-Planentwurf",
    "published_at": "2023-05-09",
    "reference": "VII-HP-08816",
    "url": "https://ratsinformation.leipzig.de/allris_leipzig_public/vo020?VOLFDNR=2011088"
}, {
    "body": "Leipzig",
    "content": "<empty>",
    "name": "Mehr Personal f\u00fcr wirksamen Geh\u00f6lzschutz  (A 0058/ 23/24)",
    "resolution": null,
    "originator": "Fraktion B\u00fcndnis 90/Die Gr\u00fcnen",
    "paper_type": "\u00c4nderung zum HH-Planentwurf",
    "published_at": "2023-05-09",
    "reference": "VII-HP-08818",
    "url": "https://ratsinformation.leipzig.de/allris_leipzig_public/vo020?VOLFDNR=2011090"
}, {
    "body": "Leipzig",
    "content": "<empty>",
    "name": "Ma\u00dfnahmen f\u00fcr Klimawandelanpassung finanzieren (A 0044/ 24-01-NF)",
    "resolution": null,
    "originator": "Fraktion B\u00fcndnis 90/Die Gr\u00fcnen",
    "paper_type": "\u00c4nderung zum HH-Planentwurf",
    "published_at": "2023-05-09",
    "reference": "VII-HP-08822",
    "url": "https://ratsinformation.leipzig.de/allris_leipzig_public/vo020?VOLFDNR=2011094"
}, {
    "body": "Leipzig",
    "content": "<empty>",
    "name": "Gesch\u00e4ftsstellen des Senior*innen- und des Behindertenbeirats personell st\u00e4rken (A 0145/ 23/24-01-\u00c4A)",
    "resolution": null,
    "originator": "SPD-Fraktion",
    "paper_type": "\u00c4nderung zum HH-Planentwurf",
    "published_at": "2023-05-09",
    "reference": "VII-HP-08824",
    "url": "https://ratsinformation.leipzig.de/allris_leipzig_public/vo020?VOLFDNR=2011096"
}, {
    "body": "Leipzig",
    "content": "<empty>",
    "name": "Ma\u00dfnahmen f\u00fcr Klimawandelanpassung finanzieren (A 0044/ 24-02-\u00c4A)",
    "resolution": null,
    "originator": "SPD-Fraktion",
    "paper_type": "\u00c4nderung zum HH-Planentwurf",
    "published_at": "2023-05-09",
    "reference": "VII-HP-08823",
    "url": "https://ratsinformation.leipzig.de/allris_leipzig_public/vo020?VOLFDNR=2011095"
}, {
    "body": "Leipzig",
    "content": "<empty>",
    "name": "Instandsetzung der Fahrbahn und der Fu\u00dfwege der Karl-Friedrich-Stra\u00dfe (OR 0039/ 23/24)",
    "resolution": null,
    "originator": "OR M\u00f6lkau",
    "paper_type": "\u00c4nderung zum HH-Planentwurf",
    "published_at": "2023-05-09",
    "reference": "VII-HP-08820",
    "url": "https://ratsinformation.leipzig.de/allris_leipzig_public/vo020?VOLFDNR=2011092"
}, {
    "body": "Leipzig",
    "content": "<empty>",
    "name": "Instandsetzung der Fahrbahn der Gutberletstra\u00dfe (OR 0040/ 23/24)",
    "resolution": null,
    "originator": "OR M\u00f6lkau",
    "paper_type": "\u00c4nderung zum HH-Planentwurf",
    "published_at": "2023-05-09",
    "reference": "VII-HP-08821",
    "url": "https://ratsinformation.leipzig.de/allris_leipzig_public/vo020?VOLFDNR=2011093"
}, {
    "body": "Leipzig",
    "content": "<empty>",
    "name": "Sanierung der Zuwegung Ger\u00e4tehaus FF M\u00f6lkau (OR 0032/ 23/24)",
    "resolution": null,
    "originator": "OR M\u00f6lkau",
    "paper_type": "\u00c4nderung zum HH-Planentwurf",
    "published_at": "2023-05-09",
    "reference": "VII-HP-08819",
    "url": "https://ratsinformation.leipzig.de/allris_leipzig_public/vo020?VOLFDNR=2011091"
}, {
    "body": "Leipzig",
    "content": "<empty>",
    "name": "Schotterg\u00e4rten den Garaus machen - Gr\u00fcnsatzung kontrollieren (A 0056/ 23/24-01-\u00c4A)",
    "resolution": null,
    "originator": "SPD-Fraktion",
    "paper_type": "\u00c4nderung zum HH-Planentwurf",
    "published_at": "2023-05-09",
    "reference": "VII-HP-08825",
    "url": "https://ratsinformation.leipzig.de/allris_leipzig_public/vo020?VOLFDNR=2011097"
}, {
    "body": "Leipzig",
    "content": "<empty>",
    "name": "Mittel f\u00fcr Schola Cantorum aufstocken (A 0119/ 23/24-02-NF)",
    "resolution": null,
    "originator": "Stadtr\u00e4tinnen Stefanie Gruner; Anna Kaleri und Katharina Krefft",
    "paper_type": "\u00c4nderung zum HH-Planentwurf",
    "published_at": "2023-05-09",
    "reference": "VII-HP-08826",
    "url": "https://ratsinformation.leipzig.de/allris_leipzig_public/vo020?VOLFDNR=2011098"
}, {
    "body": "Leipzig",
    "content": "<empty>",
    "name": "Ausstattung von Jubil\u00e4en mit Partner*innenst\u00e4dten (A 0140/ 23/24-01-NF)",
    "resolution": null,
    "originator": "SR M. Gehrt; SR Th. Kumbernu\u00df; SR M. G\u00f6tze",
    "paper_type": "\u00c4nderung zum HH-Planentwurf",
    "published_at": "2023-05-09",
    "reference": "VII-HP-08828",
    "url": "https://ratsinformation.leipzig.de/allris_leipzig_public/vo020?VOLFDNR=2011100"
}, {
    "body": "Leipzig",
    "content": "<empty>",
    "name": "F\u00f6rderung SAIDA e.V. (A 0191/ 23/24-01-NF)",
    "resolution": null,
    "originator": "SPD-Fraktion",
    "paper_type": "\u00c4nderung zum HH-Planentwurf",
    "published_at": "2023-05-09",
    "reference": "VII-HP-08833",
    "url": "https://ratsinformation.leipzig.de/allris_leipzig_public/vo020?VOLFDNR=2011105"
}, {
    "body": "Leipzig",
    "content": "<empty>",
    "name": "Umsetzung Ma\u00dfnahmenkatalog zum Schutz von Wild- und Honigbienen  (A 0061/ 23/24)",
    "resolution": null,
    "originator": "Fraktion B\u00fcndnis 90/Die Gr\u00fcnen",
    "paper_type": "\u00c4nderung zum HH-Planentwurf",
    "published_at": "2023-05-09",
    "reference": "VII-HP-08829",
    "url": "https://ratsinformation.leipzig.de/allris_leipzig_public/vo020?VOLFDNR=2011101"
}, {
    "body": "Leipzig",
    "content": "<empty>",
    "name": "\"B\u00fcrger- und Akteursbeteiligung\" weiter verstetigen - Teil II - Sachmittel (A 0038/ 23/24-02-\u00c4A)",
    "resolution": null,
    "originator": "SPD-Fraktion",
    "paper_type": "\u00c4nderung zum HH-Planentwurf",
    "published_at": "2023-05-09",
    "reference": "VII-HP-08830",
    "url": "https://ratsinformation.leipzig.de/allris_leipzig_public/vo020?VOLFDNR=2011102"
}, {
    "body": "Leipzig",
    "content": "<empty>",
    "name": "Weitere St\u00e4rkung des Solidarischen Gesundheitszentrums Leipzig e. V. (A 0124/ 23/24-01-NF)",
    "resolution": null,
    "originator": "Fraktion Die Linke; Fraktion B\u00fcndnis 90/Die Gr\u00fcnen; SPD-Fraktion",
    "paper_type": "\u00c4nderung zum HH-Planentwurf",
    "published_at": "2023-05-09",
    "reference": "VII-HP-08831",
    "url": "https://ratsinformation.leipzig.de/allris_leipzig_public/vo020?VOLFDNR=2011103"
}, {
    "body": "Leipzig",
    "content": "<empty>",
    "name": "\"B\u00fcrger- und Akteursbeteiligung\" weiter verstetigen - Teil II - Sachmittel (A 0038/ 23/24-01-NF)",
    "resolution": null,
    "originator": "Fraktion B\u00fcndnis 90/Die Gr\u00fcnen",
    "paper_type": "\u00c4nderung zum HH-Planentwurf",
    "published_at": "2023-05-09",
    "reference": "VII-HP-08827",
    "url": "https://ratsinformation.leipzig.de/allris_leipzig_public/vo020?VOLFDNR=2011099"
}, {
    "body": "Leipzig",
    "content": "<empty>",
    "name": "CABL: Budget f\u00fcr Clearingstelle/ Anonymer Behandlungsschein (BP 3) (A 0146/ 23/24-03-\u00c4A)",
    "resolution": null,
    "originator": "SPD-Fraktion",
    "paper_type": "\u00c4nderung zum HH-Planentwurf",
    "published_at": "2023-05-09",
    "reference": "VII-HP-08834",
    "url": "https://ratsinformation.leipzig.de/allris_leipzig_public/vo020?VOLFDNR=2011106"
}, {
    "body": "Leipzig",
    "content": "<empty>",
    "name": "F\u00f6rderung Fachberatungsstelle f\u00fcr Sexarbeiterinnen (A 0196/ 24-01-NF)",
    "resolution": null,
    "originator": "SPD-Fraktion",
    "paper_type": "\u00c4nderung zum HH-Planentwurf",
    "published_at": "2023-05-09",
    "reference": "VII-HP-08832",
    "url": "https://ratsinformation.leipzig.de/allris_leipzig_public/vo020?VOLFDNR=2011104"
}, {
    "body": "Leipzig",
    "content": "<empty>",
    "name": "Beratung queerer Menschen nach sexualisierter Gewalt (A 0107/ 23/24-01-NF)",
    "resolution": null,
    "originator": "Fraktion DIE LINKE",
    "paper_type": "\u00c4nderung zum HH-Planentwurf",
    "published_at": "2023-05-09",
    "reference": "VII-HP-08835",
    "url": "https://ratsinformation.leipzig.de/allris_leipzig_public/vo020?VOLFDNR=2011107"
}, {
    "body": "Leipzig",
    "content": "<empty>",
    "name": "Leipziger Tafel in der Krise f\u00fcr Bed\u00fcrftige st\u00fctzen (A 0111/ 23/24-01-\u00c4A)",
    "resolution": null,
    "originator": "SPD-Fraktion",
    "paper_type": "\u00c4nderung zum HH-Planentwurf",
    "published_at": "2023-05-09",
    "reference": "VII-HP-08836",
    "url": "https://ratsinformation.leipzig.de/allris_leipzig_public/vo020?VOLFDNR=2011108"
}, {
    "body": "Leipzig",
    "content": "<empty>",
    "name": "Mittel f\u00fcr Baumpflanzungen (A 0165/ 23/24-01-NF)",
    "resolution": null,
    "originator": "SPD-Fraktion",
    "paper_type": "\u00c4nderung zum HH-Planentwurf",
    "published_at": "2023-05-09",
    "reference": "VII-HP-08838",
    "url": "https://ratsinformation.leipzig.de/allris_leipzig_public/vo020?VOLFDNR=2011110"
}, {
    "body": "Leipzig",
    "content": "<empty>",
    "name": "Leerstand mobilisieren f\u00fcr Wohnen, Kultur und gemeinwohlorientierte Nutzungen (A 0015/ 24-01-NF)",
    "resolution": null,
    "originator": "Fraktion B\u00fcndnis 90/Die Gr\u00fcnen",
    "paper_type": "\u00c4nderung zum HH-Planentwurf",
    "published_at": "2023-05-09",
    "reference": "VII-HP-08837",
    "url": "https://ratsinformation.leipzig.de/allris_leipzig_public/vo020?VOLFDNR=2011109"
}, {
    "body": "Leipzig",
    "content": "<empty>",
    "name": "Erh\u00f6hung der Mittel f\u00fcr den barrierefreien Umbau von Bushaltestellen (A 0102/ 23/24-01-NF)",
    "resolution": null,
    "originator": "Fraktion DIE LINKE",
    "paper_type": "\u00c4nderung zum HH-Planentwurf",
    "published_at": "2023-05-09",
    "reference": "VII-HP-08839",
    "url": "https://ratsinformation.leipzig.de/allris_leipzig_public/vo020?VOLFDNR=2011111"
}, {
    "body": "Leipzig",
    "content": "<empty>",
    "name": "Kita- und Schulsozialarbeit aufstocken (Kitasozialarbeit) (A 0118/ 23/24-01-zur\u00fcckgezogen)",
    "resolution": null,
    "originator": "Fraktion DIE LINKE; Fraktion B\u00fcndnis 90/Die Gr\u00fcnen",
    "paper_type": "\u00c4nderung zum HH-Planentwurf",
    "published_at": "2023-05-09",
    "reference": "VII-HP-08843",
    "url": "https://ratsinformation.leipzig.de/allris_leipzig_public/vo020?VOLFDNR=2011115"
}, {
    "body": "Leipzig",
    "content": "<empty>",
    "name": "Ausstattung kommunaler Kitas mit Kitasozialarbeit (A 0109/ 23/24-zur\u00fcckgezogen)",
    "resolution": null,
    "originator": "Fraktion DIE LINKE",
    "paper_type": "\u00c4nderung zum HH-Planentwurf",
    "published_at": "2023-05-09",
    "reference": "VII-HP-08842",
    "url": "https://ratsinformation.leipzig.de/allris_leipzig_public/vo020?VOLFDNR=2011114"
}, {
    "body": "Leipzig",
    "content": "<empty>",
    "name": "B\u00fcrgerservice st\u00e4rken - digitale Angebote weiterentwickeln  (A 0184/ 23/24-zur\u00fcckgezogen)",
    "resolution": null,
    "originator": "SPD-Fraktion",
    "paper_type": "\u00c4nderung zum HH-Planentwurf",
    "published_at": "2023-05-09",
    "reference": "VII-HP-08845",
    "url": "https://ratsinformation.leipzig.de/allris_leipzig_public/vo020?VOLFDNR=2011117"
}, {
    "body": "Leipzig",
    "content": "<empty>",
    "name": "Sperrung von Investitionsmitteln (A 0006/ 23/24)",
    "resolution": null,
    "originator": "Fraktion Freibeuter",
    "paper_type": "\u00c4nderung zum HH-Planentwurf",
    "published_at": "2023-05-09",
    "reference": "VII-HP-08846",
    "url": "https://ratsinformation.leipzig.de/allris_leipzig_public/vo020?VOLFDNR=2011118"
}, {
    "body": "Leipzig",
    "content": "<empty>",
    "name": "Haushaltsplanung 2023/2024 (A 0210/ 23/24)",
    "resolution": null,
    "originator": "Fachausschuss Finanzen",
    "paper_type": "\u00c4nderung zum HH-Planentwurf",
    "published_at": "2023-05-09",
    "reference": "VII-HP-08841",
    "url": "https://ratsinformation.leipzig.de/allris_leipzig_public/vo020?VOLFDNR=2011113"
}, {
    "body": "Leipzig",
    "content": "<empty>",
    "name": "Einrichtung einer Stelle f\u00fcr Diversity Management im Personalamt der Stadt Leipzig (A 0005/ 23/24-zur\u00fcckgezogen)",
    "resolution": null,
    "originator": "Migrantenbeirat",
    "paper_type": "\u00c4nderung zum HH-Planentwurf",
    "published_at": "2023-05-09",
    "reference": "VII-HP-08844",
    "url": "https://ratsinformation.leipzig.de/allris_leipzig_public/vo020?VOLFDNR=2011116"
}, {
    "body": "Leipzig",
    "content": "<empty>",
    "name": "Stellen Nachhaltiges Bauen einrichten  (A 0064/ 23/24)",
    "resolution": null,
    "originator": "Fraktion B\u00fcndnis 90/Die Gr\u00fcnen",
    "paper_type": "\u00c4nderung zum HH-Planentwurf",
    "published_at": "2023-05-09",
    "reference": "VII-HP-08840",
    "url": "https://ratsinformation.leipzig.de/allris_leipzig_public/vo020?VOLFDNR=2011112"
}, {
    "body": "Leipzig",
    "content": "<empty>",
    "name": "Bau eines separaten Gleisk\u00f6rpers in der Riesaer Stra\u00dfe (A 0098/ 23/24-zur\u00fcckgezogen)",
    "resolution": null,
    "originator": "Fraktion AfD",
    "paper_type": "\u00c4nderung zum HH-Planentwurf",
    "published_at": "2023-05-09",
    "reference": "VII-HP-08849",
    "url": "https://ratsinformation.leipzig.de/allris_leipzig_public/vo020?VOLFDNR=2011121"
}, {
    "body": "Leipzig",
    "content": "<empty>",
    "name": "Gesch\u00e4ftsstellen des Senior*innen- und des Behindertenbeirats personell st\u00e4rken (A 0145/ 23/24)",
    "resolution": null,
    "originator": "Fraktion DIE LINKE; Fraktion B\u00fcndnis 90/Die Gr\u00fcnen",
    "paper_type": "\u00c4nderung zum HH-Planentwurf",
    "published_at": "2023-05-09",
    "reference": "VII-HP-08851",
    "url": "https://ratsinformation.leipzig.de/allris_leipzig_public/vo020?VOLFDNR=2011123"
}, {
    "body": "Leipzig",
    "content": "<empty>",
    "name": "Sanierung Papierm\u00fchlstra\u00dfe (A 0096/ 23/24-zur\u00fcckgezogen)",
    "resolution": null,
    "originator": "Fraktion AfD",
    "paper_type": "\u00c4nderung zum HH-Planentwurf",
    "published_at": "2023-05-09",
    "reference": "VII-HP-08853",
    "url": "https://ratsinformation.leipzig.de/allris_leipzig_public/vo020?VOLFDNR=2011125"
}, {
    "body": "Leipzig",
    "content": "<empty>",
    "name": "Institutionelle F\u00f6rderung Urban Souls e.V. (A 0204/ 23/24)",
    "resolution": null,
    "originator": "Heiko B\u00e4r",
    "paper_type": "\u00c4nderung zum HH-Planentwurf",
    "published_at": "2023-05-09",
    "reference": "VII-HP-08854",
    "url": "https://ratsinformation.leipzig.de/allris_leipzig_public/vo020?VOLFDNR=2011126"
}, {
    "body": "Leipzig",
    "content": "<empty>",
    "name": "Schulwegverbesserung an der Parkstadt 2000 in Portitz (SBB 0017/ 23/24-zur\u00fcckgezogen)",
    "resolution": null,
    "originator": "SBB Nordost",
    "paper_type": "\u00c4nderung zum HH-Planentwurf",
    "published_at": "2023-05-09",
    "reference": "VII-HP-08848",
    "url": "https://ratsinformation.leipzig.de/allris_leipzig_public/vo020?VOLFDNR=2011120"
}, {
    "body": "Leipzig",
    "content": "<empty>",
    "name": "Deckensanierung Hoepnerstra\u00dfe (A 0085/ 24-zur\u00fcckgezogen)",
    "resolution": null,
    "originator": "Fraktion AfD",
    "paper_type": "\u00c4nderung zum HH-Planentwurf",
    "published_at": "2023-05-09",
    "reference": "VII-HP-08852",
    "url": "https://ratsinformation.leipzig.de/allris_leipzig_public/vo020?VOLFDNR=2011124"
}, {
    "body": "Leipzig",
    "content": "<empty>",
    "name": "Bau der Stra\u00dfenbahnwendeschleife H\u00e4nichen (L\u00fctzschena) (A 0099/ 23/24-zur\u00fcckgezogen)",
    "resolution": null,
    "originator": "Fraktion AfD",
    "paper_type": "\u00c4nderung zum HH-Planentwurf",
    "published_at": "2023-05-09",
    "reference": "VII-HP-08850",
    "url": "https://ratsinformation.leipzig.de/allris_leipzig_public/vo020?VOLFDNR=2011122"
}, {
    "body": "Leipzig",
    "content": "<empty>",
    "name": "Park&Ride-Platz in L\u00fctzschena (A 0081/ 23-zur\u00fcckgezogen)",
    "resolution": null,
    "originator": "Fraktion AfD",
    "paper_type": "\u00c4nderung zum HH-Planentwurf",
    "published_at": "2023-05-09",
    "reference": "VII-HP-08847",
    "url": "https://ratsinformation.leipzig.de/allris_leipzig_public/vo020?VOLFDNR=2011119"
}, {
    "body": "Leipzig",
    "content": "<empty>",
    "name": "Energie- und Klimaberater im Amt f\u00fcr Sport (A 0152/ 23/24)",
    "resolution": null,
    "originator": "SR Dr. V. K\u00fclow; Dr. A. Bednarsky; SR O. Gebhardt",
    "paper_type": "\u00c4nderung zum HH-Planentwurf",
    "published_at": "2023-05-09",
    "reference": "VII-HP-08855",
    "url": "https://ratsinformation.leipzig.de/allris_leipzig_public/vo020?VOLFDNR=2011127"
}, {
    "body": "Leipzig",
    "content": "<empty>",
    "name": "Datenschutz und Informationssicherheit gew\u00e4hrleisten\t (A 0159/ 23/24)",
    "resolution": null,
    "originator": "SR Beate Ehms; SR M. K\u00fcng-Vildebrand; SR Dr. O. Naumov",
    "paper_type": "\u00c4nderung zum HH-Planentwurf",
    "published_at": "2023-05-09",
    "reference": "VII-HP-08856",
    "url": "https://ratsinformation.leipzig.de/allris_leipzig_public/vo020?VOLFDNR=2011128"
}, {
    "body": "Leipzig",
    "content": "<empty>",
    "name": "Kinder- und Jugendst\u00e4rkungsgesetz richtig umsetzen (A 0158/ 23/24)",
    "resolution": null,
    "originator": "SR W. Rambow; SR J. Nagel; SR Dr. V. K\u00fclow",
    "paper_type": "\u00c4nderung zum HH-Planentwurf",
    "published_at": "2023-05-09",
    "reference": "VII-HP-08857",
    "url": "https://ratsinformation.leipzig.de/allris_leipzig_public/vo020?VOLFDNR=2011129"
}, {
    "body": "Leipzig",
    "content": "<empty>",
    "name": "Streetwork aufstocken (A 0157/ 23/24)",
    "resolution": null,
    "originator": "SR W. Rambow; SR J. Nagel; SR Dr. V. K\u00fclow; SR S. Pellmann",
    "paper_type": "\u00c4nderung zum HH-Planentwurf",
    "published_at": "2023-05-09",
    "reference": "VII-HP-08858",
    "url": "https://ratsinformation.leipzig.de/allris_leipzig_public/vo020?VOLFDNR=2011130"
}, {
    "body": "Leipzig",
    "content": "<empty>",
    "name": "Streichung des Referates Migration und Integration (A 0071/ 23/24-01-01)",
    "resolution": null,
    "originator": "Fraktion AfD",
    "paper_type": "\u00c4nderung zum HH-Planentwurf",
    "published_at": "2023-05-09",
    "reference": "VII-HP-08861",
    "url": "https://ratsinformation.leipzig.de/allris_leipzig_public/vo020?VOLFDNR=2011133"
}, {
    "body": "Leipzig",
    "content": "<empty>",
    "name": "Aufl\u00f6sung des Referats Nachhaltige Entwicklung und Klimaschutz (A 0072/ 23/24-01)",
    "resolution": null,
    "originator": "Fraktion AfD",
    "paper_type": "\u00c4nderung zum HH-Planentwurf",
    "published_at": "2023-05-09",
    "reference": "VII-HP-08862",
    "url": "https://ratsinformation.leipzig.de/allris_leipzig_public/vo020?VOLFDNR=2011134"
}, {
    "body": "Leipzig",
    "content": "<empty>",
    "name": "Einrichtung einer Einsatzgruppe Fu\u00dfweg-Reparatur (A 0088/ 23/24-01)",
    "resolution": null,
    "originator": "Fraktion AfD",
    "paper_type": "\u00c4nderung zum HH-Planentwurf",
    "published_at": "2023-05-09",
    "reference": "VII-HP-08866",
    "url": "https://ratsinformation.leipzig.de/allris_leipzig_public/vo020?VOLFDNR=2011138"
}, {
    "body": "Leipzig",
    "content": "<empty>",
    "name": "Stellen im Amt f\u00fcr Wohnungsbau und Stadterneuerung  (A 0138/ 23/24)",
    "resolution": null,
    "originator": "Fraktion B\u00fcndnis 90/Die Gr\u00fcnen; Fraktion DIE LINKE",
    "paper_type": "\u00c4nderung zum HH-Planentwurf",
    "published_at": "2023-05-09",
    "reference": "VII-HP-08860",
    "url": "https://ratsinformation.leipzig.de/allris_leipzig_public/vo020?VOLFDNR=2011132"
}, {
    "body": "Leipzig",
    "content": "<empty>",
    "name": "Instandhaltung f\u00fcr B\u00e4nke im Stadtgebiet forcieren (A 0123/ 23/24)",
    "resolution": null,
    "originator": "SR M. Neuhaus; SR Dr. V. K\u00fclow; SR O. Gebhardt",
    "paper_type": "\u00c4nderung zum HH-Planentwurf",
    "published_at": "2023-05-09",
    "reference": "VII-HP-08864",
    "url": "https://ratsinformation.leipzig.de/allris_leipzig_public/vo020?VOLFDNR=2011136"
}, {
    "body": "Leipzig",
    "content": "<empty>",
    "name": "Leipzigs Gartendenkm\u00e4ler erhalten! (A 0083/ 23/24-01)",
    "resolution": null,
    "originator": "Fraktion AfD",
    "paper_type": "\u00c4nderung zum HH-Planentwurf",
    "published_at": "2023-05-09",
    "reference": "VII-HP-08863",
    "url": "https://ratsinformation.leipzig.de/allris_leipzig_public/vo020?VOLFDNR=2011135"
}, {
    "body": "Leipzig",
    "content": "<empty>",
    "name": "Kindern und Familien besser helfen: ASD st\u00e4rken (A 0156/ 23/24)",
    "resolution": null,
    "originator": "SR S. Pellmann; SR W. Rambow; SR J. Nagel; SR Dr. V. K\u00fclow",
    "paper_type": "\u00c4nderung zum HH-Planentwurf",
    "published_at": "2023-05-09",
    "reference": "VII-HP-08859",
    "url": "https://ratsinformation.leipzig.de/allris_leipzig_public/vo020?VOLFDNR=2011131"
}, {
    "body": "Leipzig",
    "content": "<empty>",
    "name": "Kommunale W\u00e4rmestrategie  (A 0048/ 23/24)",
    "resolution": null,
    "originator": "Fraktion B\u00fcndnis 90/Die Gr\u00fcnen",
    "paper_type": "\u00c4nderung zum HH-Planentwurf",
    "published_at": "2023-05-09",
    "reference": "VII-HP-08865",
    "url": "https://ratsinformation.leipzig.de/allris_leipzig_public/vo020?VOLFDNR=2011137"
}, {
    "body": "Leipzig",
    "content": "<empty>",
    "name": "Sanierung und Erweiterung der Turnhalle der Grundschule (OR 0016/ 23/24)",
    "resolution": null,
    "originator": "OR Liebertwolkwitz",
    "paper_type": "\u00c4nderung zum HH-Planentwurf",
    "published_at": "2023-05-09",
    "reference": "VII-HP-08869",
    "url": "https://ratsinformation.leipzig.de/allris_leipzig_public/vo020?VOLFDNR=2011141"
}, {
    "body": "Leipzig",
    "content": "<empty>",
    "name": "Aufstockung Stellen Ausl\u00e4nderbeh\u00f6rde Leipzig (A 0001/ 23/24)",
    "resolution": null,
    "originator": "Migrantenbeirat",
    "paper_type": "\u00c4nderung zum HH-Planentwurf",
    "published_at": "2023-05-09",
    "reference": "VII-HP-08868",
    "url": "https://ratsinformation.leipzig.de/allris_leipzig_public/vo020?VOLFDNR=2011140"
}, {
    "body": "Leipzig",
    "content": "<empty>",
    "name": "Streichung des Referates Migration und Integration (A 0071/ 23/24)",
    "resolution": null,
    "originator": "Fraktion AfD",
    "paper_type": "\u00c4nderung zum HH-Planentwurf",
    "published_at": "2023-05-09",
    "reference": "VII-HP-08871",
    "url": "https://ratsinformation.leipzig.de/allris_leipzig_public/vo020?VOLFDNR=2011143"
}, {
    "body": "Leipzig",
    "content": "<empty>",
    "name": "Verf\u00fcgungsfond f\u00fcr Demokratiebildung  (A 0035/ 23/24-zur\u00fcckgezogen)",
    "resolution": null,
    "originator": "Fraktion B\u00fcndnis 90/Die Gr\u00fcnen",
    "paper_type": "\u00c4nderung zum HH-Planentwurf",
    "published_at": "2023-05-09",
    "reference": "VII-HP-08870",
    "url": "https://ratsinformation.leipzig.de/allris_leipzig_public/vo020?VOLFDNR=2011142"
}, {
    "body": "Leipzig",
    "content": "<empty>",
    "name": "Streichung des Referates Gleichstellung von Frau und Mann (A 0073/ 23/24-01)",
    "resolution": null,
    "originator": "Fraktion AfD",
    "paper_type": "\u00c4nderung zum HH-Planentwurf",
    "published_at": "2023-05-09",
    "reference": "VII-HP-08867",
    "url": "https://ratsinformation.leipzig.de/allris_leipzig_public/vo020?VOLFDNR=2011139"
}, {
    "body": "Leipzig",
    "content": "<empty>",
    "name": "Aufl\u00f6sung des Referats Nachhaltige Entwicklung und Klimaschutz (A 0072/ 23/24)",
    "resolution": null,
    "originator": "Fraktion AfD",
    "paper_type": "\u00c4nderung zum HH-Planentwurf",
    "published_at": "2023-05-09",
    "reference": "VII-HP-08872",
    "url": "https://ratsinformation.leipzig.de/allris_leipzig_public/vo020?VOLFDNR=2011144"
}, {
    "body": "Leipzig",
    "content": "<empty>",
    "name": "Trinkwasser- und Abwasserverbindungen zum Bismarckturm in Leipzig/L\u00fctzschena (A 0080/ 23)",
    "resolution": null,
    "originator": "SR CHristoph Neumann",
    "paper_type": "\u00c4nderung zum HH-Planentwurf",
    "published_at": "2023-05-09",
    "reference": "VII-HP-08874",
    "url": "https://ratsinformation.leipzig.de/allris_leipzig_public/vo020?VOLFDNR=2011146"
}, {
    "body": "Leipzig",
    "content": "<empty>",
    "name": "Streichung des Referates Gleichstellung von Frau und Mann (A 0073/ 23/24)",
    "resolution": null,
    "originator": "Fraktion AfD",
    "paper_type": "\u00c4nderung zum HH-Planentwurf",
    "published_at": "2023-05-09",
    "reference": "VII-HP-08873",
    "url": "https://ratsinformation.leipzig.de/allris_leipzig_public/vo020?VOLFDNR=2011145"
}, {
    "body": "Leipzig",
    "content": "<empty>",
    "name": "Einfrieren des F\u00f6rderbudgets f\u00fcr Tr\u00e4ger der Wohlfahrtspflege (Sozialamt) (A 0077/ 23/24)",
    "resolution": null,
    "originator": "Fraktion AfD",
    "paper_type": "\u00c4nderung zum HH-Planentwurf",
    "published_at": "2023-05-09",
    "reference": "VII-HP-08878",
    "url": "https://ratsinformation.leipzig.de/allris_leipzig_public/vo020?VOLFDNR=2011150"
}, {
    "body": "Leipzig",
    "content": "<empty>",
    "name": "Streichung des Referates Demokratie und gesellschaftlicher Zusammenhalt (A 0035/ 23/24-01-\u00c4A)",
    "resolution": null,
    "originator": "Fraktion AfD",
    "paper_type": "\u00c4nderung zum HH-Planentwurf",
    "published_at": "2023-05-09",
    "reference": "VII-HP-08875",
    "url": "https://ratsinformation.leipzig.de/allris_leipzig_public/vo020?VOLFDNR=2011147"
}, {
    "body": "Leipzig",
    "content": "<empty>",
    "name": "Streichung der Bauma\u00dfnahmen an der Nato (A 0076/ 23/24)",
    "resolution": null,
    "originator": "Fraktion AfD",
    "paper_type": "\u00c4nderung zum HH-Planentwurf",
    "published_at": "2023-05-09",
    "reference": "VII-HP-08876",
    "url": "https://ratsinformation.leipzig.de/allris_leipzig_public/vo020?VOLFDNR=2011148"
}, {
    "body": "Leipzig",
    "content": "<empty>",
    "name": "Budgeterh\u00f6hung f\u00fcr die Clearingsstelle und Anonymer Behandlungsschein Leipzig (CABL) e. V. (A 0002/ 23/24)",
    "resolution": null,
    "originator": "Migrantenbeirat",
    "paper_type": "\u00c4nderung zum HH-Planentwurf",
    "published_at": "2023-05-09",
    "reference": "VII-HP-08877",
    "url": "https://ratsinformation.leipzig.de/allris_leipzig_public/vo020?VOLFDNR=2011149"
}, {
    "body": "Leipzig",
    "content": "<empty>",
    "name": "Mietkautionspool einrichten  (A 0017/ 23/24)",
    "resolution": null,
    "originator": "Fraktion B\u00fcndnis 90/Die Gr\u00fcnen",
    "paper_type": "\u00c4nderung zum HH-Planentwurf",
    "published_at": "2023-05-09",
    "reference": "VII-HP-08886",
    "url": "https://ratsinformation.leipzig.de/allris_leipzig_public/vo020?VOLFDNR=2011158"
}, {
    "body": "Leipzig",
    "content": "<empty>",
    "name": "Erh\u00f6hung der Zusch\u00fcsse f\u00fcr Bauinvestitionen f\u00fcr Sportvereine (A 0087/ 23/24)",
    "resolution": null,
    "originator": "Fraktion AfD",
    "paper_type": "\u00c4nderung zum HH-Planentwurf",
    "published_at": "2023-05-09",
    "reference": "VII-HP-08884",
    "url": "https://ratsinformation.leipzig.de/allris_leipzig_public/vo020?VOLFDNR=2011156"
}, {
    "body": "Leipzig",
    "content": "<empty>",
    "name": "F\u00f6rderung CABL e.V.; Budgeterh\u00f6hung f\u00fcr Clearingstelle/ Anonymer Behandlungsschein CABL e. V. (Beschlusspunkt 3) (A 0146/ 23/24-02-NF1)",
    "resolution": null,
    "originator": "Fraktion B\u00fcndnis 90/Die Gr\u00fcnen; Fraktion DIE LINKE",
    "paper_type": "\u00c4nderung zum HH-Planentwurf",
    "published_at": "2023-05-09",
    "reference": "VII-HP-08880",
    "url": "https://ratsinformation.leipzig.de/allris_leipzig_public/vo020?VOLFDNR=2011152"
}, {
    "body": "Leipzig",
    "content": "<empty>",
    "name": "Absicherung Pr\u00e4vention im Zentrum f\u00fcr Drogenhilfe (A 0143/ 23/24)",
    "resolution": null,
    "originator": "SR Dr. V. K\u00fclow; SR J. Nagel; SR S. Pellmann; SR W. Rambow",
    "paper_type": "\u00c4nderung zum HH-Planentwurf",
    "published_at": "2023-05-09",
    "reference": "VII-HP-08879",
    "url": "https://ratsinformation.leipzig.de/allris_leipzig_public/vo020?VOLFDNR=2011151"
}, {
    "body": "Leipzig",
    "content": "<empty>",
    "name": "Leipziger Tafel in der Krise f\u00fcr Bed\u00fcrftige st\u00fctzen (A 0111/ 23/24)",
    "resolution": null,
    "originator": "Fraktion DIE LINKE",
    "paper_type": "\u00c4nderung zum HH-Planentwurf",
    "published_at": "2023-05-09",
    "reference": "VII-HP-08882",
    "url": "https://ratsinformation.leipzig.de/allris_leipzig_public/vo020?VOLFDNR=2011154"
}, {
    "body": "Leipzig",
    "content": "<empty>",
    "name": "Absicherung Pr\u00e4vention im Zentrum f\u00fcr Drogenhilfe (A 0143/ 23/24-01-\u00c4A)",
    "resolution": null,
    "originator": "SPD-Fraktion",
    "paper_type": "\u00c4nderung zum HH-Planentwurf",
    "published_at": "2023-05-09",
    "reference": "VII-HP-08881",
    "url": "https://ratsinformation.leipzig.de/allris_leipzig_public/vo020?VOLFDNR=2011153"
}, {
    "body": "Leipzig",
    "content": "<empty>",
    "name": "Finanzierung Konzeptentwicklung Kommunales Modellprojekt Drug Checking (A 0144/ 23/24)",
    "resolution": null,
    "originator": "SR J. Nagel; SR Dr. V. K\u00fclow; SR S. Pellmann; SR W. Rambow",
    "paper_type": "\u00c4nderung zum HH-Planentwurf",
    "published_at": "2023-05-09",
    "reference": "VII-HP-08883",
    "url": "https://ratsinformation.leipzig.de/allris_leipzig_public/vo020?VOLFDNR=2011155"
}, {
    "body": "Leipzig",
    "content": "<empty>",
    "name": "Errichtung eines \u00f6ffentlichen Bolzplatzes (OR 0057/ 23/24)",
    "resolution": null,
    "originator": "OR B\u00f6hlitz-Ehrenberg",
    "paper_type": "\u00c4nderung zum HH-Planentwurf",
    "published_at": "2023-05-09",
    "reference": "VII-HP-08885",
    "url": "https://ratsinformation.leipzig.de/allris_leipzig_public/vo020?VOLFDNR=2011157"
}, {
    "body": "Leipzig",
    "content": "<empty>",
    "name": "Einfrieren der Kulturf\u00f6rderung (A 0078/ 23/24)",
    "resolution": null,
    "originator": "Fraktion AfD",
    "paper_type": "\u00c4nderung zum HH-Planentwurf",
    "published_at": "2023-05-09",
    "reference": "VII-HP-08887",
    "url": "https://ratsinformation.leipzig.de/allris_leipzig_public/vo020?VOLFDNR=2011159"
}, {
    "body": "Leipzig",
    "content": "<empty>",
    "name": "Wege in st\u00e4dtischen Park- und Gr\u00fcnanlagen sanieren! (A 0094/ 23/24)",
    "resolution": null,
    "originator": "Fraktion AfD",
    "paper_type": "\u00c4nderung zum HH-Planentwurf",
    "published_at": "2023-05-09",
    "reference": "VII-HP-08892",
    "url": "https://ratsinformation.leipzig.de/allris_leipzig_public/vo020?VOLFDNR=2011164"
}, {
    "body": "Leipzig",
    "content": "<empty>",
    "name": "Beschilderung Innerer Gr\u00fcner Ring wieder anbringen (A 0095/ 23/24)",
    "resolution": null,
    "originator": "Fraktion AfD",
    "paper_type": "\u00c4nderung zum HH-Planentwurf",
    "published_at": "2023-05-09",
    "reference": "VII-HP-08893",
    "url": "https://ratsinformation.leipzig.de/allris_leipzig_public/vo020?VOLFDNR=2011165"
}, {
    "body": "Leipzig",
    "content": "<empty>",
    "name": "Wald- und Erholungswege in st\u00e4dtischen W\u00e4ldern beschleunigt sanieren /anlegen! (A 0093/ 23/24)",
    "resolution": null,
    "originator": "Fraktion AfD",
    "paper_type": "\u00c4nderung zum HH-Planentwurf",
    "published_at": "2023-05-09",
    "reference": "VII-HP-08891",
    "url": "https://ratsinformation.leipzig.de/allris_leipzig_public/vo020?VOLFDNR=2011163"
}, {
    "body": "Leipzig",
    "content": "<empty>",
    "name": "St\u00e4rkung von Biotoppflege und Klimawandelanpassung bei Stadtgr\u00fcn und Gew\u00e4sser (Neufassung zu den Antr\u00e4gen A 0169/ 23/24-01, A 0167/23/24, A 0168/23/24) (A 0169/ 23/24-02-NF)",
    "resolution": null,
    "originator": "Fraktion B\u00fcndnis 90/Die Gr\u00fcnen; SPD-Fraktion",
    "paper_type": "\u00c4nderung zum HH-Planentwurf",
    "published_at": "2023-05-09",
    "reference": "VII-HP-08894",
    "url": "https://ratsinformation.leipzig.de/allris_leipzig_public/vo020?VOLFDNR=2011166"
}, {
    "body": "Leipzig",
    "content": "<empty>",
    "name": "Rekultivierung des Dorfplatzes, Wiederherstellung der Wegeverbindungen in einen ordentlichen Zustand, Wildwuchs beseitigen und Neubepflanzung der Gr\u00fcnfl\u00e4chen (OR 0003/ 23/24)",
    "resolution": null,
    "originator": "OR Burghausen",
    "paper_type": "\u00c4nderung zum HH-Planentwurf",
    "published_at": "2023-05-09",
    "reference": "VII-HP-08889",
    "url": "https://ratsinformation.leipzig.de/allris_leipzig_public/vo020?VOLFDNR=2011161"
}, {
    "body": "Leipzig",
    "content": "<empty>",
    "name": "Einstellen von Planungsmitteln f\u00fcr die Sanierung des Dorfteiches Lausen (SBB 0013/ 23/24)",
    "resolution": null,
    "originator": "SBB West",
    "paper_type": "\u00c4nderung zum HH-Planentwurf",
    "published_at": "2023-05-09",
    "reference": "VII-HP-08888",
    "url": "https://ratsinformation.leipzig.de/allris_leipzig_public/vo020?VOLFDNR=2011160"
}, {
    "body": "Leipzig",
    "content": "<empty>",
    "name": "Leipzigs Gartendenkm\u00e4ler erhalten! (A 0083/ 23/24)",
    "resolution": null,
    "originator": "Fraktion AfD",
    "paper_type": "\u00c4nderung zum HH-Planentwurf",
    "published_at": "2023-05-09",
    "reference": "VII-HP-08890",
    "url": "https://ratsinformation.leipzig.de/allris_leipzig_public/vo020?VOLFDNR=2011162"
}, {
    "body": "Leipzig",
    "content": "<empty>",
    "name": "\"Coole Stra\u00dfen\" - mehr Lebensqualit\u00e4t in Leipzigs Stra\u00dfen - Mittel  (A 0062/ 23/24)",
    "resolution": null,
    "originator": "Fraktion B\u00fcndnis 90/Die Gr\u00fcnen",
    "paper_type": "\u00c4nderung zum HH-Planentwurf",
    "published_at": "2023-05-09",
    "reference": "VII-HP-08897",
    "url": "https://ratsinformation.leipzig.de/allris_leipzig_public/vo020?VOLFDNR=2011169"
}, {
    "body": "Leipzig",
    "content": "<empty>",
    "name": "Aufwertung des Spielplatzes \"Oswaldplatz\" (SBB 0019/ 23/24)",
    "resolution": null,
    "originator": "SBB S\u00fcdost",
    "paper_type": "\u00c4nderung zum HH-Planentwurf",
    "published_at": "2023-05-09",
    "reference": "VII-HP-08895",
    "url": "https://ratsinformation.leipzig.de/allris_leipzig_public/vo020?VOLFDNR=2011167"
}, {
    "body": "Leipzig",
    "content": "<empty>",
    "name": "F\u00f6rderung Parkh\u00e4user in Wohngebieten (A 0090/ 23/24)",
    "resolution": null,
    "originator": "Fraktion AfD",
    "paper_type": "\u00c4nderung zum HH-Planentwurf",
    "published_at": "2023-05-09",
    "reference": "VII-HP-08896",
    "url": "https://ratsinformation.leipzig.de/allris_leipzig_public/vo020?VOLFDNR=2011168"
}, {
    "body": "Leipzig",
    "content": "<empty>",
    "name": "Umsetzung Strategie Kunst im \u00f6ffentlichen Raum (A 0141/ 23/24)",
    "resolution": null,
    "originator": "SR M. Gehrt; SR Th. Kumbernu\u00df; SR M. G\u00f6tze",
    "paper_type": "\u00c4nderung zum HH-Planentwurf",
    "published_at": "2023-05-09",
    "reference": "VII-HP-08898",
    "url": "https://ratsinformation.leipzig.de/allris_leipzig_public/vo020?VOLFDNR=2011170"
}, {
    "body": "Leipzig",
    "content": "<empty>",
    "name": "Einrichtung einer Einsatzgruppe Fu\u00dfweg-Reparatur (A 0088/ 23/24)",
    "resolution": null,
    "originator": "Fraktion AfD",
    "paper_type": "\u00c4nderung zum HH-Planentwurf",
    "published_at": "2023-05-09",
    "reference": "VII-HP-08900",
    "url": "https://ratsinformation.leipzig.de/allris_leipzig_public/vo020?VOLFDNR=2011172"
}, {
    "body": "Leipzig",
    "content": "<empty>",
    "name": "Europ\u00e4ische Mobilit\u00e4tswoche (A 0066/ 23/24)",
    "resolution": null,
    "originator": "Fraktion CDU",
    "paper_type": "\u00c4nderung zum HH-Planentwurf",
    "published_at": "2023-05-09",
    "reference": "VII-HP-08905",
    "url": "https://ratsinformation.leipzig.de/allris_leipzig_public/vo020?VOLFDNR=2011177"
}, {
    "body": "Leipzig",
    "content": "<empty>",
    "name": "Ausbau der Stra\u00dfe Deutsche Einheit (OR 0019/ 23/24)",
    "resolution": null,
    "originator": "OR Liebertwolkwitz",
    "paper_type": "\u00c4nderung zum HH-Planentwurf",
    "published_at": "2023-05-09",
    "reference": "VII-HP-08899",
    "url": "https://ratsinformation.leipzig.de/allris_leipzig_public/vo020?VOLFDNR=2011171"
}, {
    "body": "Leipzig",
    "content": "<empty>",
    "name": "Verkehrsicherheit am Naherholungsgebiet Etzoldsche Sandgrube erh\u00f6hen (SBB 0003/ 23/24)",
    "resolution": null,
    "originator": "SBB S\u00fcdost",
    "paper_type": "\u00c4nderung zum HH-Planentwurf",
    "published_at": "2023-05-09",
    "reference": "VII-HP-08902",
    "url": "https://ratsinformation.leipzig.de/allris_leipzig_public/vo020?VOLFDNR=2011174"
}, {
    "body": "Leipzig",
    "content": "<empty>",
    "name": "Instandsetzung des Parkplatzes am ehemaligen Gemeindeamt vom Plantagenweg aus.    (OR 0002/ 23/24)",
    "resolution": null,
    "originator": "OR Burghausen",
    "paper_type": "\u00c4nderung zum HH-Planentwurf",
    "published_at": "2023-05-09",
    "reference": "VII-HP-08903",
    "url": "https://ratsinformation.leipzig.de/allris_leipzig_public/vo020?VOLFDNR=2011175"
}, {
    "body": "Leipzig",
    "content": "<empty>",
    "name": "Erneuerung von Stra\u00dfenschildern (A 0100/ 23/24)",
    "resolution": null,
    "originator": "Fraktion AfD",
    "paper_type": "\u00c4nderung zum HH-Planentwurf",
    "published_at": "2023-05-09",
    "reference": "VII-HP-08906",
    "url": "https://ratsinformation.leipzig.de/allris_leipzig_public/vo020?VOLFDNR=2011178"
}, {
    "body": "Leipzig",
    "content": "<empty>",
    "name": "Erh\u00f6hung der Einnahmen durch neue Bewohnerparkzonen und h\u00f6here Geb\u00fchren  (A 0014/ 23/24)",
    "resolution": null,
    "originator": "Fraktion B\u00fcndnis 90/Die Gr\u00fcnen",
    "paper_type": "\u00c4nderung zum HH-Planentwurf",
    "published_at": "2023-05-09",
    "reference": "VII-HP-08904",
    "url": "https://ratsinformation.leipzig.de/allris_leipzig_public/vo020?VOLFDNR=2011176"
}, {
    "body": "Leipzig",
    "content": "<empty>",
    "name": "Gehwegsanierung (A 0097/ 23/24)",
    "resolution": null,
    "originator": "Fraktion AfD",
    "paper_type": "\u00c4nderung zum HH-Planentwurf",
    "published_at": "2023-05-09",
    "reference": "VII-HP-08901",
    "url": "https://ratsinformation.leipzig.de/allris_leipzig_public/vo020?VOLFDNR=2011173"
}, {
    "body": "Leipzig",
    "content": "<empty>",
    "name": "Wiederherstellung der zerst\u00f6rten Bordsteinkanten, Schnittgerinne und der Funktionsf\u00e4higkeit der Stra\u00dfenabl\u00e4ufe in der Bienitzstra\u00dfe zwischen Gartenverein \"Am Kanal\" und dem Kurhaus (OR 0004/ 23/24)",
    "resolution": null,
    "originator": "OR Burghausen",
    "paper_type": "\u00c4nderung zum HH-Planentwurf",
    "published_at": "2023-05-09",
    "reference": "VII-HP-08907",
    "url": "https://ratsinformation.leipzig.de/allris_leipzig_public/vo020?VOLFDNR=2011179"
}, {
    "body": "Leipzig",
    "content": "<empty>",
    "name": "F\u00f6rdermittel Freie Szene einsparen (A 0067/ 23/24)",
    "resolution": null,
    "originator": "Fraktion CDU",
    "paper_type": "\u00c4nderung zum HH-Planentwurf",
    "published_at": "2023-05-09",
    "reference": "VII-HP-08909",
    "url": "https://ratsinformation.leipzig.de/allris_leipzig_public/vo020?VOLFDNR=2011181"
}, {
    "body": "Leipzig",
    "content": "<empty>",
    "name": "Sanierung Fabrikstra\u00dfe (OR 0058/ 23/24)",
    "resolution": null,
    "originator": "OR B\u00f6hlitz-Ehrenberg",
    "paper_type": "\u00c4nderung zum HH-Planentwurf",
    "published_at": "2023-05-09",
    "reference": "VII-HP-08910",
    "url": "https://ratsinformation.leipzig.de/allris_leipzig_public/vo020?VOLFDNR=2011182"
}, {
    "body": "Leipzig",
    "content": "<empty>",
    "name": "Integrationspreis f\u00fcr kleine und mittlere Unternehmen ausloben (A 0089/ 23/24)",
    "resolution": null,
    "originator": "Fraktion AfD",
    "paper_type": "\u00c4nderung zum HH-Planentwurf",
    "published_at": "2023-05-09",
    "reference": "VII-HP-08911",
    "url": "https://ratsinformation.leipzig.de/allris_leipzig_public/vo020?VOLFDNR=2011183"
}, {
    "body": "Leipzig",
    "content": "<empty>",
    "name": "Grundhafter Ausbau der Stra\u00dfe Am Niederholz (OR 0018/ 23/24)",
    "resolution": null,
    "originator": "OR Liebertwolkwitz",
    "paper_type": "\u00c4nderung zum HH-Planentwurf",
    "published_at": "2023-05-09",
    "reference": "VII-HP-08908",
    "url": "https://ratsinformation.leipzig.de/allris_leipzig_public/vo020?VOLFDNR=2011180"
}, {
    "body": "Leipzig",
    "content": "<empty>",
    "name": "Umr\u00fcstung Heizung/Warmwasser/energieintensive Produktionsbereiche (A 0114/ 23/24)",
    "resolution": null,
    "originator": "Fraktion DIE LINKE",
    "paper_type": "\u00c4nderung zum HH-Planentwurf",
    "published_at": "2023-05-09",
    "reference": "VII-HP-08912",
    "url": "https://ratsinformation.leipzig.de/allris_leipzig_public/vo020?VOLFDNR=2011184"
}, {
    "body": "Leipzig",
    "content": "<empty>",
    "name": "Budget der F\u00f6rderung von Vereinen und Verb\u00e4nden der Kinder- und Jugendhilfe  (A 0011/ 23/24)",
    "resolution": null,
    "originator": "Jugendhilfeausschuss",
    "paper_type": "\u00c4nderung zum HH-Planentwurf",
    "published_at": "2023-05-09",
    "reference": "VII-HP-08914",
    "url": "https://ratsinformation.leipzig.de/allris_leipzig_public/vo020?VOLFDNR=2011186"
}, {
    "body": "Leipzig",
    "content": "<empty>",
    "name": "Digitale Schulungen u.a. zu IT-Sicherheit und Datenschutz - Konzept und Software (A 0176/ 23/24)",
    "resolution": null,
    "originator": "SPD-Fraktion",
    "paper_type": "\u00c4nderung zum HH-Planentwurf",
    "published_at": "2023-05-09",
    "reference": "VII-HP-08913",
    "url": "https://ratsinformation.leipzig.de/allris_leipzig_public/vo020?VOLFDNR=2011185"
}, {
    "body": "Leipzig",
    "content": "<empty>",
    "name": "Stabilisierung der Arbeit des Fanprojektes Leipzig und der \"Lernkurve\" (A 0147/ 23/24)",
    "resolution": null,
    "originator": "SR J. Nagel; SR M. Lazar; SR Ch. Zenker",
    "paper_type": "\u00c4nderung zum HH-Planentwurf",
    "published_at": "2023-05-09",
    "reference": "VII-HP-08915",
    "url": "https://ratsinformation.leipzig.de/allris_leipzig_public/vo020?VOLFDNR=2011187"
}, {
    "body": "Leipzig",
    "content": "<empty>",
    "name": "Jugendwohnen au\u00dferhalb der Kinder- und Jugendf\u00f6rderung sicherstellen (A 0127/ 23/24)",
    "resolution": null,
    "originator": "Fraktion B\u00fcndnis 90/Die Gr\u00fcnen; Fraktion Die Linke; SPD-Fraktion",
    "paper_type": "\u00c4nderung zum HH-Planentwurf",
    "published_at": "2023-05-09",
    "reference": "VII-HP-08916",
    "url": "https://ratsinformation.leipzig.de/allris_leipzig_public/vo020?VOLFDNR=2011188"
}, {
    "body": "Leipzig",
    "content": "<empty>",
    "name": "KiFaz-Ausbau (Kitas freie Tr\u00e4ger) (A 0101/ 23/24-03-NF)",
    "resolution": null,
    "originator": "Fraktion B\u00fcndnis 90/Die Gr\u00fcnen; Fraktion DIE LINKE; SPD-Fraktion",
    "paper_type": "\u00c4nderung zum HH-Planentwurf",
    "published_at": "2023-05-09",
    "reference": "VII-HP-08918",
    "url": "https://ratsinformation.leipzig.de/allris_leipzig_public/vo020?VOLFDNR=2011190"
}, {
    "body": "Leipzig",
    "content": "<empty>",
    "name": "Budget der F\u00f6rderung von Vereinen und Verb\u00e4nden der Kinder- und Jugendhilfe (A 0011/ 23/24-02-\u00c4A)",
    "resolution": null,
    "originator": "Fraktion B\u00fcndnis 90/Die Gr\u00fcnen; Fraktion DIE LINKE; SPD-Fraktion",
    "paper_type": "\u00c4nderung zum HH-Planentwurf",
    "published_at": "2023-05-09",
    "reference": "VII-HP-08917",
    "url": "https://ratsinformation.leipzig.de/allris_leipzig_public/vo020?VOLFDNR=2011189"
}, {
    "body": "Leipzig",
    "content": "<empty>",
    "name": "Bedrohte Freie Kunst und Kultur st\u00e4rken durch zus\u00e4tzliche F\u00f6rdermittel - Budgeterh\u00f6hung (A 0023/ 23/24)",
    "resolution": null,
    "originator": "Fraktion B\u00fcndnis 90/Die Gr\u00fcnen",
    "paper_type": "\u00c4nderung zum HH-Planentwurf",
    "published_at": "2023-05-09",
    "reference": "VII-HP-08924",
    "url": "https://ratsinformation.leipzig.de/allris_leipzig_public/vo020?VOLFDNR=2011196"
}, {
    "body": "Leipzig",
    "content": "<empty>",
    "name": "St\u00e4rkung der Energie- und Klimaschutzberatung - bei freien Tr\u00e4gern  (A 0051/ 23/24)",
    "resolution": null,
    "originator": "Fraktion B\u00fcndnis 90/Die Gr\u00fcnen",
    "paper_type": "\u00c4nderung zum HH-Planentwurf",
    "published_at": "2023-05-09",
    "reference": "VII-HP-08922",
    "url": "https://ratsinformation.leipzig.de/allris_leipzig_public/vo020?VOLFDNR=2011194"
}, {
    "body": "Leipzig",
    "content": "<empty>",
    "name": "Klimaschutzoffensive finanzieren  (A 0046/ 23/24)",
    "resolution": null,
    "originator": "Fraktion B\u00fcndnis 90/Die Gr\u00fcnen",
    "paper_type": "\u00c4nderung zum HH-Planentwurf",
    "published_at": "2023-05-09",
    "reference": "VII-HP-08921",
    "url": "https://ratsinformation.leipzig.de/allris_leipzig_public/vo020?VOLFDNR=2011193"
}, {
    "body": "Leipzig",
    "content": "<empty>",
    "name": "Absicherung der Freien Kulturszene (A 0115/ 23/24)",
    "resolution": null,
    "originator": "Fraktion DIE LINKE",
    "paper_type": "\u00c4nderung zum HH-Planentwurf",
    "published_at": "2023-05-09",
    "reference": "VII-HP-08925",
    "url": "https://ratsinformation.leipzig.de/allris_leipzig_public/vo020?VOLFDNR=2011197"
}, {
    "body": "Leipzig",
    "content": "<empty>",
    "name": "KiFaz und Kitasozialarbeit; KiFaz-Ausbau (kommunale Kitas) - Neufassung zu den Antr\u00e4gen A 0187/23/24 und A 0101/23/24 (A 0187/ 23/24-01-NF)",
    "resolution": null,
    "originator": "Fraktion B\u00fcndnis 90/Die Gr\u00fcnen; Fraktion DIE LINKE; SPD-Fraktion",
    "paper_type": "\u00c4nderung zum HH-Planentwurf",
    "published_at": "2023-05-09",
    "reference": "VII-HP-08919",
    "url": "https://ratsinformation.leipzig.de/allris_leipzig_public/vo020?VOLFDNR=2011191"
}, {
    "body": "Leipzig",
    "content": "<empty>",
    "name": "Unterst\u00fctzung der Nacht\u00f6konomie  (A 0122/ 23/24)",
    "resolution": null,
    "originator": "SR Ch. Zenker; SR Th. Kumbernu\u00df; SR J. Kasek",
    "paper_type": "\u00c4nderung zum HH-Planentwurf",
    "published_at": "2023-05-09",
    "reference": "VII-HP-08926",
    "url": "https://ratsinformation.leipzig.de/allris_leipzig_public/vo020?VOLFDNR=2011198"
}, {
    "body": "Leipzig",
    "content": "<empty>",
    "name": "Mittel f\u00fcr Lastenradverleihsystem  (A 0179/ 23/24)",
    "resolution": null,
    "originator": "SPD-Fraktion",
    "paper_type": "\u00c4nderung zum HH-Planentwurf",
    "published_at": "2023-05-09",
    "reference": "VII-HP-08923",
    "url": "https://ratsinformation.leipzig.de/allris_leipzig_public/vo020?VOLFDNR=2011195"
}, {
    "body": "Leipzig",
    "content": "<empty>",
    "name": "Sicherung digitaler p\u00e4dagogischer Musikschulangebote - Teil II  (A 0028/ 23/24)",
    "resolution": null,
    "originator": "Fraktion B\u00fcndnis 90/Die Gr\u00fcnen",
    "paper_type": "\u00c4nderung zum HH-Planentwurf",
    "published_at": "2023-05-09",
    "reference": "VII-HP-08920",
    "url": "https://ratsinformation.leipzig.de/allris_leipzig_public/vo020?VOLFDNR=2011192"
}, {
    "body": "Leipzig",
    "content": "<empty>",
    "name": "Umbau der St\u00fcnzer Str. zwischen 74. GS und Kita Dschungelbande (BE 0006/ 23/24)",
    "resolution": null,
    "originator": "Gebhardt, Ulrike",
    "paper_type": "\u00c4nderung zum HH-Planentwurf",
    "published_at": "2023-05-09",
    "reference": "VII-HP-08934",
    "url": "https://ratsinformation.leipzig.de/allris_leipzig_public/vo020?VOLFDNR=2011206"
}, {
    "body": "Leipzig",
    "content": "<empty>",
    "name": "Budget Erinnerungskultur (Neufassung zu den Antr\u00e4gen A 0135/23/24, 0026/23/24, A 0126/23/24, A 0150/23/24, A 0162/23/24, A 182/23/24) (A 0135/ 23/24-01-NF)",
    "resolution": null,
    "originator": "SPD-Fraktion; Fraktion B\u00fcndnis 90/Die Gr\u00fcnen; Fraktion Die Linke",
    "paper_type": "\u00c4nderung zum HH-Planentwurf",
    "published_at": "2023-05-09",
    "reference": "VII-HP-08928",
    "url": "https://ratsinformation.leipzig.de/allris_leipzig_public/vo020?VOLFDNR=2011200"
}, {
    "body": "Leipzig",
    "content": "<empty>",
    "name": "Sonderdynamisierung F\u00f6rderung von Vereinen und Verb\u00e4nden im Kulturbereich  (A 0188/ 23/24)",
    "resolution": null,
    "originator": "SPD-Fraktion",
    "paper_type": "\u00c4nderung zum HH-Planentwurf",
    "published_at": "2023-05-09",
    "reference": "VII-HP-08927",
    "url": "https://ratsinformation.leipzig.de/allris_leipzig_public/vo020?VOLFDNR=2011199"
}, {
    "body": "Leipzig",
    "content": "<empty>",
    "name": "Erh\u00f6hung des Jugendhilfe-Etats (BE 0001/ 23/24)",
    "resolution": null,
    "originator": "Bernard, Ulrike",
    "paper_type": "\u00c4nderung zum HH-Planentwurf",
    "published_at": "2023-05-09",
    "reference": "VII-HP-08931",
    "url": "https://ratsinformation.leipzig.de/allris_leipzig_public/vo020?VOLFDNR=2011203"
}, {
    "body": "Leipzig",
    "content": "<empty>",
    "name": "Finanzierung Umbau Haus 5+6 im Robert-Koch-Park (zu BE 0004/23/24) (A 0209/ 23/24)",
    "resolution": null,
    "originator": "Fraktion DIE LINKE",
    "paper_type": "\u00c4nderung zum HH-Planentwurf",
    "published_at": "2023-05-09",
    "reference": "VII-HP-08929",
    "url": "https://ratsinformation.leipzig.de/allris_leipzig_public/vo020?VOLFDNR=2011201"
}, {
    "body": "Leipzig",
    "content": "<empty>",
    "name": "Geh- und Radweg entlang B181 zwischen Elster-Saale-Kanal und Ochsenweg (BE 0002/ 23)",
    "resolution": null,
    "originator": "Fuchs, Sabine",
    "paper_type": "\u00c4nderung zum HH-Planentwurf",
    "published_at": "2023-05-09",
    "reference": "VII-HP-08933",
    "url": "https://ratsinformation.leipzig.de/allris_leipzig_public/vo020?VOLFDNR=2011205"
}, {
    "body": "Leipzig",
    "content": "<empty>",
    "name": "Ankauf und Verkauf von Grundst\u00fccken zur Stadtentwicklung (A 0121/ 24)",
    "resolution": null,
    "originator": "SR Dr. T. Peter; SR M. Weber; SRin A. Feichtinger",
    "paper_type": "\u00c4nderung zum HH-Planentwurf",
    "published_at": "2023-05-09",
    "reference": "VII-HP-08930",
    "url": "https://ratsinformation.leipzig.de/allris_leipzig_public/vo020?VOLFDNR=2011202"
}, {
    "body": "Leipzig",
    "content": "<empty>",
    "name": "Ausreichende Finanzierung Umbau Haus 5+6 im Robert-Koch-Park/ Leipzig-Gr\u00fcnau (BE 0004/ 23/24)",
    "resolution": null,
    "originator": "Bernard, Ulrike",
    "paper_type": "\u00c4nderung zum HH-Planentwurf",
    "published_at": "2023-05-09",
    "reference": "VII-HP-08932",
    "url": "https://ratsinformation.leipzig.de/allris_leipzig_public/vo020?VOLFDNR=2011204"
}, {
    "body": "Leipzig",
    "content": "<empty>",
    "name": "Erh\u00f6hung des Kulturetats f\u00fcr soziokulturelle Zentren und Projekte (BE 0003/ 23/24)",
    "resolution": null,
    "originator": "Bernard, Ulrike",
    "paper_type": "\u00c4nderung zum HH-Planentwurf",
    "published_at": "2023-05-09",
    "reference": "VII-HP-08935",
    "url": "https://ratsinformation.leipzig.de/allris_leipzig_public/vo020?VOLFDNR=2011207"
}, {
    "body": "Leipzig",
    "content": "<empty>",
    "name": "Mobilit\u00e4tskonzepte \"Superblocks f\u00fcr Neustadt-Neusch\u00f6nefeld und Volkmarsdorf\" (BE 0005/ 23/24)",
    "resolution": null,
    "originator": "Jedlitschka, Ariane",
    "paper_type": "\u00c4nderung zum HH-Planentwurf",
    "published_at": "2023-05-09",
    "reference": "VII-HP-08936",
    "url": "https://ratsinformation.leipzig.de/allris_leipzig_public/vo020?VOLFDNR=2011208"
}, {
    "body": "Leipzig",
    "content": "Ratsinformationssystem Stadt Leipzig -\nDiese Seite verwendet nur Cookies, die f\u00fcr den technischen Betrieb notwendig sind.\nMehr dazu in unserer Datenschutzerkl\u00e4rung.\nOK\n\t\nRatsinfo\n\tNachrichten\n\tFeeds\n\tLogin f\u00fcr die Verwaltung\n\tLogin f\u00fcr Gremienmitglieder\n\tApp\n\t\nOrganisation\n\tRat\n\tJugendparlament\n\tAusschuss\n\tOrtschaftsr\u00e4te\n\tStadtbezirksbeir\u00e4te\n\tBeir\u00e4te\n\tAufsichtsr\u00e4te\n\tZweckverb\u00e4nde, Stiftungen etc.\n\tFraktion\n\t\nSitzungen\n\tKalender\n\t\u00dcbersicht\n\t\nVorlagen\n\t\u00dcbersicht\n\tZur Beratung\n\tVorlagen aus der Politik\n\t\nTOP\n\tZust\u00e4ndigkeit/Ergebnis\n\t\nPetitionen\n\tPetitionen \u00dcbersicht\n\tOnline Petition einreichen\n\t\nRecherche\n\tPerson\n\tVolltext\n\tNeu laden\n\tWiedervorlage\n\tSeite versenden\n\t\nmehr\n\tDrucken\n\tAnzeigeschema\nEs ist ein Fehler aufgetreten\nAngefordertes Dokument existiert nicht.\nDatenschutz\n|\nImpressum\n|\nKontakt",
    "name": "Energieeffizienz mit stabilen Mieten",
    "resolution": null,
    "originator": "Fraktion DIE LINKE",
    "paper_type": "Neufassung Antrag",
    "published_at": "2023-05-09",
    "reference": "VII-A-07860-NF-04",
    "url": "https://ratsinformation.leipzig.de/allris_leipzig_public/vo020?VOLFDNR=2010890"
}, {
    "body": "Leipzig",
    "content": "1/2 \n \n \nRatsversammlung \n \n  \nNeufassung Antrag-Nr. VII-A-08079-NF-02 \n \nStatus: \u00f6ffentlich \n \nEingereicht von: \nFraktion B\u00fcndnis 90/Die Gr\u00fcnen \n \n \nStammbaum: \n \nVII-A-08079 Fraktion B\u00fcndnis 90/Die Gr\u00fcnen \n \n \nVII-A-08079-VSP-01 Dezernat \nStadtentwicklung und Bau \n \n \nVII-A-08079-NF-02 Fraktion B\u00fcndnis 90/Die \nGr\u00fcnen \n \nBetreff: \nGebt die D\u00e4cher frei! \n \n \nBeratungsfolge (\u00c4nderungen vorbehalten): \nGremium \nVoraussichtlicher \nSitzungstermin \nZust\u00e4ndigkeit \n   \nFA Umwelt, Klima und Ordnung 09.05.2023 2. Lesung \nRatsversammlung 17.05.2023 Beschlussfassung \n \n \nBeschlussvorschlag \nDer Oberb\u00fcrgermeister wird beauftragt, \n1. bis Ende 2023 eine \u00dcbersicht \u00fcber den Stand der bis dahin erfolgten Fl\u00e4chenpr\u00fcfung mit Details zu dem \nPr\u00fcfumfang und den Pr\u00fcfergebnissen zu erstellen. Dabei wird dargelegt, wie auf dem ermittelten Fl\u00e4chenpotenzial \nPhotovoltaikanlagen errichtet werden, \n2. \u00fcber Prozessoptimierungen zu informieren. Ebenso wird \u00fcber Prozessoptimierungen informiert. Hierzu wird dem \nStadtrat eine Informationsvorlage vorgelegt. \n3. \u00fcber den Umsetzungsstand j\u00e4hrlich im Energiebericht zu informieren; \n4. f\u00fcr mind. zwei konkrete Standorte unterschiedlicher Gegebenheiten (Liegenschaftsparkplatz und P&R-\nPlatz) eine PV-\u00dcberdachung modellhaft umzusetzen und die Fachaussch\u00fcsse Stadtentwicklung und Bau \nsowie Umwelt, Klima und Ordnung \u00fcber Zwischenst\u00e4nde regelm\u00e4\u00dfig zu informieren. \n5. die personellen Voraussetzungen zu schaffen, um sowohl eine z\u00fcgige Pr\u00fcfung der st\u00e4dtischen D\u00e4cher \nf\u00fcr Solaranlagen zu gew\u00e4hrleisten als auch grundlegende, wiederkehrende Fragen des Denkmalschutzes in \nBezug auf Solaranlagen zu kl\u00e4ren. Kommunale D\u00e4cher oder versiegelte Fl\u00e4chen, die die Leipziger \nKommunale Energieeffizienz GmbH (LKE) nicht zeitnah selbst mit Solaranlagen beplant, werden f\u00fcr externe \nVorhabentr\u00e4ger*innen freigegeben. Eine entsprechende Liste wird bis zum 2. 4. Quartal 2023 auf der \nWebseite der Stadt ver\u00f6ffentlicht. Sobald das Leipziger Solardachkataster \u00fcberarbeitet ist, sollen die \nfreigegebenen Dachfl\u00e4chen dort entsprechend kenntlich gemacht und fortlaufend aktualisiert werden. \nFerner informiert die Stadt, welche Vertragsoptionen f\u00fcr potentielle Vorhabentr\u00e4ger*innen bestehen. \n6. in Baubeschl\u00fcssen transparent zu machen, ob die LKE oder Dritte mit der Solarbest\u00fcckung beauftragt werden. \n \nSachverhalt \nBegr\u00fcndung des Antrags \n \nDie Neufassung \u00fcbernimmt und erg\u00e4nzt den Verwaltungsstandpunkt. \nAus dessen Begr\u00fcndung wird die konkrete Planung von mind. zwei mit Photovoltaik \u00fcberdachten Parkpl\u00e4tzen in den \nBeschlusstext \u00fcbernommen. Es ist Aufgabe der Stadt, bei der Energiewende beispielhaft voranzugehen und zu zeigen, \ndass auch aufwendigere, aber \u00f6kologisch sinnvolle und vorteilhafte Projekte wie die PV-Nutzung versiegelter Fl\u00e4chen \nrealisierbar sind. \nDabei ist darauf hinzuweisen, dass in einer Reihe von Landesbauordnungen ab einer bestimmten Anzahl an Stellpl\u00e4tzen \neine Verpflichtung zu Errichtung einer PV-Anlage bereits aufgenommen wurde, vgl. LBO BW, NRW \u00a7 8 LBO. \n1 von 2 in Zusammenstellung\n2/2 \n \nAus unserem Ursprungsantrag \u00fcbernehmen wir das Anliegen, kommunale Dachfl\u00e4chen oder versiegelte Fl\u00e4chen, die \ndie LKE nicht selbst mit Solanlagen beplant, f\u00fcr externe Vorhabentr\u00e4ger*innen wie Energiegenossenschaften \nfreizugeben. Wenn der \u201eFlaschenhals\u201c bei Personalkapazit\u00e4ten in der Stadtverwaltung liegt, sind an der Stelle des \nEngpasses die personellen Voraussetzungen zu schaffen und ggf. Stellen aus dem Personalpool zu beantragen. \nEbenso scheint es zielf\u00fchrend, wiederkehrend auftretende Fragen des Denkmalschutzes in Bezug auf PV-Anlagen \ngrunds\u00e4tzlich zu kl\u00e4ren, um Prozesse zu standardisieren und zu beschleunigen. \nKern des Antrages, und im Verwaltungsstandpunkt leider nicht zufriedenstellend aufgegriffen ist, der Punkt der \n\u201eD\u00e4cherfreigabe\u201c. Angesichts der Klimakrise m\u00fcssen schnellstm\u00f6glich die Kapazit\u00e4ten erneuerbarer Energien \nausgebaut werden \u2013 das muss sich auch in der Personalstruktur und dem Ambitionsniveau der \u00f6ffentlichen Verwaltung \nwiderspiegeln. Bei 335 grunds\u00e4tzlich in Frage kommenden D\u00e4chern und einer jetzigen eingehenden Pr\u00fcfung von 60 \nD\u00e4chern dauert es \u00fcberschl\u00e4gig \u00fcber f\u00fcnf Jahre bis alle Solarnutzungsm\u00f6glichkeiten erschlossen werden. Der \nKlimanotstand fordert z\u00fcgiges Handeln und B\u00fcrokratie sollte dem Ausbau von Solarenergie nicht im Wege stehen, \nsondern erm\u00f6glichen. \nEs ist gut, wenn das st\u00e4dtische Ziel von j\u00e4hrlich 1.500 kWp Zuwachs an Solarenergie erreicht wird. Noch besser ist es, \nwenn so schnell wie m\u00f6glich so viel wie m\u00f6glich Solarenergie auf Leipzigs D\u00e4chern zur Verf\u00fcgung gestellt wird. Dabei \nk\u00f6nnen auch externe Partner*innen mitwirken. (Dach-) Fl\u00e4chen gibt es noch reichlich.  \n \nAnlage/n \nKeine \n \n2 von 2 in Zusammenstellung\n\tVorlage",
    "name": "Gebt die D\u00e4cher frei!",
    "resolution": null,
    "originator": "Fraktion B\u00fcndnis 90/Die Gr\u00fcnen",
    "paper_type": "Neufassung Antrag",
    "published_at": "2023-05-09",
    "reference": "VII-A-08079-NF-02",
    "url": "https://ratsinformation.leipzig.de/allris_leipzig_public/vo020?VOLFDNR=2010906"
}, {
    "body": "Leipzig",
    "content": "1/2 \n \n \n \n \n  \nschriftliche Antwort zur Anfrage-Nr. VII-F-08507-AW-01 \n \nStatus: \u00f6ffentlich \n \nEingereicht von: \nDezernat Stadtentwicklung und Bau \n \n \n \nBetreff: \nInnenhofbebauung Meusdorfer Stra\u00dfe 57 \n \n \nBeratungsfolge (\u00c4nderungen vorbehalten): \nGremium \nVoraussichtlicher \nSitzungstermin \nZust\u00e4ndigkeit \n   \nRatsversammlung 17.05.2023 schriftliche \nBeantwortung \n \nSachverhalt \n \nFrage 1: Wurde f\u00fcr das o.g. Vorhaben eine Bauvoranfrage oder ein Bauantrag gestellt und \nwenn ja, was beinhaltet diese/r? \n \n Ja, mit Datum vom 19.04.2022 wurde f\u00fcr das Vorhaben \u201eUmbau, Anbau und \nSanierung an ein bestehendes Hintergeb\u00e4ude, Anbau einer Dachterrasse\u201c ein \npositiver Bauvorbescheid durch das Amt f\u00fcr Bauordnung und Denkmalpflege \nerteilt.  \n \n Ja, f\u00fcr das Bauvorhaben \u201eUmnutzung von Backstube und Garage in 2 \nWohnungen, Errichtung von Dachterrassen und Anbau eines Balkons\u201c erteilte Amt \nf\u00fcr Bauordnung und Denkmalpflege am 16.02.2023 eine Baugenehmigung mit \nNebenbestimmungen. \n \nFrage 2:  Wurden bereits Widerspr\u00fcche von Anwohnerinnen eingelegt, wenn ja wie viele? \n \n Ja, gegen die erteilte Baugenehmigung wurde durch einen Nachbarn am \n13.03.2023 Widerspruch eingereicht. Die Widerspruchspr\u00fcfung erfolgt aktuell \ndurch den zust\u00e4ndigen Verfahrensmanager. \n \nFrage 3: Welche Regulierungsm\u00f6glichkeiten sieht die Stadtverwaltung f\u00fcr diese ggf. \ngeplante Hofbebauung vor dem Hintergrund der damit geplanten weiteren \nVerdichtung des Areals, des Wegfalls von Hof-Freiraum-Bereichen, Konflikten mit \nAktivit\u00e4ten des benachbarten Kulturprojektes und vor dem Hintergrund des sich in \nErstellung befindlichen Konzeptes zur doppelten Innenentwicklung? \n \n Das Grundst\u00fcck liegt im unbeplanten Innenbereich und ist daher planungsrechtlich \nnach \u00a7 34 Baugesetzbuch zu beurteilen. Nach Beschluss \u00fcber die Aufhebung der \nSanierungssatzung \u201eLeipzig/Connewitz-Biedermannstra\u00dfe\u201c (Einbringung in die RV \nvoraussichtlich im Mai 2023) bestehen f\u00fcr das Grundst\u00fcck Meusdorfer Stra\u00dfe 57 \nneben der sozialen Erhaltungssatzung f\u00fcr das Gebiet \u201eConnewitz\u201c keine \nRegulierungsm\u00f6glichkeiten nach dem Baugesetzbuch, die \u00fcber die Bestimmungen \ndes \u00a7 34 Baugesetzbuch hinausgehen w\u00fcrden.  \n \n1 von 2 in Zusammenstellung\n2/2 \n \n \nDas in Erarbeitung befindliche Konzept zur doppelten Innenentwicklung soll k\u00fcnftig \ndie gesamtst\u00e4dtische strategische konzeptionelle Grundlage f\u00fcr eine Steuerung \nder st\u00e4dtebaulichen Entwicklung in den bestehenden Stadtquartieren bilden. \nHieraus sollen sich in ihrer Zielrichtung unterschiedliche Ma\u00dfnahmen, wie z.B. die \nBegrenzung der baulichen Entwicklung einerseits oder eine z.B. gezielte \nNachverdichtung andererseits ableiten lassen, die dann wiederum durch die zur \nVerf\u00fcgung stehenden Instrumente des Baugesetzbuches, wie z.B. st\u00e4dtebauliche \nErhaltungssatzungen oder Bauleitpl\u00e4ne umgesetzt werden k\u00f6nnen. Erst mit dem \nInkrafttreten solcher Ortssatzungen bestehen Regulierungsm\u00f6glichkeiten, die \u00fcber \ndie des \u00a7 34 BauGB hinausgehen k\u00f6nnen. \n \nIn welchen Stadtquartieren mit welcher Zielstellung und in welcher Reihenfolge \nggf. notwendige Satzungen aufgestellt werden, steht derzeit noch nicht fest. \n \n \n \nAnlage/n \nKeine \n \n2 von 2 in Zusammenstellung\n\tVorlage",
    "name": "Innenhofbebauung Meusdorfer Stra\u00dfe 57",
    "resolution": null,
    "originator": "Dezernat Stadtentwicklung und Bau",
    "paper_type": "schriftliche Antwort zur Anfrage",
    "published_at": "2023-05-09",
    "reference": "VII-F-08507-AW-01",
    "url": "https://ratsinformation.leipzig.de/allris_leipzig_public/vo020?VOLFDNR=2010758"
}, {
    "body": "Leipzig",
    "content": "1/1 \n \n \n \n \n  \nAnfrage-Nr. VII-F-08632 \n \nStatus: \u00f6ffentlich \n \nEingereicht von: \nOliver Gebhardt \n \n \n \nBetreff: \nEntwicklung von Elektrofahrzeugen in der Stadt und die Vermeidung \nvon 'Lade-Dauer-Parkern' an den Leipziger Ladepunkten \n \n \nBeratungsfolge (\u00c4nderungen vorbehalten): \nGremium \nVoraussichtlicher \nSitzungstermin \nZust\u00e4ndigkeit \n   \nRatsversammlung 14.06.2023 m\u00fcndliche \nBeantwortung \n \nSachverhalt \nDie Anzahl der Elektrofahrzeuge in der Stadt nimmt weiter zu. Die Suche nach einem Ladepunkt ist manchmal \nkomplizierter und wird auch von Fahrzeugen erschwert, die L\u00e4nger als nur w\u00e4hrend des Ladevorgangens auf \ndem Ladeparkplatz stehen.  Ich frage daher: \n \n1. Wie viele Elektro- oder Hybridfahrzeuge sind in Leipzig zugelassen? (bitte j\u00e4hrlich seit 2017 in absoluten Zahlen \nauflisten) \n2. Wie viele Ladepunkte befinden sich im Stadtgebiet? (bitte j\u00e4hrlich seit 2017 in absoluten Zahlen auflisten) \n3. Welche Anzahl von Elektro- oder Hybridfahrzeugen erwartet die Stadt Leipzig bis 2025, 2027 und 2030? \n4. Welche Anzahl von Ladepunkten im Stadtgebiet erwartet die Stadt Leipzig bis 2025, 2027 und 2030? Wie bewertet \nder Oberb\u00fcrgermeister das Verh\u00e4ltnis der erwarteten Zahlen hin zum Anzahl der Ladepunkte? \n5. Wie lange steht ein E-Fahrzeuge durchschnittlich auf einem Ladepunkt, der von der Leipziger Gruppe betrieben wird? \n6. Nach 5 Stunden wird durch die Leipziger Gruppe eine \"Standzeitzulage\" erhoben. Wie h\u00e4ufig geschah dies in den \nletzten 12 Monaten? Wie viele Ladevorg\u00e4nge gab es im genannten Zeitraum insgesamt an den Lades\u00e4ulen der \nLeipziger Gruppe? \n7. Welche Ma\u00dfnahmen k\u00f6nnen dar\u00fcber hinaus durch die Stadt Leipzig ergriffen werden um 'Lade-Dauer-Parker' auf den \nLadepunkten der Leipziger Gruppe zu vermeiden (z.B. Ma\u00dfnahmen durch das Ordnungsamt, Tarifanpassungen, \nzus\u00e4tzliche Standgeb\u00fchren etc.)? \n \nAnlage/n \nKeine \n \n1 von 1 in Zusammenstellung\n\tVorlage",
    "name": "Entwicklung von Elektrofahrzeugen in der Stadt und die Vermeidung von 'Lade-Dauer-Parkern' an den Leipziger Ladepunkten",
    "resolution": null,
    "originator": "Oliver Gebhardt",
    "paper_type": "Anfrage",
    "published_at": "2023-05-09",
    "reference": "VII-F-08632",
    "url": "https://ratsinformation.leipzig.de/allris_leipzig_public/vo020?VOLFDNR=2010843"
}, {
    "body": "Leipzig",
    "content": "1/7 \n \n \nRatsversammlung \n \n  \nNeufassung Beschlussvorlage-Nr. VII-DS-08561-NF-01 \n \nStatus: \u00f6ffentlich \n \nEingereicht von: \nDezernat Allgemeine Verwaltung \n \n \n \nBetreff: \nWahl der Sch\u00f6ffen und ehrenamtlichen Richter f\u00fcr die Jahre 2024 bis \n2028 \n \n \nBeratungsfolge (\u00c4nderungen vorbehalten): \nGremium \nVoraussichtlicher \nSitzungstermin \nZust\u00e4ndigkeit \n   \nFA Allgemeine Verwaltung 09.05.2023 Vorberatung \nRatsversammlung 17.05.2023 Beschlussfassung \n \n \nBeschlussvorschlag \n1. Die Ratsversammlung beschlie\u00dft die Erstellung der Vorschlagsliste f\u00fcr die Sch\u00f6ffen \nund ehrenamtlichen Richter per Streichung der Bewerberliste (inverses \nWahlverfahren), wie in Punkt IV. 2. (1) bis (3) dargestellt. \n2. Die Vorschl\u00e4ge f\u00fcr die Sitze der sieben Vertrauenspersonen f\u00fcr den Wahlausschuss \nbeim Amtsgericht (vgl. \u00a7 40 Abs. 3 GVG) werden gem\u00e4\u00df der Darstellung in Punkt IV. \n2. (4) durch die Fraktionen besetzt. Jede Stadtratsfraktion stellt eine \nVertrauensperson. Verbleibenden Sitze werden in der Rangfolge gem\u00e4\u00df der \nFraktionsgr\u00f6\u00dfe vergeben. Bei Gleichheit der Fraktionsgr\u00f6\u00dfe entscheidet das Los. \n3. Die Ratsversammlung nimmt den in der Vorlage dargestellten Verfahrensablauf zur \nWahl der Sch\u00f6ffen und ehrenamtlichen Richter zur Kenntnis. \n \n \nZusammenfassung \n \nAnlass der Vorlage:    \n \n  Rechtliche Vorschriften   Stadtratsbeschluss X  Verwaltungshandeln \n \n  Sonstiges: \n \nMit der Vorlage soll die Erstellung der Vorschlagsliste f\u00fcr die Wahl der Sch\u00f6ffen und \nehrenamtlichen Richter f\u00fcr die Jahre 2024 bis 2028 beschlossen werden. Daneben soll das \nVorgehen zur Wahl der Vertrauenspersonen f\u00fcr den Wahlausschuss beim Amtsgericht \nbeschlossen werden \n \n \n \n \n \n1 von 7 in Zusammenstellung\n2/7 \n \n \n \nFinanzielle Auswirkungen \nFinanzielle Auswirkungen X nein  wenn ja, \nKosteng\u00fcnstigere Alternativen gepr\u00fcft  nein  ja, Ergebnis siehe Anlage zur Begr\u00fcndung \nFolgen bei Ablehnung  nein  ja, Erl\u00e4uterung siehe Anlage zur Begr\u00fcndung \nHandelt es sich um eine Investition (damit aktivierungspflichtig)?  nein  ja, Erl\u00e4uterung siehe Anlage zur Begr\u00fcndung \n  \nIm Haushalt wirksam von bis H\u00f6he in EUR wo veranschlagt \nErgebnishaushalt Ertr\u00e4ge     \n Aufwendungen     \nFinanzhaushalt Einzahlungen     \n Auszahlungen     \nEntstehen Folgekosten oder Einsparungen?  nein  wenn ja, nachfolgend angegeben \n \nFolgekosten Einsparungen wirksam von bis H\u00f6he in EUR/Jahr wo veranschlagt \nZu Lasten anderer OE Ergeb. HH Ertr\u00e4ge     \n Ergeb. HH Aufwand     \nNach Durchf\u00fchrung der \nMa\u00dfnahme zu erwarten Ergeb. HH Ertr\u00e4ge     \n Ergeb. HH Aufwand (ohne \nAbschreibungen)     \n Ergeb. HH Aufwand aus \nj\u00e4hrl. Abschreibungen      \n    \nSteuerrechtliche Pr\u00fcfung  X nein  wenn ja \nUnternehmerische T\u00e4tigkeit i.S.d. \u00a7\u00a7 2 Abs. 1 und 2B \nUStG   nein  ja, Erl\u00e4uterung siehe Punkt 4 des Sachverhalts \nUmsatzsteuerpflicht der Leistung   nein  ja, Erl\u00e4uterung siehe Anlage zur Begr\u00fcndung \nBei Vertr\u00e4gen: Umsatzsteuerklausel aufgenommen   ja  nein, Erl\u00e4uterung siehe Anlage zur Begr\u00fcndung \n \nAuswirkungen auf den Stellenplan X nein  wenn ja, nachfolgend angegeben \nBeantragte Stellenerweiterung:  Vorgesehener Stellenabbau:  \n \n \n \n \n \n \n \n \n \n \n \n \n \n \n \n \n \n \n \n2 von 7 in Zusammenstellung\n3/7 \n \nZiele \nHintergrund zum Beschlussvorschlag: \nWelche strategischen Ziele werden mit der Ma\u00dfnahme unterst\u00fctzt? \n  \n \n2030 \u2013 Leipzig w\u00e4chst nachhaltig! \nZiele und Handlungsschwerpunkte \nLeipzig setzt auf  \nLebensqualit\u00e4t \nLeipzig besteht im  \nWettbewerb \n Balance zwischen \nVerdichtung und Freiraum \n Positive \nRahmenbedingungen f\u00fcr \nqualifizierte Arbeitspl\u00e4tze \n Qualit\u00e4t im \u00f6ffentlichen Raum \nund in der Baukultur \n Attraktives Umfeld f\u00fcr \nInnovation, Gr\u00fcnder und \nFachkr\u00e4fte \n Nachhaltige Mobilit\u00e4t \n \n Vielf\u00e4ltige und stabile \nWirtschaftsstruktur \n Vorsorgende Klima- und \nEnergiestrategie \n Vorsorgendes Fl\u00e4chen- und \nLiegenschafts-management \n Erhalt und Verbesserung der \nUmweltqualit\u00e4t \n Leistungsf\u00e4hige technische \nInfrastruktur \n Quartiersnahe Kultur-, Sport- \nund Freiraum-angebote \n \n \n Vernetzung von Bildung, \nForschung und Wirtschaft \nLeipzig schafft soziale Stabilit\u00e4t  Wirkung auf Akteure \nLeipzig st\u00e4rkt seine \nInternationalit\u00e4t \n Chancengerechtigkeit in der \ninklusiven Stadt \n B\u00fcrgerstadt  Weltoffene Stadt \n Gemeinschaftliche \nQuartiersentwicklung \n Region  Vielf\u00e4ltige, lebendige Kultur- \nund Sportlandschaft \n Bezahlbares Wohnen  Stadtrat  Interdisziplin\u00e4re \nWissenschaft und exzellente \nForschung \n Zukunftsorientierte Kita- und \nSchulangebote \n Kommunalwirtschaft  Attraktiver Tagungs- und \nTourismusstandort \n Lebenslanges Lernen  Verwaltung  Imagepr\u00e4gende \nGro\u00dfveranstaltungen \n Sichere Stadt    Globales Denken, lokal \nverantwortliches Handeln \n      \n Sonstige Ziele \nBei Bedarf \u00fcberschreiben (max. 50 ZML) \nX Trifft nicht zu     \n \n \n \n \n \n \n \n \n \n \n3 von 7 in Zusammenstellung\n4/7 \n \nKlimawirkung \nKlimawirkung durch den Beschluss der Vorlage \nStufe 1: Grobe Einordnung zur Klimawirkung (Klimaschutzes und zur \u2013wandelanpassung) \nEingesetzte Energietr\u00e4ger (Strom, \nW\u00e4rme, Brennstoff) x keine / Aussage nicht m\u00f6glich  erneuerbar  fossil \nReduziert bestehenden Energie-\n/Ressourcenverbrauch x Aussage nicht m\u00f6glich  ja  nein \nSpeichert CO2-Emissionen (u.a. \nBaumpflanzungen) x Aussage nicht m\u00f6glich  ja  nein \nMindert die Auswirkungen des \nKlimawandels (u. a. Entsiegelung, \nRegenwassermanagement) \nx Aussage nicht m\u00f6glich  ja  nein \nAbsch\u00e4tzbare Klimawirkung mit \nerheblicher Relevanz  ja, da Beschlussgremium RV, GVA, oder VA und mind. 5 \nJahre Betriebs- und Nutzungsdauer x nein \nVorlage hat keine absch\u00e4tzbare \nKlimawirkung X ja (Pr\u00fcfschema endet hier.)   \n \nStufe 2: Die Vorlage ber\u00fccksichtigt die zentralen energie- und klimapolitischen Beschl\u00fcsse (s. \nleipzig.de) \n  ja  nein (Begr\u00fcndung s. Abw\u00e4gungsprozess)  nicht ber\u00fchrt (Pr\u00fcfschema endet \nhier.) \n       \nStufe 3: Detaillierte Darstellung zur absch\u00e4tzbaren Klimawirkung nur bei erheblicher Relevanz \n  Berechnete THG-Emissionen (in t bzw. t./a): ____________________ \n  liegt vor: s. Anlage/Kapitel der Vorlage: ________________________ \n  wird vorgelegt mit: ________________ (z. B. Planungsbeschluss, Baubeschluss, Billigungs- und \nAuslegungsbeschluss) \n   \n \n \n \nSachverhalt \nBeschreibung des Abw\u00e4gungsprozesses:   \nentf\u00e4llt \n \n  \nI.  Eilbed\u00fcrftigkeitsbegr\u00fcndung  \nDie Bekanntgabe der erforderlichen Zahl an Personen f\u00fcr die Vorschlagsliste, die Grundlage \ndieser Vorlage ist, erfolgte Anfang April 2023 durch das zust\u00e4ndige Gericht. Sp\u00e4testens zum \n30. Juni 2023 ist durch den Stadtrat eine Vorschlagsliste f\u00fcr die zu w\u00e4hlenden Sch\u00f6ffen \naufzustellen. In der Stadtratssitzung am 14. Juni 2023 muss daher \u00fcber die Aufnahme der \nBewerber in die Sch\u00f6ffen-Vorschlagsliste entschieden werden. Daneben sind f\u00fcr den \nWahlausschuss durch den Stadtrat sieben Vertrauenspersonen zu w\u00e4hlen. Die \nWahlmodalit\u00e4ten sollen daher m\u00f6glichst zuvor in der Ratsversammlung am 17. Mai 2023, \nggf. im Fortsetzungstermin am 31. Mai 2023, beschlossen werden. \n  \nII.  Begr\u00fcndung Nicht\u00f6ffentlichkeit   \nentf\u00e4llt  \n  \nIII.   Strategische Ziele  \nentf\u00e4llt \n  \n4 von 7 in Zusammenstellung\n5/7 \n \nIV.  Sachverhalt  \n \n1.  Anlass  \n \n2.  Beschreibung der Ma\u00dfnahme  \n \nVorbemerkungen \nIm Jahr 2023 sind die Sch\u00f6ffen, Jugendsch\u00f6ffen beim Amts- und Landgericht sowie die \nehrenamtlichen Richter beim Verwaltungsgericht f\u00fcr die Gesch\u00e4ftsjahre 2024 bis 2028 zu \nw\u00e4hlen. Die rechtliche Grundlage daf\u00fcr bilden Gerichtsverfassungsgesetz (GVG; Sch\u00f6ffen & \nJugendsch\u00f6ffen) und Verwaltungsgerichtsordnung (VwGO; ehrenamtliche Richter) sowie die \nGemeinsame Verwaltungsvorschrift des S\u00e4chsischen Staatsministeriums der Justiz und des \nS\u00e4chsischen Staatsministeriums des Innern zur Vorbereitung und Durchf\u00fchrung der Wahl \nund Berufung der Sch\u00f6ffen und Jugendsch\u00f6ffen (VwV f\u00fcr die Sch\u00f6ffen- und \nJugendsch\u00f6ffen). \n  \nDiese Vorlage regelt N\u00e4heres und informiert zur Wahl der Sch\u00f6ffen und ehrenamtlichen \nRichter. Auf die Besetzung der Jugendsch\u00f6ffen wird hier nur rein informativ eingegangen. \nDie Zust\u00e4ndigkeit f\u00fcr die Ermittlung der Vorschlagslisten liegt beim Jugendhilfeausschuss, \nder entsprechende Prozess ist nicht Gegenstand dieser Vorlage. Der Jugendhilfeausschuss \nwird separat \u00fcber Fristen und Ablauf der Jugendsch\u00f6ffenwahl informiert. \n  \nIn der Verwaltungsvorschrift bzw. der Verwaltungsgerichtsordnung ist festgelegt, dass die \nSch\u00f6ffen und Jugendsch\u00f6ffen (f\u00fcr Strafsachen bzw. Jugendstrafsachen beim Amts- bzw. \nLandgericht) sowie die ehrenamtlichen Richter beim Verwaltungsgericht durch einen \nWahlausschuss am jeweiligen Gericht aus den Vorschlagslisten der Gemeinden im \njeweiligen Gerichtsbezirk zu w\u00e4hlen sind. Sp\u00e4testens zum 30. Juni 2023 ist durch die \nGemeinden je eine Vorschlagsliste f\u00fcr die zu w\u00e4hlenden Sch\u00f6ffen bzw. Jugendsch\u00f6ffen \naufzustellen (abweichend hiervon f\u00fcr die ehrenamtlichen Richter in der Ratsversammlung \nam 20. September 2023). Zur Aufnahme in die Vorschlagsliste ist bei den Sch\u00f6ffen die \nZustimmung von zwei Dritteln der anwesenden Mitglieder des Stadtrates, mindestens jedoch \nder H\u00e4lfte der gesetzlichen Zahl der Mitglieder des Stadtrates, im Falle der Jugendsch\u00f6ffen \nvon zwei Dritteln der stimmberechtigten Mitglieder des Jugendhilfeausschusses erforderlich \n(\u00a7 36 GVG). \n  \nUnmittelbar nach der Aufstellung sind die Vorschlagslisten eine Woche lang zu jedermanns \nEinsicht auszulegen. Beginn und Ende der Auslegungsfrist sind \u00f6ffentlich bekannt zu ma-\nchen. Gegen die Vorschlagslisten kann binnen einer Woche nach Ablauf der Auslegungsfrist \nEinspruch erhoben werden (\u00a7 37 GVG). F\u00fcr den Wahlausschuss beim Amtsgericht sind \ndurch den Stadtrat sieben Vertrauenspersonen zu w\u00e4hlen (\u00a7 40 GVG). Der \nOberb\u00fcrgermeister wird durch den Beigeordneten f\u00fcr Allgemeine Verwaltung im \nWahlausschuss vertreten. \n  \nF\u00fcr die Aufnahme in die Vorschlagsliste f\u00fcr ehrenamtliche Richter beim Verwaltungsgericht \nist ebenfalls eine Zwei-Drittel-Mehrheit der anwesenden Mitglieder des Stadtrates, \nmindestens jedoch der H\u00e4lfte der gesetzlichen Zahl der Mitglieder des Stadtrates, \nerforderlich. Eine Auslegung der Vorschlagsliste zur Einsichtnahme erfolgt nicht. Die \n\u00dcbermittlung der Vorschlagsliste an das Verwaltungsgericht erfolgt voraussichtlich erst im \nvierten Quartal. \n  \nZust\u00e4ndig f\u00fcr die Realisierung der Aufgaben der Stadt Leipzig zur Vorbereitung und \nDurchf\u00fchrung der Wahl der Sch\u00f6ffen und ehrenamtlichen Richter am Verwaltungsgericht ist \ndas Amt f\u00fcr Statistik und Wahlen und das B\u00fcro f\u00fcr Ratsangelegenheiten. Die nachfolgend \nvorgeschlagene Verfahrensweise zur Wahl der Sch\u00f6ffen und ehrenamtlichen Richter \nentspricht im Grundsatz der bereits 2018 praktizierten Verfahrensweise. \n  \n  \n \n5 von 7 in Zusammenstellung\n6/7 \n \nVorgeschlagene Verfahrensweise \n  \n(1) In der Stadtratssitzung am 14. Juni 2023 wird unter Regie des B\u00fcros f\u00fcr Ratsangelegen-\nheiten \u00fcber die Aufnahme der Bewerber in die Sch\u00f6ffen-Vorschlagsliste entschieden. \nDazu ist die Zustimmung von zwei Dritteln der anwesenden Mitglieder des Stadtrates, \nmindestens jedoch der H\u00e4lfte der gesetzlichen Mitgliederzahl erforderlich. Durch das Amt \nf\u00fcr Statistik und Wahlen wird eine entsprechende Liste vorbereitet, in der alle bis zum \n31. M\u00e4rz 2023 eingegangenen Bewerbungen ber\u00fccksichtigt werden. \n \nIn geheimer Wahl sind durch die Stadtr\u00e4te die Namen der Bewerber zu streichen, die \nnicht in die Vorschlagsliste aufgenommen werden sollen (inverses Wahlverfahren). \nEin regul\u00e4res Wahlverfahren w\u00fcrde die Zustimmung jedes Stadtrates bzw. jeder \nStadtr\u00e4tin zu jeder einzelnen Sch\u00f6ffenbewerbung erfordern, was einer Zustimmung zu \nca. 950 Wahlvorschl\u00e4gen aus 1.300 Bewerbungen bedarf und damit f\u00fcr die Ratsarbeit \nweder organisatorisch noch zeitlich praktikabel w\u00e4re. \n  \n(2) [gestrichen] \n  \n(3) F\u00fcr den Fall, dass weniger Bewerber als die vom jeweiligen Gericht mitgeteilte \nMindestzahl die notwendige Stimmenzahl erreichen, finden weitere Wahlg\u00e4nge bis zum \nErreichen der Mindestzahl statt. Dabei stehen jeweils nur die Bewerber zur Wahl, die \nbisher nicht gew\u00e4hlt wurden. \n  \n(4) F\u00fcr den Wahlausschuss sind durch den Stadtrat sieben Vertrauenspersonen zu w\u00e4hlen. \nDie Vorschl\u00e4ge f\u00fcr diese Wahl erfolgen durch die Fraktionen bis zum 1. Juni 2023 an das \nB\u00fcro f\u00fcr Ratsangelegenheiten nach dem folgenden Prozedere: \n  \n Grundlage ist, dass f\u00fcr jede Fraktion das Vorschlagsrecht f\u00fcr einen Sitz vergeben wird. \nVerbleibenden Sitze werden in der Rangfolge gem\u00e4\u00df der Fraktionsgr\u00f6\u00dfe vergeben. Bei \nGleichheit der Fraktionsgr\u00f6\u00dfe entscheidet das Los unter Anwesenheit des Leiters des \nB\u00fcros f\u00fcr Ratsangelegenheiten, des Leiters des Amtes f\u00fcr Statistik und Wahlen und je \neines Fraktionsvertreters bzw. einer Vertreterin der betroffenen Fraktionen. \n  \n Die Wahl der Vertrauenspersonen erfolgt ebenfalls in der Stadtratssitzung am 14. Juni \n2023. Zur Wahl ist die Zustimmung von zwei Dritteln der anwesenden Mitglieder des \nStadtrates, mindestens jedoch der H\u00e4lfte der gesetzlichen Mitgliederzahl erforderlich. \n  \n(5) Die Aufstellung der Vorschlagsliste f\u00fcr ehrenamtliche Richter beim Verwaltungsgericht \nerfolgt in der Stadtratssitzung am 20. September 2023 gem\u00e4\u00df der oben genannten \nVerfahrensweise. Aufgenommen werden alle Bewerber, die sich bis zum 22. Mai 2023 \ngemeldet haben. \n  \nBegr\u00fcndung \n  \nIn der Gemeinsamen Verwaltungsvorschrift des S\u00e4chsischen Staatsministeriums der Justiz \nund des S\u00e4chsischen Staatsministeriums des Innern zur Vorbereitung und Durchf\u00fchrung der \nWahl und Berufung der Sch\u00f6ffen und Jugendsch\u00f6ffen (Sch\u00f6ffen- und Jugendsch\u00f6ffen VwV) \nbzw. der Verwaltungsgerichtsordnung ist festgelegt, dass die Gemeinden f\u00fcr die Aufstellung \nder Vorschlagslisten f\u00fcr die Sch\u00f6ffen, Jugendsch\u00f6ffen und ehrenamtlichen Richter beim \nVerwaltungsgericht zust\u00e4ndig sind. \n  \nDer vorstehende Ablauf dieser Aufstellung entspricht diesen Festlegungen. Grunds\u00e4tzlich \nentspricht die gesamte Verfahrensweise dem Ablauf wie vor f\u00fcnf Jahren. Gem\u00e4\u00df Mitteilung \ndes Landgerichtspr\u00e4sidenten sind in die Vorschlagsliste f\u00fcr Sch\u00f6ffen insgesamt 948 \nPersonen aufzunehmen, in die Vorschlagsliste f\u00fcr Jugendsch\u00f6ffen insgesamt 396 Personen. \nDie per vorl\u00e4ufiger Information bekanntgegebene Zahl der vorzuschlagenden Personen f\u00fcr \ndie Liste der ehrenamtlichen Richter am Verwaltungsgericht betr\u00e4gt 94 Personen. \n  \n6 von 7 in Zusammenstellung\n7/7 \n \n3.  Realisierungs- / Zeithorizont  \n- \n  \n4.  Finanzielle Auswirkungen  \n- \n  \n5.  Auswirkungen auf den Stellenplan  \nkeine -  \n  \n6.  B\u00fcrgerbeteiligung  \n  \n  bereits erfolgt   geplant X  nicht n\u00f6tig \n \n7.  Besonderheiten   \n- \n  \n8.  Folgen bei Nichtbeschluss  \nBei Nichtbeschluss w\u00e4ren wichtige Modalit\u00e4ten f\u00fcr das Wahlverfahren zur Erstellung der \nVorschlagsliste f\u00fcr die Wahl der Sch\u00f6ffen, ehrenamtlichen Richter sowie \nVertrauenspersonen f\u00fcr den Wahlausschuss beim Amtsgericht nicht festgelegt. \n \n \nAnlage/n \nKeine \n \n7 von 7 in Zusammenstellung\n\tVorlage",
    "name": "Wahl der Sch\u00f6ffen und ehrenamtlichen Richter f\u00fcr die Jahre 2024 bis 2028",
    "resolution": null,
    "originator": "Dezernat Allgemeine Verwaltung",
    "paper_type": "Neufassung Beschlussvorlage",
    "published_at": "2023-05-09",
    "reference": "VII-DS-08561-NF-01",
    "url": "https://ratsinformation.leipzig.de/allris_leipzig_public/vo020?VOLFDNR=2010860"
}, {
    "body": "Leipzig",
    "content": "1/1 \n \n \n \n \n  \nAnfrage-Nr. VII-F-08613 \n \nStatus: \u00f6ffentlich \n \nEingereicht von: \nFraktion DIE LINKE \n \n \n \nBetreff: \nAnwendbarkeit des Tarifabschlusses TV\u00f6D auf freie Tr\u00e4ger \n \n \nBeratungsfolge (\u00c4nderungen vorbehalten): \nGremium \nVoraussichtlicher \nSitzungstermin \nZust\u00e4ndigkeit \n   \nRatsversammlung 17.05.2023 m\u00fcndliche/schriftliche \nBeantwortung \n \nSachverhalt \nBereits in der Tarifrunde 2020 wurde f\u00fcr den \u00f6ffentlichen Dienst die Zahlung einer Corona-\nPr\u00e4mie au\u00dferhalb des regul\u00e4ren Arbeitsentgeltes vereinbart. In der Folge gab es eine \numfangreiche Debatte \u00fcber die Anwendbarkeit der Vereinbarung auf freie Tr\u00e4ger (der \nJugendhilfe oder im Bereich der freien Wohlfahrtspflege und Migrant*innenhilfe), die ihre \nBesch\u00e4ftigten zwar in Anlehnung an den TV\u00f6D bezahlen, jedoch nicht unmittelbar dem \nTarifvertrag angeh\u00f6ren. In der Tarifrunde 2023 wurde erneut ein \u201eInflationsausgleichsgeld\u201c \nau\u00dferhalb der regul\u00e4ren Tariferh\u00f6hung vereinbart. Es steht zu bef\u00fcrchten, dass zahlreiche \nBesch\u00e4ftigte, die \u201enur\u201c in Anlehnung an den TV\u00f6D bezahlt werden, hiervon nicht profitieren \nwerden. Vor diesem Hintergrund fragen wir an: \n \n1. Beabsichtigt die Stadt denjenigen freien Tr\u00e4gern, die sich innerhalb einer F\u00f6rderung \nder Stadt Leipzig befinden und ihre Besch\u00e4ftigten in Anlehnung an den TV\u00f6D \nbezahlen, auch die Auszahlung der Inflationsausgleichspr\u00e4mie an die Besch\u00e4ftigten \nzur refinanzieren?  \n2. Wie verh\u00e4lt es sich im Bereich von Finanzierungsvereinbarungen (bspw. Hilfen zur \nErziehung oder Kita)? \n3. Welche Mehrkosten k\u00e4men auf die Stadt Leipzig zu, falls dies so umgesetzt werden \nw\u00fcrde? Bitte nach Bereichen aufschl\u00fcsseln. \n4. Falls nein zu Frage 1: Welche Voraussetzungen m\u00fcssen gegeben sein, damit die Stadt \ndie Auszahlung einer Inflationsausgleichspr\u00e4mie an die Besch\u00e4ftigten refinanziert? \n5. Beabsichtigt die Stadt, die freien Tr\u00e4ger proaktiv \u00fcber die o.g. Voraussetzungen zu \ninformieren, um m\u00f6glichst vielen Besch\u00e4ftigten die Auszahlung einer \nInflationsausgleichspr\u00e4mie zu erm\u00f6glichen und somit die Besch\u00e4ftigung in der \nF\u00f6rderung der Stadt Leipzig (bspw. im Bereich der Jugendhilfe oder freien \nWohlfahrtspflege) attraktiv zu halten? \n \nAnlage/n \nKeine \n \n1 von 1 in Zusammenstellung\n\tVorlage",
    "name": "Anwendbarkeit des Tarifabschlusses TV\u00f6D auf freie Tr\u00e4ger",
    "resolution": null,
    "originator": "Fraktion DIE LINKE",
    "paper_type": "Anfrage",
    "published_at": "2023-05-09",
    "reference": "VII-F-08613",
    "url": "https://ratsinformation.leipzig.de/allris_leipzig_public/vo020?VOLFDNR=2010790"
}, {
    "body": "Leipzig",
    "content": "1/2 \n \n \n \n \n  \nAntrag-Nr. VII-A-08607 \n \nStatus: \u00f6ffentlich \n \nEingereicht von: \nFraktion B\u00fcndnis 90/Die Gr\u00fcnen \n \n \nStammbaum: \n \nVII-A-08607 Fraktion B\u00fcndnis 90/Die Gr\u00fcnen \n \nBetreff: \nSchaffung von Wohnraum vorantreiben \u2013 Wohnungsbaukoordinator*in \neinsetzen \n \n \nBeratungsfolge (\u00c4nderungen vorbehalten): \nGremium \nVoraussichtlicher \nSitzungstermin \nZust\u00e4ndigkeit \n   \nRatsversammlung 17.05.2023 Verweisung in die \nGremien \nFA Stadtentwicklung und Bau 30.05.2023 1. Lesung \nzeitweilig beratender Ausschuss Wohnen 30.05.2023 1. Lesung \n \n \nBeschlussvorschlag \nDer Oberb\u00fcrgermeister wird beauftragt, die Schaffung von Wohnraum durch \neine beschleunigte \u00e4mter- und dezernats\u00fcbergreifende Zusammenarbeit bei \nder Planung und Genehmigung von Wohnungsbauvorhaben zu unterst\u00fctzen. \nHierzu ist ein*e Wohnungsbaukoordinator*in einzusetzen und mit den \nnotwendigen Befugnissen zur z\u00fcgigen Kl\u00e4rung \u00e4mter- und \ndezernats\u00fcbergreifender Konflikte auszustatten. Begleitende Ma\u00dfnahmen zur \nBeschleunigung von Planungs- und Genehmigungsprozessen sind zu pr\u00fcfen. \n \nSachverhalt \nBegr\u00fcndung des Antrags \n \nBedingt durch deutlich anziehende Bauzinsen und -kosten drohen auch in Leipzig deutlich weniger Vorhaben f\u00fcr \nSanierung und Neubau von Wohnraum geplant und umgesetzt zu werden. Bei gleichzeitig unvermindertem \nBev\u00f6lkerungszuzug droht sich dadurch die ohnehin angespannte Lage des Wohnungsmarkts weiter zu versch\u00e4rfen. \nWesentliche Stellschrauben zur L\u00f6sung, insbesondere zur finanziellen St\u00e4rkung des sozialen und kommunalen \nWohnungsbaus sowie zur Vereinfachung von Vorgaben, liegen bei Bund und Freistaat. Unabh\u00e4ngig davon sollten \nbestehende Hemmnisse auf kommunaler Ebene soweit wie m\u00f6glich abgebaut werden. \n \nAuf der Grundlage des Wohnungspolitischen Konzepts hat die Stadt Leipzig in den letzten Jahren bereits umfangreich \nvorhandene Spielr\u00e4ume genutzt, um in erheblichem Umfang zus\u00e4tzlichen Wohnraum zu schaffen. Dies wurde \nma\u00dfgeblich unterst\u00fctzt durch die Verwaltung, die einen entsprechend deutlichen Zuwachs an Genehmigungsverfahren \ngemeistert hat. \n \nGleichwohl treten in Planungs- und Genehmigungsprozessen bei der Kl\u00e4rung dezernats\u00fcbergreifender Konflikte immer \nwieder Verz\u00f6gerungen auf, deren z\u00fcgige Kl\u00e4rung durch den hierf\u00fcr zust\u00e4ndigen Oberb\u00fcrgermeister nur unzureichend \nwahrgenommen wird. Auf dieser Ebene gibt es deutliches Optimierungspotential f\u00fcr eine z\u00fcgigere Planung und \nGenehmigung von Wohnungsbauvorhaben. \n \nEin*e Wohnungsbaukoordinator*in, wie z.B. in Hamburg, Stuttgart oder Berlin vorhanden, kann bei \n1 von 2 in Zusammenstellung\n2/2 \n \nVerfahrenshemmnissen als Ansprechperson f\u00fcr Investierende dienen und aktiv Abstimmungsprozesse zwischen den \n\u00c4mtern und Dezernaten bef\u00f6rdern. Diese Person ist mit notwendigen Befugnissen auszustatten, um \u00e4mter- und \ndezernats\u00fcbergreifende Konflikte im Sinne der Wohnraumschaffung kl\u00e4ren zu k\u00f6nnen. Dazu z\u00e4hlen umfangreiche \nInformations- und Beteiligungsrechte sowie die M\u00f6glichkeit, Dienstwege abzuk\u00fcrzen und auf Basis von \nKompromissvorschl\u00e4gen z\u00fcgig Entscheidungen auf h\u00f6herer Ebene herbeif\u00fchren zu k\u00f6nnen. \n \nDie Einrichtung und konkrete Umsetzung einer solchen Stelle ist im B\u00fcndnis f\u00fcr Wohnen zu diskutieren. Dabei ist auch \ndie personelle Unterst\u00fctzung, ggf. die Einrichtung eines zuarbeitenden Stabs, zu er\u00f6rtern. Begleitend sind neben der \ndigitalen Bauakte auch Optimierungen in den Prozessen wie z.B. Normzeiten und Richtlinien innerhalb der \nGenehmigungsverfahren zu pr\u00fcfen. Ebenso ist in den Blick zu nehmen, ob weitere Zust\u00e4ndigkeiten, wie z.B. die \nMinderung des \u00dcberhangs von bereits genehmigten, aber nicht umgesetzten Bauvorhaben oder die Schaffung von \nWohnraum f\u00fcr besondere Bedarfsgruppen (Housing First, Gefl\u00fcchtete und Migration, u.a.) sinnvoll sind. \n \nAnlage/n \nKeine \n \n2 von 2 in Zusammenstellung\n\tVorlage",
    "name": "Schaffung von Wohnraum vorantreiben \u2013 Wohnungsbaukoordinator*in einsetzen",
    "resolution": null,
    "originator": "Fraktion B\u00fcndnis 90/Die Gr\u00fcnen",
    "paper_type": "Antrag",
    "published_at": "2023-05-09",
    "reference": "VII-A-08607",
    "url": "https://ratsinformation.leipzig.de/allris_leipzig_public/vo020?VOLFDNR=2010779"
}, {
    "body": "Leipzig",
    "content": "Tagged PDF\n1/7 \n \n \nRatsversammlung \n \n  \nBeschlussvorlage-Nr. VII-DS-08561 \n \nStatus: \u00f6ffentlich \n \nEingereicht von: \nDezernat Allgemeine Verwaltung \n \n \n \nBetreff: \nWahl der Sch\u00f6ffen und ehrenamtlichen Richter f\u00fcr die Jahre 2024 bis \n2028 \n \n \nBeratungsfolge (\u00c4nderungen vorbehalten): \nGremium \nVoraussichtlicher \nSitzungstermin \nZust\u00e4ndigkeit \n   \nDB OBM - Vorabstimmung 28.04.2023 Vorberatung \nDienstberatung des Oberb\u00fcrgermeisters 02.05.2023 Best\u00e4tigung \nFA Allgemeine Verwaltung 09.05.2023 Vorberatung \nRatsversammlung 17.05.2023 Beschlussfassung \n \n \nBeschlussvorschlag \n1. Die Ratsversammlung beschlie\u00dft die Erstellung der Vorschlagsliste f\u00fcr die Sch\u00f6ffen \nund ehrenamtlichen Richter per Streichung der Bewerberliste (inverses \nWahlverfahren), wie in Punkt IV. 2. (1) bis (3) dargestellt. \n2. Die Vorschl\u00e4ge f\u00fcr die Sitze der sieben Vertrauenspersonen f\u00fcr den Wahlausschuss \nbeim Amtsgericht (vgl. \u00a7 40 Abs. 3 GVG) werden gem\u00e4\u00df der Darstellung in Punkt IV. \n2. (4) durch die Fraktionen besetzt. Jede Stadtratsfraktion stellt eine \nVertrauensperson. Verbleibenden Sitze werden in der Rangfolge gem\u00e4\u00df der \nFraktionsgr\u00f6\u00dfe vergeben. Bei Gleichheit der Fraktionsgr\u00f6\u00dfe entscheidet das Los. \n3. Die Ratsversammlung nimmt den in der Vorlage dargestellten Verfahrensablauf zur \nWahl der Sch\u00f6ffen und ehrenamtlichen Richter zur Kenntnis. \n \n \nZusammenfassung \n \nAnlass der Vorlage:    \n \n  Rechtliche Vorschriften   Stadtratsbeschluss X  Verwaltungshandeln \n \n  Sonstiges: \n \nMit der Vorlage soll die Erstellung der Vorschlagsliste f\u00fcr die Wahl der Sch\u00f6ffen und \nehrenamtlichen Richter f\u00fcr die Jahre 2024 bis 2028 beschlossen werden. Daneben soll das \nVorgehen zur Wahl der Vertrauenspersonen f\u00fcr den Wahlausschuss beim Amtsgericht \nbeschlossen werden. \n \n \n \n \n1 von 7 in Zusammenstellung\n2/7 \n \nFinanzielle Auswirkungen \nFinanzielle Auswirkungen X nein  wenn ja, \nKosteng\u00fcnstigere Alternativen gepr\u00fcft  nein  ja, Ergebnis siehe Anlage zur Begr\u00fcndung \nFolgen bei Ablehnung  nein  ja, Erl\u00e4uterung siehe Anlage zur Begr\u00fcndung \nHandelt es sich um eine Investition (damit aktivierungspflichtig)?  nein  ja, Erl\u00e4uterung siehe Anlage zur Begr\u00fcndung \n  \nIm Haushalt wirksam von bis H\u00f6he in EUR wo veranschlagt \nErgebnishaushalt Ertr\u00e4ge     \n Aufwendungen     \nFinanzhaushalt Einzahlungen     \n Auszahlungen     \nEntstehen Folgekosten oder Einsparungen?  nein  wenn ja, nachfolgend angegeben \n \nFolgekosten Einsparungen wirksam von bis H\u00f6he in EUR/Jahr wo veranschlagt \nZu Lasten anderer OE Ergeb. HH Ertr\u00e4ge     \n Ergeb. HH Aufwand     \nNach Durchf\u00fchrung der \nMa\u00dfnahme zu erwarten Ergeb. HH Ertr\u00e4ge     \n Ergeb. HH Aufwand (ohne \nAbschreibungen)     \n Ergeb. HH Aufwand aus \nj\u00e4hrl. Abschreibungen      \n    \nSteuerrechtliche Pr\u00fcfung  X nein  wenn ja \nUnternehmerische T\u00e4tigkeit i.S.d. \u00a7\u00a7 2 Abs. 1 und 2B \nUStG   nein  ja, Erl\u00e4uterung siehe Punkt 4 des Sachverhalts \nUmsatzsteuerpflicht der Leistung   nein  ja, Erl\u00e4uterung siehe Anlage zur Begr\u00fcndung \nBei Vertr\u00e4gen: Umsatzsteuerklausel aufgenommen   ja  nein, Erl\u00e4uterung siehe Anlage zur Begr\u00fcndung \n \nAuswirkungen auf den Stellenplan X nein  wenn ja, nachfolgend angegeben \nBeantragte Stellenerweiterung:  Vorgesehener Stellenabbau:  \n \n \n \n \n \n \n \n \n \n \n \n \n \n \n \n \n \n \n \n \n \n2 von 7 in Zusammenstellung\n3/7 \n \n \nZiele \nHintergrund zum Beschlussvorschlag: \nWelche strategischen Ziele werden mit der Ma\u00dfnahme unterst\u00fctzt? \n  \n \n2030 \u2013 Leipzig w\u00e4chst nachhaltig! \nZiele und Handlungsschwerpunkte \nLeipzig setzt auf  \nLebensqualit\u00e4t \nLeipzig besteht im  \nWettbewerb \n Balance zwischen \nVerdichtung und Freiraum \n Positive \nRahmenbedingungen f\u00fcr \nqualifizierte Arbeitspl\u00e4tze \n Qualit\u00e4t im \u00f6ffentlichen Raum \nund in der Baukultur \n Attraktives Umfeld f\u00fcr \nInnovation, Gr\u00fcnder und \nFachkr\u00e4fte \n Nachhaltige Mobilit\u00e4t \n \n Vielf\u00e4ltige und stabile \nWirtschaftsstruktur \n Vorsorgende Klima- und \nEnergiestrategie \n Vorsorgendes Fl\u00e4chen- und \nLiegenschafts-management \n Erhalt und Verbesserung der \nUmweltqualit\u00e4t \n Leistungsf\u00e4hige technische \nInfrastruktur \n Quartiersnahe Kultur-, Sport- \nund Freiraum-angebote \n \n \n Vernetzung von Bildung, \nForschung und Wirtschaft \nLeipzig schafft soziale Stabilit\u00e4t  Wirkung auf Akteure \nLeipzig st\u00e4rkt seine \nInternationalit\u00e4t \n Chancengerechtigkeit in der \ninklusiven Stadt \n B\u00fcrgerstadt  Weltoffene Stadt \n Gemeinschaftliche \nQuartiersentwicklung \n Region  Vielf\u00e4ltige, lebendige Kultur- \nund Sportlandschaft \n Bezahlbares Wohnen  Stadtrat  Interdisziplin\u00e4re \nWissenschaft und exzellente \nForschung \n Zukunftsorientierte Kita- und \nSchulangebote \n Kommunalwirtschaft  Attraktiver Tagungs- und \nTourismusstandort \n Lebenslanges Lernen  Verwaltung  Imagepr\u00e4gende \nGro\u00dfveranstaltungen \n Sichere Stadt    Globales Denken, lokal \nverantwortliches Handeln \n      \n Sonstige Ziele \nBei Bedarf \u00fcberschreiben (max. 50 ZML) \nx Trifft nicht zu     \n \n \n \n \n \n \n \n \n \n3 von 7 in Zusammenstellung\n4/7 \n \nKlimawirkung \nKlimawirkung durch den Beschluss der Vorlage \nStufe 1: Grobe Einordnung zur Klimawirkung (Klimaschutzes und zur \u2013wandelanpassung) \nEingesetzte Energietr\u00e4ger (Strom, \nW\u00e4rme, Brennstoff) x keine / Aussage nicht m\u00f6glich  erneuerbar  fossil \nReduziert bestehenden Energie-\n/Ressourcenverbrauch x Aussage nicht m\u00f6glich  ja  nein \nSpeichert CO2-Emissionen (u.a. \nBaumpflanzungen) x Aussage nicht m\u00f6glich  ja  nein \nMindert die Auswirkungen des \nKlimawandels (u. a. Entsiegelung, \nRegenwassermanagement) \nx Aussage nicht m\u00f6glich  ja  nein \nAbsch\u00e4tzbare Klimawirkung mit \nerheblicher Relevanz  ja, da Beschlussgremium RV, GVA, oder VA und mind. 5 \nJahre Betriebs- und Nutzungsdauer x nein \nVorlage hat keine absch\u00e4tzbare \nKlimawirkung X ja (Pr\u00fcfschema endet hier.)   \n \nStufe 2: Die Vorlage ber\u00fccksichtigt die zentralen energie- und klimapolitischen Beschl\u00fcsse (s. \nleipzig.de) \n  ja  nein (Begr\u00fcndung s. Abw\u00e4gungsprozess)  nicht ber\u00fchrt (Pr\u00fcfschema endet \nhier.) \n       \nStufe 3: Detaillierte Darstellung zur absch\u00e4tzbaren Klimawirkung nur bei erheblicher Relevanz \n  Berechnete THG-Emissionen (in t bzw. t./a): ____________________ \n  liegt vor: s. Anlage/Kapitel der Vorlage: ________________________ \n  wird vorgelegt mit: ________________ (z. B. Planungsbeschluss, Baubeschluss, Billigungs- und \nAuslegungsbeschluss) \n   \n \n \n \nSachverhalt \nBeschreibung des Abw\u00e4gungsprozesses:   \nentf\u00e4llt \n  \nI.  Eilbed\u00fcrftigkeitsbegr\u00fcndung  \nDie Bekanntgabe der erforderlichen Zahl an Personen f\u00fcr die Vorschlagsliste, die Grundlage \ndieser Vorlage ist, erfolgte Anfang April 2023 durch das zust\u00e4ndige Gericht. Sp\u00e4testens zum \n30. Juni 2023 ist durch den Stadtrat eine Vorschlagsliste f\u00fcr die zu w\u00e4hlenden Sch\u00f6ffen \naufzustellen. In der Stadtratssitzung am 14. Juni 2023 muss daher \u00fcber die Aufnahme der \nBewerber in die Sch\u00f6ffen-Vorschlagsliste entschieden werden. Daneben sind f\u00fcr den \nWahlausschuss durch den Stadtrat sieben Vertrauenspersonen zu w\u00e4hlen. Die \nWahlmodalit\u00e4ten sollen daher m\u00f6glichst zuvor in der Ratsversammlung am 17. Mai 2023, \nggf. im Fortsetzungstermin am 31. Mai 2023, beschlossen werden. \n  \nII.  Begr\u00fcndung Nicht\u00f6ffentlichkeit   \nentf\u00e4llt  \n \n  \n \n \n \n4 von 7 in Zusammenstellung\n5/7 \n \nIII.   Strategische Ziele  \n \nIV.  Sachverhalt  \n \n1.  Anlass  \n \n \n2.  Beschreibung der Ma\u00dfnahme  \n \nVorbemerkungen  \nIm Jahr 2023 sind die Sch\u00f6ffen, Jugendsch\u00f6ffen beim Amts- und Landgericht sowie die \nehrenamtlichen Richter beim Verwaltungsgericht f\u00fcr die Gesch\u00e4ftsjahre 2024 bis 2028 zu \nw\u00e4hlen. Die rechtliche Grundlage daf\u00fcr bilden Gerichtsverfassungsgesetz (GVG; Sch\u00f6ffen & \nJugendsch\u00f6ffen) und Verwaltungsgerichtsordnung (VwGO; ehrenamtliche Richter) sowie die \nGemeinsame Verwaltungsvorschrift des S\u00e4chsischen Staatsministeriums der Justiz und des \nS\u00e4chsischen Staatsministeriums des Innern zur Vorbereitung und Durchf\u00fchrung der Wahl \nund Berufung der Sch\u00f6ffen und Jugendsch\u00f6ffen (VwV f\u00fcr die Sch\u00f6ffen- und \nJugendsch\u00f6ffen).  \n \nDiese Vorlage regelt N\u00e4heres und informiert zur Wahl der Sch\u00f6ffen und ehrenamtlichen \nRichter. Auf die Besetzung der Jugendsch\u00f6ffen wird hier nur rein informativ eingegangen. \nDie Zust\u00e4ndigkeit f\u00fcr die Ermittlung der Vorschlagslisten liegt beim Jugendhilfeausschuss, \nder entsprechende Prozess ist nicht Gegenstand dieser Vorlage. Der Jugendhilfeausschuss \nwird separat \u00fcber Fristen und Ablauf der Jugendsch\u00f6ffenwahl informiert. \n \nIn der Verwaltungsvorschrift bzw. der Verwaltungsgerichtsordnung ist festgelegt, dass die \nSch\u00f6ffen und Jugendsch\u00f6ffen (f\u00fcr Strafsachen bzw. Jugendstrafsachen beim Amts- bzw. \nLandgericht) sowie die ehrenamtlichen Richter beim Verwaltungsgericht durch einen \nWahlausschuss am jeweiligen Gericht aus den Vorschlagslisten der Gemeinden im \njeweiligen Gerichtsbezirk zu w\u00e4hlen sind. Sp\u00e4testens zum 30. Juni 2023 ist durch die \nGemeinden je eine Vorschlagsliste f\u00fcr die zu w\u00e4hlenden Sch\u00f6ffen bzw. Jugendsch\u00f6ffen \naufzustellen (abweichend hiervon f\u00fcr die ehrenamtlichen Richter in der Ratsversammlung \nam 20. September 2023). Zur Aufnahme in die Vorschlagsliste ist bei den Sch\u00f6ffen die \nZustimmung von zwei Dritteln der anwesenden Mitglieder des Stadtrates, mindestens jedoch \nder H\u00e4lfte der gesetzlichen Zahl der Mitglieder des Stadtrates, im Falle der Jugendsch\u00f6ffen \nvon zwei Dritteln der stimmberechtigten Mitglieder des Jugendhilfeausschusses erforderlich \n(\u00a7 36 GVG).  \n \nUnmittelbar nach der Aufstellung sind die Vorschlagslisten eine Woche lang zu jedermanns \nEinsicht auszulegen. Beginn und Ende der Auslegungsfrist sind \u00f6ffentlich bekannt zu ma-\nchen. Gegen die Vorschlagslisten kann binnen einer Woche nach Ablauf der Auslegungsfrist \nEinspruch erhoben werden (\u00a7 37 GVG). F\u00fcr den Wahlausschuss beim Amtsgericht sind \ndurch den Stadtrat sieben Vertrauenspersonen zu w\u00e4hlen (\u00a7 40 GVG). Der \nOberb\u00fcrgermeister wird durch den Beigeordneten f\u00fcr Allgemeine Verwaltung im \nWahlausschuss vertreten.  \n \nF\u00fcr die Aufnahme in die Vorschlagsliste f\u00fcr ehrenamtliche Richter beim Verwaltungsgericht \nist ebenfalls eine Zwei-Drittel-Mehrheit der anwesenden Mitglieder des Stadtrates, \nmindestens jedoch der H\u00e4lfte der gesetzlichen Zahl der Mitglieder des Stadtrates, \nerforderlich. Eine Auslegung der Vorschlagsliste zur Einsichtnahme erfolgt nicht. Die \n\u00dcbermittlung der Vorschlagsliste an das Verwaltungsgericht erfolgt voraussichtlich erst im \nvierten Quartal.  \n5 von 7 in Zusammenstellung\n6/7 \n \n \nZust\u00e4ndig f\u00fcr die Realisierung der Aufgaben der Stadt Leipzig zur Vorbereitung und \nDurchf\u00fchrung der Wahl der Sch\u00f6ffen und ehrenamtlichen Richter am Verwaltungsgericht ist \ndas Amt f\u00fcr Statistik und Wahlen und das B\u00fcro f\u00fcr Ratsangelegenheiten. Die nachfolgend \nvorgeschlagene Verfahrensweise zur Wahl der Sch\u00f6ffen und ehrenamtlichen Richter \nentspricht im Grundsatz der bereits 2018 praktizierten Verfahrensweise. \n \n \nVorgeschlagene Verfahrensweise \n \n(1) In der Stadtratssitzung am 14. Juni 2023 wird unter Regie des B\u00fcros f\u00fcr \nRatsangelegenheiten \u00fcber die Aufnahme der Bewerber in die Sch\u00f6ffen-\nVorschlagsliste entschieden. Dazu ist die Zustimmung von zwei Dritteln der \nanwesenden Mitglieder des Stadtrates, mindestens jedoch der H\u00e4lfte der \ngesetzlichen Mitgliederzahl erforderlich. Durch das Amt f\u00fcr Statistik und Wahlen wird \neine entsprechende Liste vorbereitet, in der alle bis zum 31. M\u00e4rz 2023 \neingegangenen Bewerbungen ber\u00fccksichtigt werden.  \n \nIn geheimer Wahl sind durch die Stadtr\u00e4te die Namen der Bewerber zu streichen, \ndie nicht in die Vorschlagsliste aufgenommen werden sollen (inverses \nWahlverfahren). Ein regul\u00e4res Wahlverfahren w\u00fcrde die Zustimmung jedes \nStadtrates bzw. jeder Stadtr\u00e4tin zu jeder einzelnen Sch\u00f6ffenbewerbung erfordern, \nwas einer Zustimmung zu ca. 950 Wahlvorschl\u00e4gen aus 1.300 Bewerbungen bedarf \nund damit f\u00fcr die Ratsarbeit weder organisatorisch noch zeitlich praktikabel w\u00e4re.  \n \n(2) Da die von den jeweiligen Gerichten vorgegebene Zahl an Vorschl\u00e4gen nicht \n\u00fcberschritten werden soll, werden die \u00fcberz\u00e4hligen Bewerber mit den niedrigsten \nStimmenzahlen gestrichen, falls erforderlich entscheidet bei gleicher Stimmenzahl \ndas durch den Leiter des Amtes f\u00fcr Statistik und Wahlen bzw. eine durch ihn \nbeauftragte Person zu ziehende Los. \n \n(3) F\u00fcr den Fall, dass weniger Bewerber als die vom jeweiligen Gericht mitgeteilte \nMindestzahl die notwendige Stimmenzahl erreichen, finden weitere Wahlg\u00e4nge bis \nzum Erreichen der Mindestzahl statt. Dabei stehen jeweils nur die Bewerber zur \nWahl, die bisher nicht gew\u00e4hlt wurden. \n \n(4) F\u00fcr den Wahlausschuss sind durch den Stadtrat sieben Vertrauenspersonen zu \nw\u00e4hlen. Die Vorschl\u00e4ge f\u00fcr diese Wahl erfolgen durch die Fraktionen bis zum 1. Juni \n2023 an das B\u00fcro f\u00fcr Ratsangelegenheiten nach dem folgenden Prozedere: \n \nGrundlage ist, dass f\u00fcr jede Fraktion das Vorschlagsrecht f\u00fcr einen Sitz vergeben \nwird. Verbleibenden Sitze werden in der Rangfolge gem\u00e4\u00df der Fraktionsgr\u00f6\u00dfe \nvergeben. Bei Gleichheit der Fraktionsgr\u00f6\u00dfe entscheidet das Los unter Anwesenheit \ndes Leiters des B\u00fcros f\u00fcr Ratsangelegenheiten, des Leiters des Amtes f\u00fcr Statistik \nund Wahlen und je eines Fraktionsvertreters bzw. einer Vertreterin der betroffenen \nFraktionen.  \n \nDie Wahl der Vertrauenspersonen erfolgt ebenfalls in der Stadtratssitzung am 14. \nJuni 2023. Zur Wahl ist die Zustimmung von zwei Dritteln der anwesenden Mitglieder \ndes Stadtrates, mindestens jedoch der H\u00e4lfte der gesetzlichen Mitgliederzahl \nerforderlich.  \n \n6 von 7 in Zusammenstellung\n7/7 \n \n(5) Die Aufstellung der Vorschlagsliste f\u00fcr ehrenamtliche Richter beim \nVerwaltungsgericht erfolgt in der Stadtratssitzung am 20. September 2023 gem\u00e4\u00df der \noben genannten Verfahrensweise. Aufgenommen werden alle Bewerber, die sich bis \nzum 22. Mai 2023 gemeldet haben. \n \nBegr\u00fcndung \n \nIn der Gemeinsamen Verwaltungsvorschrift des S\u00e4chsischen Staatsministeriums der Justiz \nund des S\u00e4chsischen Staatsministeriums des Innern zur Vorbereitung und Durchf\u00fchrung der \nWahl und Berufung der Sch\u00f6ffen und Jugendsch\u00f6ffen (Sch\u00f6ffen- und Jugendsch\u00f6ffen VwV) \nbzw. der Verwaltungsgerichtsordnung ist festgelegt, dass die Gemeinden f\u00fcr die Aufstellung \nder Vorschlagslisten f\u00fcr die Sch\u00f6ffen, Jugendsch\u00f6ffen und ehrenamtlichen Richter beim \nVerwaltungsgericht zust\u00e4ndig sind.  \n \nDer vorstehende Ablauf dieser Aufstellung entspricht diesen Festlegungen. Grunds\u00e4tzlich \nentspricht die gesamte Verfahrensweise dem Ablauf wie vor f\u00fcnf Jahren. Gem\u00e4\u00df Mitteilung \ndes Landgerichtspr\u00e4sidenten sind in die Vorschlagsliste f\u00fcr Sch\u00f6ffen insgesamt 948 \nPersonen aufzunehmen, in die Vorschlagsliste f\u00fcr Jugendsch\u00f6ffen insgesamt 396 Personen. \nDie per vorl\u00e4ufiger Information bekanntgegebene Zahl der vorzuschlagenden Personen f\u00fcr \ndie Liste der ehrenamtlichen Richter am Verwaltungsgericht betr\u00e4gt 94 Personen. \n \n3.  Realisierungs- / Zeithorizont \n- \n  \n4.  Finanzielle Auswirkungen \n- \n  \n5.  Auswirkungen auf den Stellenplan \nKeine. \n  \n6.  B\u00fcrgerbeteiligung \n  \n   bereits erfolgt    geplant x  nicht n\u00f6tig \n  \n  \n7.  Besonderheiten  \n- \n  \n8.  Folgen bei Nichtbeschluss \nBei Nichtbeschluss w\u00e4ren wichtige Modalit\u00e4ten f\u00fcr das Wahlverfahren zur Erstellung der \nVorschlagsliste f\u00fcr die Wahl der Sch\u00f6ffen, ehrenamtlichen Richter sowie \nVertrauenspersonen f\u00fcr den Wahlausschuss beim Amtsgericht nicht festgelegt. \n \n \n \n \nAnlage/n \nKeine \n \n7 von 7 in Zusammenstellung\n\tVorlage",
    "name": "Wahl der Sch\u00f6ffen und ehrenamtlichen Richter f\u00fcr die Jahre 2024 bis 2028",
    "resolution": null,
    "originator": "Dezernat Allgemeine Verwaltung",
    "paper_type": "Beschlussvorlage",
    "published_at": "2023-05-08",
    "reference": "VII-DS-08561",
    "url": "https://ratsinformation.leipzig.de/allris_leipzig_public/vo020?VOLFDNR=2010595"
}, {
    "body": "Leipzig",
    "content": "1/5 \n \n \nRatsversammlung \n \n  \nBeschlussvorlage-Nr. VII-P-07960-DS-02 \n \nStatus: \u00f6ffentlich \n \nEingereicht von: \nPetitionsausschuss / Petent: Mike Demmig \n \n \n \nBetreff: \nErhaltung der Gr\u00fcnfl\u00e4che und Umwandlung in Park \n \n \nBeratungsfolge (\u00c4nderungen vorbehalten): \nGremium \nVoraussichtlicher \nSitzungstermin \nZust\u00e4ndigkeit \n   \nDB OBM - Vorabstimmung  Vorberatung \nDienstberatung des Oberb\u00fcrgermeisters  Information zur \nKenntnis \nRatsversammlung  Beschlussfassung \n \n \nBeschlussvorschlag \nDer Petitionsausschuss legt zur Petition folgenden Alternativvorschlag vor: \n \n1. Der Oberb\u00fcrgermeister wird beauftragt, L\u00f6sungsans\u00e4tze zu untersuchen, die sowohl \ndauerhafte Gr\u00fcnfl\u00e4chen als auch eine Bebauung in einem ausbalancierten Verh\u00e4ltnis \nuntereinander auf diesen Fl\u00e4chen (nach dem Grundsatz der doppelten \nInnenentwicklung) vorsehen. \n \n2. Die \u00d6ffentlichkeit und der Stadtbezirksbeirat Alt-West sind in geeigneter Weise \neinzubeziehen. \n \nR\u00e4umlicher Bezug \nStadtbezirk Alt-West, Ortsteil Lindenau \n \nZusammenfassung \n \nAnlass der Vorlage:    \n \n  Rechtliche Vorschriften   Stadtratsbeschluss   Verwaltungshandeln \n \nx  Sonstiges: Petition VII-P-07960 \n \n \n \n \n \n \n \n \n \n \n \n1 von 7 in Zusammenstellung\n2/5 \n \nFinanzielle Auswirkungen \nFinanzielle Auswirkungen x nein  wenn ja, \nKosteng\u00fcnstigere Alternativen gepr\u00fcft  nein  ja, Ergebnis siehe Anlage zur Begr\u00fcndung \nFolgen bei Ablehnung  nein  ja, Erl\u00e4uterung siehe Anlage zur Begr\u00fcndung \nHandelt es sich um eine Investition (damit aktivierungspflichtig)?  nein  ja, Erl\u00e4uterung siehe Anlage zur Begr\u00fcndung \n  \nIm Haushalt wirksam von bis H\u00f6he in EUR wo veranschlagt \nErgebnishaushalt Ertr\u00e4ge     \n Aufwendungen     \nFinanzhaushalt Einzahlungen     \n Auszahlungen     \nEntstehen Folgekosten oder Einsparungen?  nein  wenn ja, nachfolgend angegeben \n \nFolgekosten Einsparungen wirksam von bis H\u00f6he in EUR/Jahr wo veranschlagt \nZu Lasten anderer OE Ergeb. HH Ertr\u00e4ge     \n Ergeb. HH Aufwand     \nNach Durchf\u00fchrung der \nMa\u00dfnahme zu erwarten Ergeb. HH Ertr\u00e4ge     \n Ergeb. HH Aufwand (ohne \nAbschreibungen)     \n Ergeb. HH Aufwand aus \nj\u00e4hrl. Abschreibungen      \n    \nSteuerrechtliche Pr\u00fcfung  x nein  wenn ja \nUnternehmerische T\u00e4tigkeit i.S.d. \u00a7\u00a7 2 Abs. 1 und 2B \nUStG   nein  ja, Erl\u00e4uterung siehe Punkt 4 des Sachverhalts \nUmsatzsteuerpflicht der Leistung   nein  ja, Erl\u00e4uterung siehe Anlage zur Begr\u00fcndung \nBei Vertr\u00e4gen: Umsatzsteuerklausel aufgenommen   ja  nein, Erl\u00e4uterung siehe Anlage zur Begr\u00fcndung \n \nAuswirkungen auf den Stellenplan x nein  wenn ja, nachfolgend angegeben \nBeantragte Stellenerweiterung:  Vorgesehener Stellenabbau:  \n \n \n \n \n \n \n \n \n \n \n \n \n \n \n \n \n \n \n \n \n \n \n \n \n \n \n2 von 7 in Zusammenstellung\n3/5 \n \nZiele \nHintergrund zum Beschlussvorschlag: \nWelche strategischen Ziele werden mit der Ma\u00dfnahme unterst\u00fctzt? \n  \n \n2030 \u2013 Leipzig w\u00e4chst nachhaltig! \nZiele und Handlungsschwerpunkte \nLeipzig setzt auf  \nLebensqualit\u00e4t \nLeipzig besteht im  \nWettbewerb \nx Balance zwischen \nVerdichtung und Freiraum \n Positive \nRahmenbedingungen f\u00fcr \nqualifizierte Arbeitspl\u00e4tze \nx Qualit\u00e4t im \u00f6ffentlichen Raum \nund in der Baukultur \n Attraktives Umfeld f\u00fcr \nInnovation, Gr\u00fcnder und \nFachkr\u00e4fte \n Nachhaltige Mobilit\u00e4t \n \n Vielf\u00e4ltige und stabile \nWirtschaftsstruktur \n Vorsorgende Klima- und \nEnergiestrategie \n Vorsorgendes Fl\u00e4chen- und \nLiegenschafts-management \n Erhalt und Verbesserung der \nUmweltqualit\u00e4t \n Leistungsf\u00e4hige technische \nInfrastruktur \n Quartiersnahe Kultur-, Sport- \nund Freiraum-angebote \n \n \n Vernetzung von Bildung, \nForschung und Wirtschaft \nLeipzig schafft soziale Stabilit\u00e4t  Wirkung auf Akteure \nLeipzig st\u00e4rkt seine \nInternationalit\u00e4t \n Chancengerechtigkeit in der \ninklusiven Stadt \n B\u00fcrgerstadt  Weltoffene Stadt \n Gemeinschaftliche \nQuartiersentwicklung \n Region  Vielf\u00e4ltige, lebendige Kultur- \nund Sportlandschaft \nx Bezahlbares Wohnen  Stadtrat  Interdisziplin\u00e4re \nWissenschaft und exzellente \nForschung \n Zukunftsorientierte Kita- und \nSchulangebote \n Kommunalwirtschaft  Attraktiver Tagungs- und \nTourismusstandort \n Lebenslanges Lernen  Verwaltung  Imagepr\u00e4gende \nGro\u00dfveranstaltungen \n Sichere Stadt    Globales Denken, lokal \nverantwortliches Handeln \n      \n Sonstige Ziele \nBei Bedarf \u00fcberschreiben (max. 50 ZML) \n Trifft nicht zu     \n \n \n \n \n \n \n \n \n \n \n \n \n3 von 7 in Zusammenstellung\n4/5 \n \nKlimawirkung \nKlimawirkung durch den Beschluss der Vorlage \nStufe 1: Grobe Einordnung zur Klimawirkung (Klimaschutzes und zur \u2013wandelanpassung) \nEingesetzte Energietr\u00e4ger (Strom, \nW\u00e4rme, Brennstoff)  keine / Aussage nicht m\u00f6glich  erneuerbar  fossil \nReduziert bestehenden Energie-\n/Ressourcenverbrauch  Aussage nicht m\u00f6glich  ja  nein \nSpeichert CO2-Emissionen (u.a. \nBaumpflanzungen)  Aussage nicht m\u00f6glich  ja  nein \nMindert die Auswirkungen des \nKlimawandels (u. a. Entsiegelung, \nRegenwassermanagement) \n Aussage nicht m\u00f6glich  ja  nein \nAbsch\u00e4tzbare Klimawirkung mit \nerheblicher Relevanz  ja, da Beschlussgremium RV, GVA, oder VA und mind. 5 \nJahre Betriebs- und Nutzungsdauer  nein \nVorlage hat keine absch\u00e4tzbare \nKlimawirkung x ja (Pr\u00fcfschema endet hier.)   \n \nStufe 2: Die Vorlage ber\u00fccksichtigt die zentralen energie- und klimapolitischen Beschl\u00fcsse (s. \nleipzig.de) \n  ja  nein (Begr\u00fcndung s. Abw\u00e4gungsprozess) x nicht ber\u00fchrt (Pr\u00fcfschema endet \nhier.) \n       \nStufe 3: Detaillierte Darstellung zur absch\u00e4tzbaren Klimawirkung nur bei erheblicher Relevanz \n  Berechnete THG-Emissionen (in t bzw. t./a): ____________________ \n  liegt vor: s. Anlage/Kapitel der Vorlage: ________________________ \n  wird vorgelegt mit: ________________ (z. B. Planungsbeschluss, Baubeschluss, Billigungs- und \nAuslegungsbeschluss) \n   \n \n \nSachverhalt \nBegr\u00fcndung: \n \nIn der Petition werden die aktuell dr\u00e4ngendsten Herausforderungen der Stadtentwicklung \nangesprochen. Einerseits die Sicherung notwendiger klimawirksamer Frei- und Gr\u00fcnr\u00e4ume \nals Orte der Vielfalt und Erholung im Stadtgebiet (Balance zwischen Verdichtung und \nFreiraum sowie Qualit\u00e4t im \u00f6ffentlichen Raum und in der Baukultur), andererseits die \nbehutsame Nachverdichtung in den historischen Ortsmitten mit beispielsweisen vielf\u00e4ltigen \nWohnraumangebote (Bezahlbares Wohnen) oder Strukturen des Gemeinwesens.  \n \nDie Baufl\u00e4chen entlang der Kuhturmstra\u00dfe wurden im Gestaltungsrahmen von Sanierungs- \nbzw. Stadtumbauma\u00dfnahmen tempor\u00e4r begr\u00fcnt, hergerichtet und befinden sich zu gro\u00dfen \nTeilen im Besitz der Stadt Leipzig.  \nF\u00fcr die benannten Fl\u00e4chen besteht bereits heute grunds\u00e4tzlich Baurecht aufgrund der Lage \nim Geltungsbereich des rechtskr\u00e4ftigen Bebauungsplanes Nr. 30.1 \"Henricistra\u00dfe (1. \n\u00c4nderung)\".  \n   \nDie zust\u00e4ndigen Fach\u00e4mter besch\u00e4ftigen sich derzeit konkret mit den k\u00fcnftigen \nEntwicklungen dieser, im Eigentum der Stadt Leipzig befindlichen Fl\u00e4chen. Momentan \nwerden durch externe Planungsb\u00fcros beispielhafte Strategien f\u00fcr eine vorbildliche \nHerangehensweise im Sinne der doppelten Innenentwicklung am Standort untersucht. Ziel \ndieser Untersuchung ist es, die richtige Balance zwischen Verdichtung und Freiraum auf den \nBaufl\u00e4chen zu er\u00f6rtern.  \n   \n4 von 7 in Zusammenstellung\n5/5 \n \nDie Ergebnisse der st\u00e4dtebaulich-freiraumplanerischen Fl\u00e4chenstudie werden zeitnah \nvorliegen und sollen im Weiteren als Arbeitsgrundlage dienen, die Fl\u00e4chen als Pilotprojekt \nder doppelten Innenentwicklung unter Abw\u00e4gung der Realisierungsm\u00f6glichkeiten am \nStandort fortzuf\u00fchren.  \n   \nOb in diesem Zusammenhang und aufgrund der Eigentumsverh\u00e4ltnisse eine \u00c4nderung des \nbestehenden Bebauungsplanes erforderlich ist, wird im Ergebnis des gesamten \nAbw\u00e4gungsprozesses zur Entwicklung der st\u00e4dtischen Fl\u00e4chen entschieden.  \n \nAnlage/n \n1 Petition VII-P-07960 (\u00f6ffentlich) \n \n \n5 von 7 in Zusammenstellung\n \nSeite 1 von 1 \nPetition VII-P-07960 \n \nEinreicher: Mike Demmig \n \nBetreff: Erhaltung der Gr\u00fcnfl\u00e4che und Umwandlung in Park \n \n \nSehr geehrter Petitionsausschuss,  \n \nwir bitten in Form einer Petition darum, die Gr\u00fcnfl\u00e4che zwischen Kuhturm- und Angerstra\u00dfe- \nmit einem Durchgang zur Dreilindenstra\u00dfe in Alt-Lindenau als \u00f6ffentliche Gr\u00fcnfl\u00e4che m\u00f6glichst \nim Gesamten (auf beiden Seiten der Kuhturmstra\u00dfe) oder teilweise (auf einer Seite der \nKuhturmstra\u00dfe) zu erhalten und als Park zu benennen (umzuwidmen).  \n \nSachverhalt: \n \nBei der sich entlang der Kuhturmstra\u00dfe befindlichen Gr\u00fcnfl\u00e4chen handelt es sich beidseitig \num zwischenbegr\u00fcnte Grundst\u00fccke. Sie liegen auch im B-Planbereich Nr. 30.1 \n\u201eHenricistra\u00dfe\u201c, 1. \u00c4nderung (rechtskr\u00e4ftig seit 16.08.2003) und sind dort als Baufl\u00e4chen \n(Besonderes Wohngebiet) festgesetzt. Eine Benennung als Park w\u00fcrde diesem Sachverhalt \nnicht entsprechen. \n \nDer Verzicht auf die Baufl\u00e4chen und die Erhaltung des Gr\u00fcns (sofern der Eigent\u00fcmer die Stadt \nLeipzig ist) w\u00fcrde die weitere Entwicklung Alt-Lindenaus zu einem klimagerechten \nStadtquartier bef\u00f6rdern.  \n \nVielen Dank im Voraus f\u00fcr die Pr\u00fcfung dieses Sachverhalts. \n6 von 7 in Zusammenstellung\nBilder \u00a9 2022 GeoBasis-DE/BKG,GeoContent,Maxar Technologies,Kartendaten \u00a9 2022 GeoBasis-DE/BKG (\u00a92009) 20 m\nKuhturmstra\u00dfe\nKuhturmstra\u00dfe - Google Maps https://www.google.de/maps/place/Kuhturmstra%C3%9Fe,+04177+Leipzig/@51.3369852,12...\n1 von 2 08.11.2022, 15:10\n7 von 7 in Zusammenstellung\n\tVorlage\n\tAnlage  1 Petition VII-P-07960",
    "name": "Erhaltung der Gr\u00fcnfl\u00e4che und Umwandlung in Park",
    "resolution": null,
    "originator": "Petitionsausschuss / Petent: Mike Demmig",
    "paper_type": "Beschlussvorlage",
    "published_at": "2023-05-09",
    "reference": "VII-P-07960-DS-02",
    "url": "https://ratsinformation.leipzig.de/allris_leipzig_public/vo020?VOLFDNR=2010581"
}, {
    "body": "Leipzig",
    "content": "1/3 \n \n \nRatsversammlung \n \n  \nBeschlussvorlage-Nr. VII-P-08537-DS-01 \n \nStatus: \u00f6ffentlich \n \nEingereicht von: \nPetitionsausschuss / Petent: Dieter Krause \n \n \n \nBetreff: \nPetition nach \u00a7 12 S\u00e4chsGemO zur Benennung eines der neugebauten \nGymnasien in Leipzig nach dem Vorm\u00e4rz-Publizisten Robert Blum \n \n \nBeratungsfolge (\u00c4nderungen vorbehalten): \nGremium \nVoraussichtlicher \nSitzungstermin \nZust\u00e4ndigkeit \n   \nDB OBM - Vorabstimmung  Best\u00e4tigung \nDienstberatung des Oberb\u00fcrgermeisters  Best\u00e4tigung \nRatsversammlung  Beschlussfassung \n \n \nBeschlussvorschlag \nDie Petition wird abgelehnt. \n \nR\u00e4umlicher Bezug \nStadt Leipzig \n \nZusammenfassung \n \nAnlass der Vorlage:    \n \n  Rechtliche Vorschriften   Stadtratsbeschluss   Verwaltungshandeln \n \nx  Sonstiges: Petition VII-P-08537 \n \n \nFinanzielle Auswirkungen \nFinanzielle Auswirkungen x nein  wenn ja, \nKosteng\u00fcnstigere Alternativen gepr\u00fcft  nein  ja, Ergebnis siehe Anlage zur Begr\u00fcndung \nFolgen bei Ablehnung  nein  ja, Erl\u00e4uterung siehe Anlage zur Begr\u00fcndung \nHandelt es sich um eine Investition (damit aktivierungspflichtig)?  nein  ja, Erl\u00e4uterung siehe Anlage zur Begr\u00fcndung \n  \nIm Haushalt wirksam von bis H\u00f6he in EUR wo veranschlagt \nErgebnishaushalt Ertr\u00e4ge     \n Aufwendungen     \nFinanzhaushalt Einzahlungen     \n Auszahlungen     \nEntstehen Folgekosten oder Einsparungen?  nein  wenn ja, nachfolgend angegeben \n \nFolgekosten Einsparungen wirksam von bis H\u00f6he in EUR/Jahr wo veranschlagt \nZu Lasten anderer OE Ergeb. HH Ertr\u00e4ge     \n1 von 4 in Zusammenstellung\n2/3 \n \n Ergeb. HH Aufwand     \nNach Durchf\u00fchrung der \nMa\u00dfnahme zu erwarten Ergeb. HH Ertr\u00e4ge     \n Ergeb. HH Aufwand (ohne \nAbschreibungen)     \n Ergeb. HH Aufwand aus \nj\u00e4hrl. Abschreibungen      \n    \nSteuerrechtliche Pr\u00fcfung  x nein  wenn ja \nUnternehmerische T\u00e4tigkeit i.S.d. \u00a7\u00a7 2 Abs. 1 und 2B \nUStG   nein  ja, Erl\u00e4uterung siehe Punkt 4 des Sachverhalts \nUmsatzsteuerpflicht der Leistung   nein  ja, Erl\u00e4uterung siehe Anlage zur Begr\u00fcndung \nBei Vertr\u00e4gen: Umsatzsteuerklausel aufgenommen   ja  nein, Erl\u00e4uterung siehe Anlage zur Begr\u00fcndung \n \nAuswirkungen auf den Stellenplan x nein  wenn ja, nachfolgend angegeben \nBeantragte Stellenerweiterung:  Vorgesehener Stellenabbau:  \n \n \nZiele \nHintergrund zum Beschlussvorschlag: \nWelche strategischen Ziele werden mit der Ma\u00dfnahme unterst\u00fctzt? \n  \n \n2030 \u2013 Leipzig w\u00e4chst nachhaltig! \nZiele und Handlungsschwerpunkte \nLeipzig setzt auf  \nLebensqualit\u00e4t \nLeipzig besteht im  \nWettbewerb \n Balance zwischen \nVerdichtung und Freiraum \n Positive \nRahmenbedingungen f\u00fcr \nqualifizierte Arbeitspl\u00e4tze \n Qualit\u00e4t im \u00f6ffentlichen Raum \nund in der Baukultur \n Attraktives Umfeld f\u00fcr \nInnovation, Gr\u00fcnder und \nFachkr\u00e4fte \n Nachhaltige Mobilit\u00e4t \n \n Vielf\u00e4ltige und stabile \nWirtschaftsstruktur \n Vorsorgende Klima- und \nEnergiestrategie \n Vorsorgendes Fl\u00e4chen- und \nLiegenschafts-management \n Erhalt und Verbesserung der \nUmweltqualit\u00e4t \n Leistungsf\u00e4hige technische \nInfrastruktur \n Quartiersnahe Kultur-, Sport- \nund Freiraum-angebote \n \n \n Vernetzung von Bildung, \nForschung und Wirtschaft \nLeipzig schafft soziale Stabilit\u00e4t  Wirkung auf Akteure \nLeipzig st\u00e4rkt seine \nInternationalit\u00e4t \n Chancengerechtigkeit in der \ninklusiven Stadt \n B\u00fcrgerstadt  Weltoffene Stadt \n Gemeinschaftliche \nQuartiersentwicklung \n Region  Vielf\u00e4ltige, lebendige Kultur- \nund Sportlandschaft \n Bezahlbares Wohnen  Stadtrat  Interdisziplin\u00e4re \nWissenschaft und exzellente \nForschung \n Zukunftsorientierte Kita- und \nSchulangebote \n Kommunalwirtschaft  Attraktiver Tagungs- und \nTourismusstandort \n Lebenslanges Lernen  Verwaltung  Imagepr\u00e4gende \nGro\u00dfveranstaltungen \n Sichere Stadt    Globales Denken, lokal \nverantwortliches Handeln \n2 von 4 in Zusammenstellung\n3/3 \n \n      \n Sonstige Ziele \nBei Bedarf \u00fcberschreiben (max. 50 ZML) \nx Trifft nicht zu     \n \n \nKlimawirkung \nKlimawirkung durch den Beschluss der Vorlage \nStufe 1: Grobe Einordnung zur Klimawirkung (Klimaschutzes und zur \u2013wandelanpassung) \nEingesetzte Energietr\u00e4ger (Strom, \nW\u00e4rme, Brennstoff) x keine / Aussage nicht m\u00f6glich  erneuerbar  fossil \nReduziert bestehenden Energie-\n/Ressourcenverbrauch x Aussage nicht m\u00f6glich  ja  nein \nSpeichert CO2-Emissionen (u.a. \nBaumpflanzungen) x Aussage nicht m\u00f6glich  ja  nein \nMindert die Auswirkungen des \nKlimawandels (u. a. Entsiegelung, \nRegenwassermanagement) \nx Aussage nicht m\u00f6glich  ja  nein \nAbsch\u00e4tzbare Klimawirkung mit \nerheblicher Relevanz  ja, da Beschlussgremium RV, GVA, oder VA und mind. 5 \nJahre Betriebs- und Nutzungsdauer x nein \nVorlage hat keine absch\u00e4tzbare \nKlimawirkung x ja (Pr\u00fcfschema endet hier.)   \n \nStufe 2: Die Vorlage ber\u00fccksichtigt die zentralen energie- und klimapolitischen Beschl\u00fcsse (s. \nleipzig.de) \n  ja  nein (Begr\u00fcndung s. Abw\u00e4gungsprozess) x nicht ber\u00fchrt (Pr\u00fcfschema endet \nhier.) \n       \nStufe 3: Detaillierte Darstellung zur absch\u00e4tzbaren Klimawirkung nur bei erheblicher Relevanz \n  Berechnete THG-Emissionen (in t bzw. t./a): ____________________ \n  liegt vor: s. Anlage/Kapitel der Vorlage: ________________________ \n  wird vorgelegt mit: ________________ (z. B. Planungsbeschluss, Baubeschluss, Billigungs- und \nAuslegungsbeschluss) \n   \n \n \nSachverhalt \nBegr\u00fcndung  \n \nDie Petition wird abgelehnt, da der Name \u201eRobert Blum\u201c bereits an die Robert-Bum-Schule \u2013 \nBerufliches Schulzentrum der Stadt Leipzig \u2013 im Ortsteil Mockau vergeben ist. \n \nAnlage/n \n1 Petition VII-P-08537 (\u00f6ffentlich) \n \n \n3 von 4 in Zusammenstellung\nDieter Krause\nStadt Leipzig / \nPetitionsausschuss \nMartin-Luther-Ring 4-6 \n04109 Leipzig\nBetr.: Petition nach \u00a7 12 S\u00e4chsGemOrdnung zur Benennung eines der neugebauten\nGymnasien in Leipzig nach Robert Blum\nLiebe Stadtr\u00e4te,  Leipzig, 15.03.2023\nmit dieser Petition fordere ich die Benennung eines der neu gebauten Leipziger Gymnasien nach\nRobert Blum! Auf eine Begr\u00fcndung verzichte ich hier \u2013 die kann sich jeder selber geben! Aber es\nkann nicht sein, dass zwar Berlin ein Robert-Blum-Gymnasium besitzt \u2013 aber Leipzig, das mit Ab-\nstand die wichtigste Wirkungsst\u00e4tte von Robert Blum war, keines! Vielen Dank.\nhttps://www.gymnasium-berlin.net/robert-blum-gymnasium\nMit freundlichem Gru\u00df\nDieter Krause\nPS.: Die Namensgebung eines der neuen Leipziger Gymnasien nach Robert Blum sollte am 9. No-\nvember 2023, dem 175. Todestag von Robert Blum, erfolgen! Und ich sehe keine \u00dcberschneidung\nmit dem Berufsschulzentrum Robert Blum in Leipzig. Die Namensgebung eines Berufsschulzent-\nrums nach Robert Blum in Leipzig, der ja von der Ausbildung her Buchh\u00e4ndler und dann Verleger\nwar, halte ich aber f\u00fcr ausgesprochen suboptimal! \nDas Berufsschulzentrum 12 \"Robert Blum\" ist aus der 1952 gegr\u00fcndeten Berufshilfsschule hervor-\ngegangen und befand sich ab 1992 bis 2016 an den Standorten Komarowstra\u00dfe 2 und Wodan-\nstra\u00dfe 40:\n- 2016 erfolgte der Umzug der Stammschule in das sanierte Schulgeb\u00e4ude Rosenowstra\u00dfe 60 und\nder Au\u00dfenstelle in das Schulgeb\u00e4ude Kohlgartenstra\u00dfe 58\n- hier wird Abg\u00e4ngern aus Schulen zur Lernf\u00f6rderung das Berufsvorbereitende Jahr (BVJ) und der\nberufstheoretische Unterricht in Fachwerkerberufen angeboten\n-ab 01.08.2019 wird das Berufliche Schulzentrum 12 in Robert-Blum-Schule umbenannt\nhttps://www.leipzig.de/detailansicht-adresse/berufliches-schulzentrum-12-robert-blum-der-stadt-\nleipzig\n4 von 4 in Zusammenstellung\nhttps://www.gymnasium-berlin.net/robert-blum-gymnasium\n\tVorlage\n\tAnlage  1 Petition VII-P-08537",
    "name": "Petition nach \u00a7 12 S\u00e4chsGemO zur Benennung eines der neugebauten Gymnasien in Leipzig nach dem Vorm\u00e4rz-Publizisten Robert Blum",
    "resolution": null,
    "originator": "Petitionsausschuss / Petent: Dieter Krause",
    "paper_type": "Beschlussvorlage",
    "published_at": "2023-05-08",
    "reference": "VII-P-08537-DS-01",
    "url": "https://ratsinformation.leipzig.de/allris_leipzig_public/vo020?VOLFDNR=2010405"
}]